"করোনায় শনাক্ত সাড়ে ৩ লাখ ছাড়াল, মৃত্যু ৪০","দেশে গত ২৪ ঘণ্টায় করোনা শনাক্ত হয়েছেন ১৭০৫ জন। এ নিয়ে এখন পর্যন্ত ৩ লাখ ৫০ হাজার ৬২১ জন শনাক্ত হলেন। গত ২৪ ঘণ্টায় করোনায় মারা গেছেন ৪০ জন।



ফলে করোনায় মোট মৃত্যু হল ৪৯৭৯ জনের। ২৪ ঘণ্টায় সুস্থ হয়েছেন ২১৫২ জন, এখন পর্যন্ত সুস্থ হয়েছেন ২ লাখ ৫৮ হাজার ৭১৭ জন।সোমবার স্বাস্থ্য অধিদফতরের অতিরিক্ত মহাপরিচালক অধ্যাপক ডা. নাসিমা সুলতানা স্বাক্ষরিত করোনাবিষয়ক সংবাদ বিজ্ঞপ্তিতে সর্বশেষ এসব তথ্য জানানো হয়েছে।বিজ্ঞপ্তিতে বলা হয়, গত ২৪ ঘণ্টায় নমুনা সংগ্রহ হয়েছে ১২ হাজার ৯৬৭টি, নমুনা পরীক্ষা করা হয়েছে ১৩ হাজার ৫৩টি। এখন পর্যন্ত ১৮ লাখ ৩৪ হাজার ৩২৩টি নমুনা পরীক্ষা করা হয়েছে।নমুনা পরীক্ষার মধ্যে গত ২৪ ঘণ্টায় শনাক্ত হয়েছেন এক হাজার ৭০৫ জন। গত ২৪ ঘণ্টায় শনাক্তের হার ১৩ দশমিক ০৬ শতাংশ এবং এখন পর্যন্ত ১৯ দশমিক ১১ শতাংশ।২৪ ঘণ্টায় শনাক্ত বিবেচনায় সুস্থতার হার ৭৩ দশমিক ৭৯ শতাংশ এবং মৃত্যুর হার এক দশমিক ৪১ শতাংশ।২৪ ঘণ্টায় মৃত্যুবরণকারীদের মধ্যে ২৭ জন পুরুষ এবং ১৩ জন নারী। এখন পর্যন্ত পুরুষ ৩৮৭৩ এবং নারী মৃত্যুবরণ করেছেন ১১০৬ জন।২৪ ঘণ্টায় মারা যাওয়াদের বয়স বিশ্লেষণে দেখা যায়, ৬০ ঊর্ধ্ব ২০ জন, ৫১ থেকে ৬০ বছরের মধ্যে ১০ জন, ৪১ থেকে ৫০ বছরের মধ্যে ৪ জন, ৩১ থেকে ৪০ বছরের মধ্যে ৩ জন, ২১ থেকে ৩০ বছরের মধ্যে ২ জন এবং ০ থেকে ১০ বছরের মধ্যে একজন রয়েছেন।বিভাগ বিশ্লেষণে দেখা গেছে, মৃত্যুবরণকারীদের মধ্যে ঢাকা বিভাগে ২৬ জন, চট্টগ্রাম বিভাগে ৯ জন, রংপুর বিভাগে ২ জন এবং রাজশাহী, খুলনা ও বরিশাল বিভাগে একজন করে রয়েছেন।২৪ ঘণ্টায় হাসপাতালে মৃত্যুবরণ করেছেন ৩৭ জন, মৃত অবস্থায় হাসপাতালে আনা হয়েছে একজনকে এবং বাড়িতে মৃত্যুবরণ করেছেন দুই জন।গত ২৪ ঘণ্টায় আইসোলেশনে রাখা হয়েছে ৩ হাজার ৩২৯ জনকে। বর্তমানে আইসোলেশনে আছেন ১৬ হাজার ৪০২ জন। ২৪ ঘণ্টায় আইসোলেশন থেকে ছাড়া পেয়েছেন ৬৬৩ জন।এখন পর্যন্ত ছাড়া পেয়েছেন ৬২ হাজার ৮৯১ জন। এখন পর্যন্ত আইসোলেশন করা হয়েছে ৭৯ হাজার ২৯৩ জনকে।প্রাতিষ্ঠানিক ও হোম মিলে ২৪ ঘণ্টায় কোয়ারেন্টিন করা হয়েছে এক হাজার ২৫৮ জনকে। বর্তমানে কোয়ারেন্টিনে আছেন ৪৬ হাজার ৯০৪ জন।
",22/9/2020,various
কোটিপতি গাড়িচালক আবদুল মালেক ১৪ দিনের রিমান্ডে,"স্বাস্থ্য অধিদফতরের কোটিপতি গাড়িচালক আবদুল মালেক ওরফে হাজী আবদুল মালেকের (৬৩) বিরুদ্ধে পৃথক দুই মামলায় মোট ১৪ দিনের রিমান্ডের আদেশ দিয়েছেন আদালত। সোমবার শুনানি শেষে ঢাকা মহানগর হাকিম শহিদুল ইসলাম রিমান্ডের এ আদেশ দেন।



এদিন বিকালে গাড়িচালক আবদুল মালেককে বরখাস্ত করা হয়েছে। স্বাস্থ্য অধিদফতরের মহাপরিচালক (ডিজি) ডা. আবুল বাশার মোহাম্মদ খুরশীদ আলম জানান, বিভিন্ন অপরাধে জড়িত থাকার কারণে তাকে চাকরি থেকে বরখাস্ত করা হয়। এদিকে স্বাস্থ্যসেবা বিভাগের সচিব আবদুল মান্নান বলেছেন, স্বাস্থ্য খাতে দুর্নীতি করে কেউ পার পাবে না। দুপুরে সচিবালয়ে স্বাস্থ্য মন্ত্রণালয়ের সভাকক্ষে কোভিড-১৯-এর দ্বিতীয় পর্যায়ে দেশের সার্বিক প্রস্তুতি প্রসঙ্গে একটি বিশেষ সভা শেষে প্রেস ব্রিফিংয়ে সাংবাদিকদের এ কথা বলেন তিনি।সোমবার আসামি আবদুল মালেককে আদালতে হাজির করে অস্ত্র ও জাল টাকা উদ্ধারে বিশেষ ক্ষমতা আইনের পৃথক দুই মামলায় সাত দিন করে ১৪ দিনের রিমান্ড আবেদন করা হয়। মামলার তদন্তকারী কর্মকর্তা তুরাগ থানার এসআই রুবেল শেখ আসামির রিমান্ডের এ আবেদন করেন। অপরদিকে আসামিপক্ষে রিমান্ড বাতিল চেয়ে জামিন আবেদন করা হয়। উভয় পক্ষের শুনানি শেষে আদালত আসামির জামিন আবেদন নাকচ করে রিমান্ডের ওই আদেশ দেন।রিমান্ড আবেদনে বলা হয়: আবদুল মালেক ডিজির (স্বাস্থ্য ও শিক্ষা) গাড়িচালক। এ ছাড়া তিনি বাংলাদেশ সরকারি গাড়িচালক সমিতির সভাপতি হিসেবে ২০-২৫ বছর দায়িত্ব পালন করে আসছেন। কর্মস্থলে তিনি খুবই প্রভাবশালী। এ ছাড়া তিনি দীর্ঘদিন জাল টাকার ব্যবসাসহ নিজ কর্মস্থলে সাংগঠনিক পদবিকে কাজে লাগিয়ে বদলি ও নিয়োগ বাণিজ্য করে অবৈধভাবে বিপুল পরিমাণ বিত্ত-বৈভবের মালিক হয়েছেন। এ অবস্থায় মামলার মূল রহস্য উদ্ঘাটন, অবৈধ আগ্নেয়াস্ত্রের উৎস, জাল টাকার উৎস এবং পলাতক আসামিদের পূর্ণাঙ্গ নাম-ঠিকানা সংগ্রহ ও গ্রেফতারের জন্য আসামিকে রিমান্ডে নিয়ে জিজ্ঞাসাবাদ জরুরি।রাষ্ট্রপক্ষে আসামির রিমান্ডের শুনানি করেন ঢাকা মহানগর দায়রা জজ আদালতের প্রধান কৌঁসুলি মো. আবদুল্লাহ আবু। শুনানিতে তিনি বলেন, একজন তৃতীয় শ্রেণির কর্মচারী হওয়া সত্ত্বেও মালেক কোটি কোটি টাকার মালিক। অস্ত্র, জাল টাকা, চাঁদাবাজিসহ কর্মস্থলে বিভিন্ন অনিয়মের মাধ্যমে আসামি অঢেল সম্পদের মালিক হয়েছেন। আসামিকে রিমান্ডে নিয়ে জিজ্ঞাসাবাদ করা হলে মামলার মূল রহস্য উদ্ঘটান হবে। অপরদিকে আসামিপক্ষে রিমান্ড বাতিল চেয়ে জামিন আবেদন করা হয়। আইনজীবী জিএম মিজানুর রহমান আসামিপক্ষে শুনানি করেন। শুনানিতে তিনি বলেন, ডিজির গাড়িচালক হওয়ার কারণে মালেককে ফাঁসানো হয়েছে। স্বাস্থ্য বিভাগের কিছু লোক তাকে ফাঁসিয়েছেন। তিনি দীর্ঘদিন ধরে অসুস্থ। শ্বাসকষ্টের রোগী। এমনকি কোভিড-১৯-এ আক্রান্ত ছিলেন। এ ছাড়া তিনি একজন বয়স্ক মানুষ। আর মামলায় যা উদ্ধার হওয়ার, তা তো হয়েছে। তাকে রিমান্ডে নেয়ার কোনো প্রয়োজন নেই। প্রয়োজনে তাকে জেলগেটে জিজ্ঞাসাবাদ করা হোক। উভয় পক্ষের শুনানি শেষে আদালত আসামির জামিন নাকচ করে রিমান্ডের ওই আদেশ দেন।এদিকে শুনানি শেষে আদালত থেকে কোর্ট হাজতখানায় নেয়ার পথে আসামি মালেক উচ্চৈঃস্বরে বলেন, আমি সম্পূর্ণ নির্দোষ। আমাকে মামলায় ফাঁসানো হয়েছে। আমি চক্রান্তের শিকার।এর আগে রোববার ভোরে রাজধানীর তুরাগ থেকে মালেককে গ্রেফতার করে র‌্যাব। ওই সময় তার কাছ থেকে একটি বিদেশি পিস্তল, পাঁচ রাউন্ড গুলি, দেড় লাখ টাকার জাল নোট, একটি ল্যাপটপ ও মোবাইল ফোন উদ্ধার করা হয়। এ ঘটনায় র‌্যাব-১-এর পুলিশ পরিদর্শক আলমগীর হোসেন বাদী হয়ে মামলা দুটি করেন।স্বাস্থ্য খাতে দুর্নীতি করে পার পাওয়ার সুযোগ নেই : স্বাস্থ্যসেবা বিভাগের সচিব আবদুল মান্নান বলেছেন, স্বাস্থ্য খাতে দুর্নীতি করে পার পাওয়ার আর কোনো সুযোগ নেই। ইতোমধ্যে স্বাস্থ্য খাতের দুর্নীতি অনেকটা কমিয়ে আনা হয়েছে। আরও যেসব জায়গায় আছে সেগুলোও নজরদারির মধ্যে রাখা হয়েছে। সুতরাং স্বাস্থ্য খাতে দুর্নীতি করে কেউ পার পাবে না। ভ্যাকসিন আমদানি প্রসঙ্গে সচিব জানান, বিশ্বে বর্তমানে ৯টি কোম্পানির টিকা আবিষ্কারের শেষ পর্যায়ে রয়েছে। বাংলাদেশের অন্তত ৫টি কোম্পানির সঙ্গে আলোচনা চলছে। চীনের সিনোভ্যাক যে কোনো সময় ট্রায়াল শুরু করতে পারে। রাশিয়া বাংলাদেশেই তাদের ভ্যাকসিন উৎপাদন নিয়ে কাজ করতে আগ্রহ প্রকাশ করেছে। ভারত, রাশিয়ার ভ্যাকসিনের পাশাপাশি ফ্রান্স ও বেলজিয়ামের ভ্যাকসিন পাওয়া নিয়েও কাজ চলছে। ফ্রান্স ও বেলজিয়াম ইতোমধ্যে তাদের ভ্যাকসিন ট্রায়ালের জন্য বাংলাদেশ সরকারের কাছে আবেদন করেছে। ভ্যাকসিন আগে পেতে আর্থিকসহ সব রকম প্রস্তুতি নেয়া রয়েছে। ভ্যাকসিন আমদানি করলে প্রথম পর্যায়ে কী পরিমাণ আমদানি করা হতে পারে-এ প্রসঙ্গে জানতে চাইলে সচিব জানান, প্রাথমিকভাবে অন্তত আড়াই থেকে তিন মিলিয়ন ভ্যাক্সিন আমদানি করার পরিকল্পনা সরকারের রয়েছে।",22/9/2020,various
ভাইয়ের কাছ থেকে ছিনিয়ে নিয়ে স্কুলছাত্রীকে হত্যা,"ঢাকার সাভারে প্রেমের প্রস্তাবে রাজি না হওয়ায় স্কুলছাত্রী নিলা রায়কে কুপিয়ে হত্যা করা হয়েছে। নিলার ভাই অলক রায়ের দাবি, মিজানুর রহমান চৌধুরী নামে এক ব্যক্তি দুই হাতে ছুরি নিয়ে নিলাকে কুপিয়ে হত্যা করে। হত্যাকাণ্ডে পর থেকে অভিযুক্ত ওই যুবক পলাতক রয়েছে। রোববার রাতে সাভার পৌর এলাকার কাজী মোকমা পাড়ায় পরিত্যক্ত বাড়ির ভেতরে এ হত্যাকাণ্ড ঘটে।



নিলা মানিকগঞ্জ সদর উপজেলার বালিরটেক গ্রামের নারায়ণ রায়ের মেয়ে। সে পরিবারের সঙ্গে পৌর এলাকার কাজী মোকমাপাড়ায় শীতল ভিলায় ভাড়া থেকে স্থানীয় অ্যাসেড স্কুলের দশম শ্রেণিতে লেখাপড়া করত। হত্যাকাণ্ডে অভিযুক্ত মিজান পরিত্যক্ত ওই বাড়ির মালিক আবদুর রহমানের ছেলে। মিজান তার পরিবারের সঙ্গে একই এলাকার টগর ভিলায় ভাড়া থাকে ও স্থানীয় এক কলেজের ছাত্র।পুলিশ জানায়, দীর্ঘদিন ধরে মিজান নিলাকে প্রেমের প্রস্তাব দিয়ে আসছিল। কিন্তু তা প্রত্যাখ্যান করে নিলা। রোববার রাত ৯টার দিকে সাভার গার্লস স্কুলের পাশের গলিতে মিজান রিকশা গতিরোধ করে জোর করে নিলা ও তার ভাইকে রিকশা থেকে নামিয়ে এ-৬১/৪ নম্বর নিজেদের পরিত্যক্ত বাড়িতে নিয়ে যায়। সেখানে নিলাকে গালাগাল করে ছুরিকাঘাত ও কুপিয়ে পালিয়ে যায় মিজান। পরে স্থানীয়রা গুরুতর আহত অবস্থায় নিলাকে উদ্ধার করে সাভার এনাম মেডিকেল কলেজ হাসপাতালে নিয়ে গেলে সেখানে চিকিৎসাধীন অবস্থায় তার মৃত্যু হয়।অলক রায় বলেন, দীর্ঘদিন ধরেই মিজান আমার বোনকে নানাভাবে উত্যক্ত করে আসছিল। রোববার রাতে নিলার শ্বাসকষ্ট হচ্ছিল। এজন্য তাকে চিকিৎসককে দেখিয়ে আসার সময় মিজান জোর করে রিকশা থেকে নামিয়ে পরিত্যক্ত একটি বাড়িতে নিয়ে যায় এবং আমাকে ভয়ভীতি দেখিয়ে তাড়িয়ে দেয়।এর কিছুক্ষণ পর চিৎকার শুনে ঘটনাস্থলে গিয়ে দেখি কিছু যুবক দৌড়ে পালিয়ে যাচ্ছে। পরে আহত অবস্থায় আমার বোনকে উদ্ধার করে হাসপাতালে নিয়ে গেলে চিকিৎসাধীন অবস্থায় তার মৃত্যু হয়।স্থানীয়রা জানান, মিজান প্রতিদিনই পরিত্যক্ত ওই বাড়িতে বন্ধুদের নিয়ে মাদকসেবন করত। সরেজমিন ঘটনাস্থলে গিয়ে তার প্রমাণও মিলেছে। পাশের এক ভাড়াটিয়া বলেন, প্রতিদিনই ওই বাড়িতে মাদকের আসর বসে। বিষয়টি থানা পুলিশসহ স্থানীয় জনপ্রতিনিধিদের জানানো হলেও কোনো প্রতিকার পাওয়া যায়নি। শনিবার বিকালেও ওই জায়গায় আওয়ামী লীগ নেতা শিরুর ছেলে শাকিল ও সাকিব মিলে এক স্কুলছাত্রীকে গালাগাল ও মারধর করে।সাভার থানার পুলিশ পরিদর্শক (তদন্ত) সাইফুল ইসলাম বলেন, নিলার লাশ উদ্ধার করে ময়নাতদন্তের জন্য রাজধানীর সোহরাওয়ার্দী মেডিকেল কলেজ হাসপাতালে পাঠানো হয়েছে। অভিযুক্ত মিজানকে গ্রেফতারে অভিযান চালানো হবে বলে জানান তিনি।",22/9/2020,various
