ভ্রাতুষ্পুত্র আসিবকে ঘরে তুলে নিলেন জিএম কাদের,"এরশাদ পরিবারের সন্তান ভ্রাতুষ্পুত্র সাবেক সংসদ সদস্য হুসেইন মকবুল শাহরিয়ার আসিফকে ঘরে তুলে নিলেন পার্টির চেয়ারম্যান বিরোধীদলীয় উপনেতা জিএম কাদের। এই খবরে রংপুরে তৃণমূল নেতাকর্মীদের মাঝে আনন্দ উচ্ছ্বাস ভরে উঠেছে।



রংপুর থেকে এরশাদ পরিবারের কেউ দলের নেতৃত্বে আসার যে আকাঙ্ক্ষা নেতাকর্মীরা এতদিন মনের ভেতর পুষে রেখেছিল এ যে তারই বহিঃপ্রকাশ ঘটেছে এই আনন্দ উচ্ছ্বাসের মধ্য দিয়ে।দলের ভেতর নানা টানাপোড়ন ও রাজনীতির সমীকরণের কারণে পার্টি থেকে বহিষ্কারের আড়াই বছর পর এরশাদ পরিবারের উত্তরসূরি সাবেক সংসদ সদস্য হুসেইন মকবুল শাহরিয়ার আসিফের বিরুদ্ধে বহিষ্কারাদেশ প্রত্যাহার করা হয়েছে। তিনি রংপুর-১ (গঙ্গাচড়া) আসনের সংসদ সদস্য ছিলেন। দলের চেয়ারম্যান সাবেক রাষ্ট্রপতি হুসেইন মুহম্মদ এরশাদ তাকে খুব স্নেহ করতেন।এরশাদের অনুজ সাবেক সংসদ সদস্য প্রয়াত মোজাম্মেল হোসেন লালুর সন্তান আসিব। পার্টির দলীয় টানাপোড়ন ক্ষমতার দ্বন্দ্ব নানা কারণে ২০১৭ সালের রংপুর সিটি কর্পোরেশনের নির্বাচনের সময় তিনি দলের প্রার্থীর বিরুদ্ধে অবস্থান নিয়ে রংপুর সিটি নির্বাচনে প্রার্থী ছিলেন। সে কারণে তাকে দল থেকে বহিষ্কার করা হয়।শনিবার দলের চেয়ারম্যানের জারিকৃত এক আদেশে তার বহিষ্কারাদেশ প্রত্যাহার করে তাকে দলে ফিরিয়ে নেয়া হয়েছে। ওই আদেশে স্বাক্ষর করেছেন জাতীয় পার্টির বর্তমান চেয়ারম্যান ও বিরোধীদলীয় উপনেতা গোলাম মোহাম্মদ কাদের। এই আদেশ ইতিমধ্যেই কার্যকর হয়েছে।এ দিকে দীর্ঘ ২ বছর ৭ মাস ১০ দিন পর এরশাদ পরিবারের উত্তরসূরি ভ্রাতুষ্পুত্র আসিফ শাহরিয়ারের বিরুদ্ধে জারিকৃত বহিষ্কারাদেশ প্রত্যাহার করায় পার্টির চেয়ারম্যানের প্রতি কৃতজ্ঞতা ও ধন্যবাদ জানিয়ে সামাজিক যোগাযোগ মাধ্যমে স্ট্যাটাস দিয়েছেন আসিফের ভক্ত ও সমর্থকরা। বিভিন্ন স্থানে তারা মিষ্টি বিতরণ করেছেন।আসিফের এই বহিষ্কারাদেশ প্রত্যাহারে জাতীয় পার্টির তৃণমূল পর্যায়ের নেতাকর্মীরাসহ তার সমর্থক ও ভক্তদের মধ্যে আনন্দ উচ্ছ্বাস দেখা দিয়েছে। তারা নতুন করে জাতীয় পার্টিকে সাজাতে পরিকল্পনাও করছেন। যাতে করে ফিরে আসে জাতীয় পার্টির হারানো গৌরব।এ বিষয়ে কথা হয় রংপুর সদর উপজেলার সদ্যপুষ্করনী ইউনিয়নের জাতীয় পার্টির তৃণমূলের কর্মী বদিউজ্জামান রঞ্জুর সঙ্গে। তিনি বলেন, আসিফ শাহরিয়ার হচ্ছে এরশাদ পরিবারের যোগ্য উত্তরসূরি। এরশাদ সাহেব বেঁচে থাকতে তাকে ভাতিজা নয় নিজের সন্তান হিসেবে পরিচয় দিতেন। আসিফ তৃণমূলের নেতা। তার নেতৃত্বে জাতীয় পার্টি আবার সুসংগঠিত হবে।জাতীয় পার্টির তৃণমূলের একাধিক নেতাকর্মী জানান, জাতীয় পার্টির তৃণমূল পর্যায়ে এরশাদ পরিবারের সন্তান হিসেবে আসিফ শাহরিয়ারের ব্যাপক গ্রহণযোগ্যতা রয়েছে। কারণ তিনি তৃণমূলের নেতাকর্মীদের সুখে-দুখে পাশে থেকেছেন। পার্টিকে শক্তিশালী করতে ছুটে বেড়িয়েছেন। তার এই বহিষ্কারাদেশ প্রত্যাহারে তৃণমূল নেতাকর্মীরা খুশি।এ দিকে বহিষ্কারাদেশ প্রত্যাহারের পর এক প্রতিক্রিয়ায় সাবেক এমপি হুসাইন মকবুল আসিফ শাহরিয়ার বলেন, আমার বড় আব্বা মরহুম হুসেইন মুহাম্মদ এরশাদ ছিলেন ৬৮ হাজার গ্রামবাংলার নয়নমনি। তিনি জাতীয় পার্টির প্রতিষ্ঠাতা, সাবেক রাষ্ট্রপতি ও বিরোধীদলীয় নেতা ছিলেন। তার সরকারের আমলে দেশের ব্যাপক উন্নয়ন হয়েছে। তিনি আজ আমাদের মাঝে নেই। কিন্তু রয়ে গেছে তার স্বপ্ন। সেই স্বপ্ন বাস্তবায়নে কাজ করে যাব।আসিফ আরও বলেন, জাতীয় পার্টিকে শক্তিশালী করতে সংগঠন মজবুত করতে হবে। ত্যাগী ও পরীক্ষিত নেতাকর্মীদের নিয়ে তৃণমূলে স্বচ্ছতার ভিত্তিতে কমিটি গঠন করতে হবে।উল্লেখ্য, দলের নির্দেশ অমান্য করে রংপুর সিটি কর্পোরেশন নির্বাচনে মেয়র পদে বিদ্রোহী প্রার্থী হওয়ায় ২০১৭ সালের ৮ ডিসেম্বর তৎকালীন যুগ্ম-মহাসচিব হুসেইন মকবুল শাহরিয়ার আসিফকে বহিষ্কার করেছিলেন পার্টির চেয়ারম্যান, সাবেক রাষ্ট্রপতি ও হুসেইন মুহম্মদ এরশাদ। ওই সময় আসিফকে দলের প্রাথমিক সদস্য পদসহ সব ধরনের পদ ও পদবি কেরে নেয়া হয়।এরপর থেকে এরশাদের অভিমানী ভাতিজা আসিফ শাহরিয়ার নিজেকে গুটিয়ে রাখেন। দীর্ঘ সময় ধরে রাজনীতির মাঠে তাকে আর দেখা যায়নি। তার বড় আব্বা হুসেইন মুহম্মদ এরশাদ ২০১৯ সালের ১৪ জুলাই মারা গেলে রংপুর-৩ (সদর ও সিটি) আসনটি শূন্য হয়। এই আসনে উপ-নির্বাচনে ভাই সাদ এরশাদের বিদ্রোহী হয়ে স্বতন্ত্র পদেও ভোট যুদ্ধে হেরে যান আসিফ।তবে এর আগে তিনি ২০০৮ সালে রংপুর-১ (গঙ্গাচড়া) আসনে জাতীয় পার্টি থেকে সংসদ সদস্য নির্বাচিত হয়েছিলেন। তিনি জাতীয় পার্টির কেন্দ্রীয় যুগ্ম-মহাসচিব ছাড়াও রংপুর জেলা কমিটির সদস্য সচিব ও বিলুপ্ত রংপুর পৌরসভা জাতীয় পার্টির সাংগঠনিক সম্পাদক হিসেবে দায়িত্ব পালন করেছেন।",19/9/2020,politics
এরশাদের আদর্শে মানুষের কল্যাণে রাজনীতি করতে হবে: জিএম কাদের,"জাতীয় পার্টির চেয়ারম্যান ও বিরোধীদলীয় উপনেতা গোলাম মোহাম্মদ কাদের বলেছেন, ‘পল্লীবন্ধু হুসেইন মুহম্মদ এরশাদ ছিলেন এক মহান নেতা। এক বছর আগে তার বিদায়ে বাংলাদেশের রাজনীতিতে এক বিশাল শূন্যতার সৃষ্টি হয়েছিল। তবে জাতীয় পার্টি এখন অনেক সুসংহত এবং ঐক্যবদ্ধ। কোনো অপশক্তি জাতীয় পার্টির এগিয়ে চলা রোধ করতে পারবে না।’



তিনি বলেন, ‘এরশাদের রাজনীতি ছিল দেশ ও মানুষের কল্যাণে নিবেদিত। আমরাও পল্লীবন্ধুর আদর্শ অনুসরণ করে দেশ ও মানুষের কল্যাণে রাজনীতি এগিয়ে নেব। পল্লীবন্ধুর স্বপ্নের নতুন বাংলাদেশ গড়তে আমরা কাজ করব। যেখানে থাকবে না বেকারত্ব, দুর্নীতি ও বৈষম্য। আমরা সামাজিক ন্যায়বিচার ও সুশাসন প্রতিষ্ঠা করব।’মঙ্গলবার বেলা ১১টায় রংপুরের পল্লী নিবাসে এরশাদের সমাধিসৌধ বেদিতে পুষ্পস্তবক অর্পণ করে এ শ্রদ্ধা নিবেদন শেষে সেখানে ‘এরশাদের জীবন কর্ম ও রাজনীতি’ শীর্ষক এক আলোচনা সভায় প্রধান অতিথির বক্তব্যে তিনি এ সব কথা বলেন।সভায় সভাপতিত্ব করেন রংপুর সিটি কর্পোরেশন মেয়র পার্টির প্রেসিডিয়াম সদস্য রংপুর মহানগর সভাপতি মোস্তাফিজার রহমান মোস্তফা। সাবেক রাষ্ট্রপতি জাতীয় পার্টির প্রতিষ্ঠাতা চেয়ারম্যান হুসেইন মুহম্মদ এরশাদের উন্নয়নের তালিকা তুলে ধরে পার্টির চেয়ারম্যান গোলাম মোহাম্মদ কাদের বলেন, ‘সারা দেশে রাস্তা-ঘাট, ব্রিজ-কালভার্ট করে পল্লীবন্ধু দেশকে আধুনিক বাংলাদেশে পরিণত করেছেন। স্বাস্থ্য ও শিক্ষায় অনন্য ভূমিকা রেখেছিলেন। দুরদর্শী এরশাদ বিকেএসপি প্রতিষ্ঠা করে দেশের ক্রীড়াঙ্গনে অসাধারণ অবদান রেখেছেন। পল্লীবন্ধুর হাতে প্রতিষ্ঠিত বিকেএসপি থেকে আজ সাকিব আল হাসানের মতো বিশ্বমানের খেলোয়াড় পাচ্ছে বাংলাদেশ।’তিনি বলেন, আজকে যে ঢাকা শহরকে এত সুন্দর দেখছেন সেটার রূপকার হুসেইন মোহাম্মদ এরশাদ। স্কুল-কলেজগুলোকে সরকারিকরণ, সরকারি কর্মকর্তা-কর্মচারীদের ঈদ বোনাস, সারা দেশে বিদ্যুৎসহ সব উন্নয়ন কর্মকাণ্ডের জন্য এরশাদ স্মরণীয় হয়ে থাকবেন।স্বাস্থ্য ব্যবস্থা ভেঙ্গে গেছে উল্লেখ করে স্বাস্থ্যখাতে দুর্নীতিবাজদের দ্রুত শাস্তির আওতায় আনতে সরকারকে ব্যবস্থা নেয়ার আহ্বান জানান। একটি বৈষম্যহীন ও দুর্নীতিমুক্ত দেশ ও এরশাদের স্বপ্ন বাস্তবায়নে তার আদর্শ নিয়ে নেতাকর্মীদের এগিয়ে যাওয়ার আহ্বান জানান তিনি।সভায় আরও বক্তব্য রাখেন জাতীয় পার্টির মহাসচিব ও বিরোধীদলীয় চিফ হুইপ মসিউর রহমান রাঙ্গা।এ সময় জাতীয় পার্টির প্রেসিডিয়াম সদস্য সুনীল শুভ রায়, মীর আবদুস সবুর আসুদ, ব্যারিস্টার শামীম হায়দার পাটোয়ারী এমপি, রেজাউল ইসলাম ভূঁইয়া, সোলায়মান আলম শেঠ, মেজর (অব.) রানা মোহাম্মদ সোহেল এমপি, নাজমা আক্তার এমপি, আলমগীর সিকদার লোটন, আবদুস সাত্তার, জহিরুল ইসলাম, লিয়াকত আলী খোকা এমপি, ভাইস-চেয়ারম্যান আহসান আদেলুর রহমান আদেল এমপি, নুরুল ইসলাম তালুকদার এমপি, যুগ্ম-মহাসচিব ও মহানগর সাধারণ সম্পাদক এসএম ইয়াসির, জেলা সাধারণ সম্পাদক হাজী আবদুর রাজ্জাক, কেন্দ্রীয় সাংগঠনিক সম্পাদক মঞ্জুরুল ইসলাম মঞ্জু, যুগ্ম-কোষাধ্যক্ষ অ্যাডভোকেট আবু তৈয়ব, যুগ্ম-দফতর সম্পাদক মাহমুদ আলম, জাতীয় ছাত্রসমাজের সভাপতি ইব্রাহিম খান জুয়েল, সাধারণ সম্পাদক আল মামুনসহ কেন্দ্রীয় ও স্থানীয় নেতৃবৃন্দ উপস্থিত ছিলেন।পল্লী নিবাসে এরশাদের সমাধিতে শ্রদ্ধা নিবেদনসাবেক রাষ্ট্রপতি, বিরোধীদলীয় নেতা ও জাতীয় পার্টির প্রতিষ্ঠাতা চেয়ারম্যান প্রয়াত হুসেইন মুহম্মদ এরশাদের সমাধিতে বিনম্র শ্রদ্ধা নিবেদন করেছেন জাতীয় পার্টির কেন্দ্রীয় নেতারা। পরে এরশাদ ও তার পরিবারের সদস্যদের আত্মার মাগফিরাত কামনা করে দোয়া-মোনাজাত করা হয়। এতে দেশ ও জাতির কল্যাণ এবং সমৃদ্ধি কামনা করা হয়।মঙ্গলবার বেলা ১১টায় রংপুরের পল্লী নিবাসে সমাধিসৌধ বেদিতে পুষ্পস্তবক অর্পণ করে এ শ্রদ্ধা জানান এরশাদের ছোট ভাই, দলের বর্তমান চেয়ারম্যান ও জাতীয় সংসদের বিরোধীদলীয় উপনেতা জিএম কাদের এমপি।এর আগে সাবেক রাষ্ট্রপতি হুসেইন মুহম্মদ এরশাদের প্রথম মৃত্যুবার্ষিকীতে ঢাকা থেকে জাতীয় পার্টির কেন্দ্রীয় নেতা ও সংসদ সদস্যরা সকালে বিমানযোগে সৈয়দপুরে আসেন। সেখান থেকে গাড়িবহরে করে রংপুরের পল্লী নিবাসে পৌঁছে এরশাদের সমাধির পাশে দাঁড়িয়ে নীরবতা পালন ও সূরা তেলোয়াত করেন।পরে পার্টির কেন্দ্রীয় ও স্থানীয় নেতাদের সঙ্গে নিয়ে এরশাদের সমাধিতে শ্রদ্ধা নিবেদন জানিয়ে এরশাদ ও তার পরিবারের সদস্যদের আত্মার মাগফিরাত কামনা করে দোয়া-মোনাজাত করেন।এ সময় আরও উপস্থিত ছিলেন জাতীয় পার্টির মহাসচিব মসিউর রহমান রাঙ্গা, অতিরিক্ত মহাসচিব ব্যারিস্টার শামীম হায়দার পাটোয়ারী, প্রেসিডিয়াম সদস্য ও রংপুর সিটি মেয়র মোস্তাফিজার রহমান মোস্তফা, যুগ্ম-মহাসচিব এসএম ইয়াসির, রংপুর জেলার সাধারণ সম্পাদক হাজী আবদুর রাজ্জাক, যুগ্ম-সাধারণ সম্পাদক শাফিউল ইসলাম শাফী, খতিবার রহমান, সাংগঠনিক সম্পাদক শামীম সিদ্দিকী, মহানগর জাপার যুগ্ম-সম্পাদক লোকমান হোসেন, মহানগর যুব সংহতির সভাপতি শাহিন হোসেন জাকির প্রমুখ।এ দিকে কেন্দ্রীয় নেতারা ছাড়াও রংপুর জেলা ও মহানগর জাতীয় পার্টি এবং অঙ্গ সংগঠনের নেতাকর্মী এবং এরশাদ ভক্তরা সমাধিতে ফুলেল শ্রদ্ধা নিবেদন করেন। সকাল থেকেই পল্লী নিবাসে ঢাকা থেকে আসা নেতারা ছাড়াও উত্তরবঙ্গের ১৬ জেলার বিভিন্ন স্থান থেকে আসা নেতাকর্মীদের সমাগম হয়।শ্রদ্ধা নিবেদনের আনুষ্ঠানিকতা শেষে পল্লী নিবাস চত্বরে প্রয়াত রাষ্ট্রপতি এইচ এম এরশাদের জীবনকর্ম ও রাজনৈতিক দর্শন শীর্ষক আলোচনা সভা অনুষ্ঠিত হয়। এতে কেন্দ্রীয় ও স্থানীয় নেতৃবৃন্দ অংশ নেন।এদিকে এরশাদের মৃত্যুবার্ষিকী উপলক্ষে রংপুরে সকাল থেকেই কোরআন খতম, নগরীর ৩৩টি ওয়ার্ডে মাইকের মাধ্যমে কোরআন তেলোয়াত ও তার রাজনৈতিক বক্তব্য প্রচার, দুপুরে অসহায় দুস্থদের মাঝে খাবার বিতরণ এবং বিকালে মসজিদ-মন্দিরসহ ধর্মীয় উপাসনালয়ে বিশেষ মোনাজাতের আয়োজন করা হয়েছে।",19/9/2020,politics
এরশাদের কবর জিয়ারতে রংপুরে যাচ্ছেন জিএম কাদের,"ঢাকা থেকে শীর্ষ নেতাদের সঙ্গে নিয়ে মঙ্গলবার সকালে রংপুরে আসবেন জাতীয় পার্টি চেয়ারম্যান ও বিরোধী দলীয় উপনেতা গোলাম মোহাম্মদ কাদের এমপি। সাবেক সফল রাষ্ট্রপতি ও জাতীয় পার্টির প্রতিষ্ঠাতা চেয়ারম্যান পল্লীবন্ধু হুসেইন মুহম্মদ এরশাদের মাজার জিয়ারত করতে তিনি আসছেন।



পরে বিকাল ৪ টায় জাতীয় পার্টি চেয়ারম্যান-এর বনানী কার্যালয়ে দোয়া মাহফিল ও আলোচনা সভায় প্রধান অতিথি হিসেবে উপস্থিত থাকবেন। জাতীয় পার্টি চেয়ারম্যান ১৪ জুলাই শীর্ষ নেতৃবৃন্দসহ তিনি বিমান যোগে ঢাকা থেকে রওনা দিয়ে সৈয়দপুর বিমানবন্দর থেকে রংপুরে আসবেন। বেলা সাড়ে ১০টায় গোলাম মোহাম্মদ কাদের পল্লী নিবাসে উপস্থিত হয়ে প্রয়াত রাষ্ট্রপতি ও জাতীয় পার্টির প্রতিষ্ঠাতা চেয়ারম্যান পল্লীবন্ধু হুসেইন মুহম্মদ এরশাদের সমাধিতে পুষ্পস্তবক অর্পণ করবেন। এ সময় মিলাদ মাহফিল ও দোয়া মুনাজাতে অংশ নেবেন।ঢাকায় ফিরে তিনি বিকাল সাড়ে ৪টায় জাতীয় পার্টি চেয়ারম্যানের বনানী অফিসে পল্লীবন্ধু হুসেইন মুহম্মদ এরশাদের প্রথম মৃত্যু বার্ষিকী উপলক্ষে আয়োজিত মিলাদ মাহফিল ও আলোচনা সভায় অংশ নেবেন।",19/9/2020,politics
