এমপি ছোট মনির করোনায় আক্রান্ত,"টাঙ্গাইল-২ (গোপালপুর-ভূঞাপুর) আসনের সংসদ সদস্য তানভীর হাসান ছোট মনির করোনাভাইরাসে আক্রান্ত হয়েছেন। সোমবার সাংসদ ছোট মনিরসহ ১৭ জন নতুন করে করোনাভাইরাসে আক্রান্ত হন। জেলায় মোট করোনা আক্রান্তের সংখ্যা ৩ হাজার অতিক্রম করল।



এর আগে টাঙ্গাইল-৮ (বাসাইল-সখীপুর) আসনের সাংসদ ও জেলা আওয়ামী লীগের সাধারণ সম্পাদক জোয়াহেরুল ইসলাম, টাঙ্গাইল-৭ (মির্জাপুর) আসনের সাংসদ একাব্বর হোসেন সপরিবারে করোনাভাইরাসে আক্রান্ত হয়েছিলেন। তারা এখন সুস্থ।এমপি ছোট মনির জানান, জ্বর অনুভব করায় নমুনা পরীক্ষা করে তিনি আক্রান্ত বলে জানতে পারেন। সোমবার বিকালে তিনি ঢাকার উদ্দেশে রওনা হন। ঢাকায় বাংলাদেশ স্পেশালাইজড মেডিকেল হাসপাতালে ভর্তি হয়ে চিকিৎসা নেবেন বলে জানান।জেলা স্বাস্থ্য বিভাগ সূত্র জানায়, টাঙ্গাইলে প্রথম করোনা আক্রান্ত রোগী শনাক্ত হয় ৮ এপ্রিল। পরে এপ্রিল মাসে রোগীর সংখ্যা বেড়ে দাঁড়ায় ২৪ জনে। মে মাসে মোট আক্রান্তের সংখ্যা হয় ১৬৫, জুন মাসে ৬১২, জুলাই মাসে ১ হাজার ৬৩৮, আগস্ট মাসে ২ হাজার ৫৯৪ জন হয়। সর্বশেষ ২১ সেপ্টেম্বর পর্যন্ত রোগীর সংখ্যা দাঁড়াল ৩০১৭ জনে।মোট আক্রান্ত রোগীর মধ্যে দুই হাজার ৪১৪ জন সুস্থ হয়েছেন। মৃত্যুবরণ করেছেন ৫৬ জন। বর্তমানে চিকিৎসাধীন রয়েছেন ৫৪৭ জন।টাঙ্গাইলের সিভিল সার্জন ও জেলা করোনা প্রতিরোধ কমিটির সদস্য সচিব মোহাম্মদ ওয়াহীদুজ্জামান জানান, জেলায় আক্রান্ত রোগীদের মধ্যে সুস্থতার হার সন্তোষজনক।",22/9/2020,covid-19
অ্যান্টিজেন টেস্টের অনুমতি দিল স্বাস্থ্য মন্ত্রণালয়,"দেশের সব সরকারি মেডিকেল কলেজ হাসপাতাল, জেলা হাসপাতাল, সরকারি আরটিপিসিআর ল্যাবরেটরি এবং সব স্বাস্থ্য ইন্সটিটিউটে অ্যান্টিজেনভিত্তিক টেস্ট চালুর অনুমতি মিলেছে।



বিশ্ব স্বাস্থ্য সংস্থার গাইড লাইন অনুসরণ করে অ্যান্টিজেন পরীক্ষার অনুমতি দিয়েছে স্বাস্থ্য ও পরিবার কল্যাণ মন্ত্রণালয়।গত ১৭ সেপ্টেম্বর স্বাস্থ্য ও পরিবার কল্যাণ মন্ত্রণালয়ের স্বাস্থ্যসেবা বিভাগের সরকারি স্বাস্থ্য ব্যবস্থাপনা-১ অধিশাখার উপসচিব ড. বিলকিস বেগম স্বাক্ষরিত চিঠি থেকে এ তথ্য জানা গেছে। সেখানে বলা হয়েছে- স্বাস্থ্য মহাপরিচালকের প্রস্তাবনার পরিপ্রেক্ষিতে এক চিঠিতে বলা হয়, সারা দেশে অ্যান্টিজেন টেস্টের চাহিদার পরিপ্রেক্ষিতে অতি অল্পসময়ে করোনা শনাক্ত করতে স্বাস্থ্য অধিদফতরের প্রস্তাবনা ও বিশ্ব স্বাস্থ্য সংস্থার অন্তর্বর্তীকালীন গাইডেন্স অনুসরণ করে দেশের সব সরকারি মেডিকেল কলেজ হাসপাতাল, জেলা হাসপাতাল, সরকারি পিসিআর ল্যাব এবং সব স্বাস্থ্য ইন্সটিটিউটে অ্যান্টিজেনভিত্তিক টেস্ট চালুর অনুমতি প্রদান করা হয়।তবে শর্ত থাকে যে, যাচাই-বাছাইয়ের নিমিত্তে স্বাস্থ্য অধিদফতরে প্রক্রিয়াধীন কোভডি-১৯ ল্যাব সম্প্রসারণ নীতিমালাটি চূড়ান্ত হলে তা যথাযথভাবে অনুসরণ করতে হবে।
",22/9/2020,covid-19
করোনায় একদিনে আরও ৪০ জনের প্রাণহানি,"করোনাভাইরাসে গত ২৪ ঘণ্টায় দেশে আরও ৪০ জনের মৃত্যু হয়েছে। এ নিয়ে দেশে মোট ৪ হাজার ৯৭৯ জন কোভিড রোগী মারা গেলেন।



এই সময়ে দেশে ১ হাজার ৭০৫ জন কোভিড রোগী শনাক্ত হয়েছেন। এ নিয়ে দেশে মোট শনাক্ত হলেন ৩ লাখ ৫০ হাজার ৬২১ জন।এছাড়া গত ২৪ ঘণ্টায় সুস্থ হয়েছেন ২ হাজার ১৫২ জন এবং মোট সুস্থ ২ লাখ ৫৮ হাজার ৭১৭ জন।সোমবার স্বাস্থ্য অধিদফতর এক সংবাদ বিজ্ঞপ্তিতে এ তথ্য জানানো হয়েছে।এতে বলা হয়, গত ২৪ ঘণ্টায় ১৩ হাজার ৫৩টি নমুনা পরীক্ষা করে ১ হাজার ৭০৫ জনের দেহে করোনা শনাক্ত হয়েছে। মোট শনাক্ত ৩ লাখ ৫০ হাজার ৬২১।গত ২৪ ঘণ্টায় পরীক্ষা বিবেচনায় শনাক্তের হার ১৩ দশমিক ৬ শতাংশ।এই সময়ে দেশে আরও ৪০ জনের মৃত্যু হয়েছে। মারা যাওয়া রোগীদের মধ্যে ২৭ জন পুরুষ ও ১৩ জন নারী। এ নিয়ে দেশে মোট ৪ হাজার ৯৭৯ জন কোভিড রোগীর মৃত্যু হলো।এছাড়া গত ২৪ ঘণ্টায় সুস্থ হয়েছেন ২ হাজার ১৫২ জন এবং মোট সুস্থ ২ লাখ ৫৮ হাজার ৭১৭ জন।শনাক্ত বিবেচনায় সুস্থতার হার ৭৩ দশমিক ৭৯ শতাংশ ও মৃত্যু হার ১ দশমিক ৪২ শতাংশ।গত বছরের ডিসেম্বরে চীন থেকে উৎপত্তি হওয়া প্রাণঘাতী করোনাভাইরাস বাংলাদেশসহ বিশ্বের ২১৩টি দেশ ও অঞ্চলে ছড়িয়ে পড়েছে।গত ১১ মার্চ করোনাভাইরাস সংকটকে মহামারী ঘোষণা করে বিশ্ব স্বাস্থ্য সংস্থা (ডব্লিউএইচও)।বাংলাদেশে প্রথম কোভিড-১৯ রোগী শনাক্ত হন ৮ মার্চ এবং এ রোগে আক্রান্ত প্রথম রোগীর মৃত্যু হয় ১৮ মার্চ।",22/9/2020,covid-19
"করোনায় মৃত্যু ৫ হাজার  ছুঁই ছুঁই, শনাক্ত সাড়ে ৩ লাখ ছাড়াল","করোনাভাইরাসে গত ২৪ ঘণ্টায় দেশে ১ হাজার ৭০৫ জন কোভিড রোগী শনাক্ত হয়েছেন। এ নিয়ে দেশে মোট শনাক্ত হলেন ৩ লাখ ৫০ হাজার ৬২১ জন।



এই সময়ে দেশে আরও ৪০ জনের মৃত্যু হয়েছে। এ নিয়ে দেশে মোট ৪ হাজার ৯৭৯ জন কোভিড রোগী মারা গেলেন।এছাড়া গত ২৪ ঘণ্টায় সুস্থ হয়েছেন ২ হাজার ১৫২ জন এবং মোট সুস্থ ২ লাখ ৫৮ হাজার ৭১৭ জন।সোমবার স্বাস্থ্য অধিদফতর এক সংবাদ বিজ্ঞপ্তিতে এ তথ্য জানানো হয়েছে।এতে বলা হয়, গত ২৪ ঘণ্টায় ১৩ হাজার ৫৩টি নমুনা পরীক্ষা করে ১ হাজার ৭০৫ জনের দেহে করোনা শনাক্ত হয়েছে। মোট শনাক্ত ৩ লাখ ৫০ হাজার ৬২১।গত ২৪ ঘণ্টায় পরীক্ষা বিবেচনায় শনাক্তের হার ১৩ দশমিক ৬ শতাংশ।এই সময়ে দেশে আরও ৪০ জনের মৃত্যু হয়েছে। মারা যাওয়া রোগীদের মধ্যে ২৭ জন পুরুষ ও ১৩ জন নারী। এ নিয়ে দেশে মোট ৪ হাজার ৯৭৯ জন কোভিড রোগীর মৃত্যু হলো।এছাড়া গত ২৪ ঘণ্টায় সুস্থ হয়েছেন ২ হাজার ১৫২ জন এবং মোট সুস্থ ২ লাখ ৫৮ হাজার ৭১৭ জন।শনাক্ত বিবেচনায় সুস্থতার হার ৭৩ দশমিক ৭৯ শতাংশ ও মৃত্যু হার ১ দশমিক ৪২ শতাংশ।গত বছরের ডিসেম্বরে চীন থেকে উৎপত্তি হওয়া প্রাণঘাতী করোনাভাইরাস বাংলাদেশসহ বিশ্বের ২১৩টি দেশ ও অঞ্চলে ছড়িয়ে পড়েছে।গত ১১ মার্চ করোনাভাইরাস সংকটকে মহামারী ঘোষণা করে বিশ্ব স্বাস্থ্য সংস্থা (ডব্লিউএইচও)।বাংলাদেশে প্রথম কোভিড-১৯ রোগী শনাক্ত হন ৮ মার্চ এবং এ রোগে আক্রান্ত প্রথম রোগীর মৃত্যু হয় ১৮ মার্চ।",22/9/2020,covid-19
"করোনা সংক্রমণ বাড়তে পারে, প্রস্তুতি নেয়ার নির্দেশ প্রধানমন্ত্রীর","আগামী মাস কিংবা নভেম্বর থেকে আরেকবার করোনাভাইরাসের সংক্রমণ বাড়তে পারে, তাই আগেই প্রয়োজনীয় সব প্রস্তুতি নিতে সংশ্লিষ্টদের নির্দেশ দিয়েছেন প্রধানমন্ত্রী শেখ হাসিনা।
সোমবার মন্ত্রিসভার বৈঠকের পর সচিবালয়ে ব্রিফিংয়ে এ কথা জানান মন্ত্রিপরিষদ সচিব খন্দকার আনোয়ারুল ইসলাম। এর আগে প্রধানমন্ত্রী শেখ হাসিনার সভাপতিত্বে মন্ত্রিসভার ভার্চুয়াল বৈঠক অনুষ্ঠিত হয়।
তিনি বলেন, অক্টোবর-নভেম্বর থেকে আরেকবার করোনাভাইরাসের সংক্রমণ বাড়তে পারে, তাই প্রয়োজনীয় সব প্রস্তুতি নিয়ে রাখার নির্দেশ দিয়েছেন প্রধানমন্ত্রী। এছাড়া মাস্কের ব্যবহারে আরও সতর্ক হওয়ার আহ্বান জানিয়েছেন তিনি। 
কোভিড-১৯ জাতীয় কারিগরি পরামর্শক কমিটির সভাশেষে রোববার রাতে পাঠানো এক সংবাদ বিজ্ঞপ্তিতে বাংলাদেশেও কোভিড-১৯ সংক্রমণের দ্বিতীয় ঢেউ লাগার আশঙ্কার কথা জানানো হয়। 
কমিটির সভাপতি অধ্যাপক ডা. মোহাম্মদ সহিদুল্লাহর পাঠানো সংবাদ বিজ্ঞপ্তিতে বলা হয়েছে, দ্বিতীয় দফায় করোনাভাইরাস সংক্রমণের মধ্যেই বিভিন্ন দেশের সঙ্গে যোগাযোগ উন্মুক্ত হচ্ছে। কিন্তু স্বাস্থ্যবিধি মানার ক্ষেত্রে জনগণের মধ্যে শৈথিল্য দেখা যাচ্ছে।
এসব কারণে আমাদের দেশেও পুনরায় করোনা সংক্রমণের আশঙ্কা রয়েছে। দ্বিতীয় দফার সংক্রমণ প্রতিরোধের পাশাপাশি সংক্রমণ হলে স্বাস্থ্যসেবা নিশ্চিত করতে পূর্ণ প্রস্তুতি রাখতে সরকারকে পরামর্শ দিয়েছে কারিগরি পরামর্শ কমিটি। 
বিজ্ঞপ্তিতে বলা হয়েছে, গত কয়েক সপ্তাহ ধরে দেশে সংক্রমণের হার নিম্নমুখী হলেও ‘স্বস্তির’ জায়গায় পৌঁছেনি। কোভিড-১৯ চিকিৎসায় নিবেদিত কিছু হাসপাতালে শয্যা খালি থাকছে। অন্যদিকে অন্য রোগে আক্রান্ত মানুষের সংখ্যা রোজ বাড়ছে।



",22/9/2020,covid-19
চারঘাটে স্বাস্থ্য কমপ্লেক্সের আরএমও করোনায় আক্রান্ত,"রাজশাহীর চারঘাট উপজেলা স্বাস্থ্য কমপ্লেক্সের কর্তব্যরত চিকিৎসক (আরএমও) ডা. আতিকুল হক করোনাভাইরাসে আক্রান্ত হয়েছেন।



সোমবার ডা. আতিক নিজেই এ তথ্য নিশ্চিত করেছেন।উপজেলা স্বাস্থ্য কমপ্লেক্সের প্রধান ডা. আশিকুর রহমান যুগান্তরকে জানান, ডা. আতিক জ্বরসহ হালকা কাশিতে ভুগছিলেন।গত ১৭ সেপ্টেম্বর সকালে হাসপাতালে করোনা নমুনা প্রদান করেন তিনি। এর পর গত ১৯ সেপ্টেম্বর রাজশাহী মেডিকেল কলেজ হাসপাতালের ল্যাবে করোনা পরীক্ষায় তার পজিটিভ রিপোর্ট আসে।এর পর থেকে হাসপাতাল কোয়ার্টারে তিনি হোম কোয়ারেন্টিনে রয়েছেন। তিনি বর্তমানে সুস্থ রয়েছেন।",22/9/2020,covid-19
বাংলাদেশেও করোনা সংক্রমণের দ্বিতীয় ঢেউয়ের শঙ্কা,"পশ্চিমাবিশ্বের মতো বাংলাদেশেও কোভিড-১৯ সংক্রমণের দ্বিতীয় ঢেউ লাগার আশঙ্কা করছেন বিশেষজ্ঞরা। এ জন্য তারা কঠোরভাবে স্বাস্থ্যবিধি মেনে চলার ওপর জোর দিয়েছেন।



কোভিড-১৯ জাতীয় কারিগরি পরামর্শক কমিটির সভাশেষে রোববার রাতে পাঠানো এক সংবাদ বিজ্ঞপ্তিতে এই শঙ্কার কথা জানানো হয়েছে। কমিটির সভাপতি অধ্যাপক ডা. মোহাম্মদ সহিদুল্লাহর পাঠানো সংবাদ বিজ্ঞপ্তিতে বলা হয়েছে, দ্বিতীয় দফায় করোনাভাইরাস সংক্রমণের মধ্যেই বিভিন্ন দেশের সঙ্গে যোগাযোগ উন্মুক্ত হচ্ছে। কিন্তু স্বাস্থ্যবিধি মানার ক্ষেত্রে জনগণের মধ্যে শৈথিল্য দেখা যাচ্ছে।
এসব কারণে আমাদের দেশেও পুনরায় করোনা সংক্রমণের আশঙ্কা রয়েছে। দ্বিতীয় দফার সংক্রমণ প্রতিরোধের পাশাপাশি সংক্রমণ হলে স্বাস্থ্যসেবা নিশ্চিত করতে পূর্ণ প্রস্তুতি রাখতে সরকারকে পরামর্শ দিয়েছে কারিগরি পরামর্শ কমিটি। বিজ্ঞপ্তিতে বলা হয়েছে, গত কয়েক সপ্তাহ ধরে দেশে সংক্রমণের হার নিম্নমুখী হলেও ‘স্বস্তির’ জায়গায় পৌঁছেনি। কোভিড-১৯ চিকিৎসায় নিবেদিত কিছু হাসপাতালে শয্যা খালি থাকছে। অন্যদিকে অন্য রোগে আক্রান্ত মানুষের সংখ্যা রোজ বাড়ছে।
এমতাবস্থায় অন্যান্য রোগের চিকিৎসাসেবা নিশ্চিত করা, অর্থ সাশ্রয় করতে কোভিড-১৯ হাসপাতালের অব্যবহৃত শয্যা সংকোচনের সিদ্ধান্ত নিয়েছে সরকার।তবে দেশে এখনও আইসোলেশন কেন্দ্রের প্রয়োজন আছে বলে মনে করে জাতীয় পরামর্শক কমিটি। এ ক্ষেত্রে কমিটির পরামর্শ হচ্ছে- শয্যা সংখ্যা সংকোচন করা হলেও পুরোপুরি বন্ধ না করা। ভবিষ্যতে প্রয়োজন হলে যাতে পুনরায় এসব আইসোলেশন সেন্টার ব্যবহার করা যায়, সেই প্রস্তুতি নিয়ে রাখতে হবে।দ্বিতীয় দফার সংক্রমণ প্রতিরোধ ও নিয়ন্ত্রণে এখনই করণীয় বিষয় ঠিক করে সে অনুযায়ী প্রস্তুতি নিতে সরকারকে পরামর্শ দিয়েছে জাতীয় পরামর্শক কমিটি।জাতীয় কারিগরি পরামর্শক কমিটি দ্বিতীয় দফার সংক্রমণ দ্রুত নির্ণয়ের জন্য আরও বেশি পরিমাণে পরীক্ষা করার তাগিদ দিয়েছে। 
এ অবস্থায় কোভিড ১৯-এর নমুনা পরীক্ষার জন্য জনগণকে উদ্বুদ্ধ করার জন্য পদক্ষেপ নিতে বলে কমিটি। সংক্রমণ ছড়িয়ে পড়া প্রতিরোধ করতে সংক্রমিত ব্যক্তিকে দ্রুত চিহ্নিত করে আইসোলেশন নিশ্চিত করার কথা বলেছে। বিভিন্ন দেশ থেকে প্রবাসীর দেশে আসছে জানিয়ে ভ্রমণসংক্রান্ত পরামর্শ ও নিয়ম জারি করার তাগিদ দিয়েছে জাতীয় পরামর্শক কমিটি। সংক্রমণ প্রতিরোধে দেশে ঢোকার স্থানগুলোতে কার্যক্রম জোরদার করতে হবে।বিদেশ ফেরতদের স্ক্রিনিং, প্রাতিষ্ঠানিক ও হোম কোয়ারেন্টিন নিশ্চিত করার জন্য ব্যবস্থা করতে হবে। এ ব্যাপারে করোনাট্রেসার অ্যাপ ব্যবহারের কথা বলা হয়েছে। প্রসঙ্গত, করোনা পরিস্থিতি সামাল দেয়ার পর সংক্রমণ ফের বেড়ে যাওয়ায় বিরূপ পরিস্থিতিতে পড়েছে যুক্তরাজ্য ও ফ্রান্স।
বাংলাদেশে এখন সংক্রমণের চিত্র প্রায় স্থিতিশীল হলেও ফ্রান্স ও যুক্তরাজ্যের মতো সংক্রমণের দ্বিতীয় ঢেউ লাগার আশঙ্কা করা হচ্ছে। বিশেষ করে আসছে শীতে করোনা পরিস্থিতি আরও খারাপ রূপ নিতে পারে বলে সতর্ক করা হয়েছে।বাংলাদেশে করোনা সংক্রমণ ধরা পড়ে ৮ মার্চ। প্রথম মৃত্যু হয় ১৮ মার্চ। রোববার পর্যন্ত দেশে করোনা শনাক্ত রোগীর সংখ্যা দাঁড়িয়েছে ৩ লাখ ৪৮ হাজার ৯১৬ জনে। মারা গেছে ৪ হাজার ৯৩৯ জন।শুরুতে স্বাস্থ্যবিধি মেনে চলার ওপর কড়াকড়ি ও জনসচেতনতা দুটোই দেখা গিয়েছিল। কিন্তু যতই দিন গড়াচ্ছে, ততই মানুষের উদাসীনতা দেখা যাচ্ছে। গণপরিবহনগুলোতে ঠাসাঠাসি করে চলাফেরা করতে দেখা যাচ্ছে লোকজনকে। টেস্টের সংখ্যাও কমে গেছে।",22/9/2020,covid-19
