রিমান্ড শেষে ফের কারাগারে ওসি প্রদীপ,"কক্সবাজারের টেকনাফে সেনাবাহিনীর অবসরপ্রাপ্ত মেজর সিনহা মোহাম্মদ রাশেদ খান হত্যা মামলায় পুলিশের বরখাস্ত হওয়া ওসি প্রদীপের চতুর্থ দফায় রিমান্ড শেষে কারাগারে পাঠিয়েছেন আদালত।



চতুর্থ দফায় একদিনের রিমান্ড শেষে আদালতে হাজির করা হলে মঙ্গলবার বিকালে কক্সবাজার সিনিয়র জুডিশিয়াল ম্যাজিস্ট্রেট তামান্না ফারাহর আদালত ওসি প্রদীপকে কারাগারে পাঠানোর আদেশ দেন। এর আগে সোমবার দুপুরে প্রদীপকে রিমান্ডে নেয় র্যা ব।বিষয়টি নিশ্চিত করেছেন কোর্ট ইন্সপেক্টর প্রদীপ কুমার দাস। তিনি জানান, চতুর্থ দফায় একদিনের রিমান্ড শেষে মঙ্গলবার দুপুরে ওসি প্রদীপকে আদালতে হাজির করে র্যা ব। বিকালে কক্সবাজার সিনিয়র জুডিশিয়াল ম্যাজিস্ট্রেট তামান্না ফারাহর আদালত তাকে কারাগারে পাঠানোর আদেশ দেন। তিনি আরও জানান, এর আগে প্রদীপকে তৃতীয় দফা রিমান্ড শেষে সোমবার দুপুর ১টা ৫৫ মিনিটে আদালতে হাজির করা হয়। পরে মামলার তদন্তকারী সংস্থা র্যা ব অধিকতর জিজ্ঞাসাবাদের জন্য প্রদীপের আরেক দফা রিমান্ড আবেদন করেন। আদালত একদিনের রিমান্ড মঞ্জুর করেন।সিনহা হত্যা মামলায় ওসি প্রদীপ কুমার দাশ, পরিদর্শক লিয়াকত আলী ও থানার এসআই নন্দদুলাল রক্ষিতকে গত শুক্রবার তৃতীয় দফায় তিন দিনের রিমান্ডে নেয় মামলার তদন্তকারী সংস্থা র্যা ব। তাদের মধ্যে রোববার দায় স্বীকার করে জবানবন্দি দেন লিয়াকত। সোমবার ১৬৪ ধারায় জবানবন্দি দেন নন্দদুলাল।প্রসঙ্গত, গত ৩১ জুলাই রাত সাড়ে ১০টার দিকে কক্সবাজার-টেকনাফ মেরিন ড্রাইভের বাহারছড়া ইউনিয়নের শামলাপুর চেকপোস্টে পুলিশের গুলিতে নিহত হন অবসরপ্রাপ্ত মেজর সিনহা মোহাম্মদ রাশেদ খান।সিনহা হত্যা মামলার ১৩ আসামি কারাগারে রয়েছেন। তারা হলেন– টেকনাফ থানার বরখাস্ত হওয়া ওসি প্রদীপ কুমার দাশ, বাহারছড়া পুলিশ ফাঁড়ির ইনচার্জ পরিদর্শক লিয়াকত আলী, থানার এসআই নন্দদুলাল রক্ষিত, এসআই লিটন মিয়া, কনস্টেবল সাফানুর করিম, কামাল হোসেন ও আবদুল্লাহ আল মামুন, আর্মড পুলিশ ব্যাটালিয়নের (এপিবিএন) তিন সদস্য– এসআই মো. শাহজাহান, কনস্টেবল মো. রাজীব ও মো. আবদুল্লাহ এবং টেকনাফের মারিশবুনিয়া এলাকার বাসিন্দা নুরুল আমিন, নিজাম উদ্দিন ও মোহাম্মদ আইয়াস।রিমান্ড শেষে এপিবিএনের তিন সদস্য কয়েক দিন আগে সিনিয়র জুডিশিয়াল ম্যাজিস্ট্রেট আদালতে ১৬৪ ধারায় স্বীকারোক্তিমূলক জবানবন্দি দিয়েছেন। বর্তমানে তারা তিনজন জেলা কারাগারে অবস্থান করছেন। ঘটনার সময় এপিবিএনের তিন সদস্য শামলাপুর তল্লাশিচৌকির দায়িত্বে ছিলেন।",20/9/2020,country-news
ওসি প্রদীপের বক্তব্যের জন্য আটকে আছে তদন্ত প্রতিবেদন,"অবসরপ্রাপ্ত মেজর সিনহা মো. রাশেদ খান হত্যার ঘটনায় স্বরাষ্ট্র মন্ত্রণালয়ের উচ্চপর্যায়ের তদন্ত কমিটির প্রতিবেদন টেকনাফ থানার বরখাস্ত হওয়া ওসি প্রদীপ কুমার দাশের জন্য আটকে রয়েছে বলে জানা গেছে।



তদন্ত কমিটির প্রধান ও চট্টগ্রামের অতিরিক্ত বিভাগীয় কমিশনার মোহাম্মদ মিজানুর রহমান রোববার কক্সবাজার হিলডাউন সার্কিট হাউসের সম্মেলন কক্ষে কমিটির সবাইকে নিয়ে জরুরি সভা করেন।সভা শেষে সন্ধ্যায় এক প্রেস ব্রিফিংয়ে সাংবাদিকদের বলেন, মেজর (অব.) সিনহা মো. রাশেদ হত্যার ঘটনায় বরখাস্ত হওয়া ওসি প্রদীপ ঘনিষ্ঠভাবে জড়িত রয়েছে। সংশ্লিষ্ট বিভিন্নজনের বক্তব্যে সিনহা হত্যাকাণ্ডে তার সংশ্লিষ্টতার কথা উঠে এসেছে। তাই ওসি প্রদীপের জবানবন্দি নিয়ে তার দেয়া তথ্য-উপাত্ত বিশ্লেষণ করে তদন্ত রিপোর্ট জমা দেয়া হবে।তিনি বলেন, ৩১ আগস্ট প্রতিবেদন জমা দেয়ার শেষ তারিখ ছিল। কিন্তু আমরা আরও কয়েক দিন সময় বৃদ্ধির জন্য মন্ত্রণালয়ে আবেদন করেছি। আগামী ১ সেপ্টেম্বর ওসি প্রদীপের জবানবন্দি নিতে পারব বলে রোববার জানিয়েছিলেন কমিটির প্রধান। কিন্তু ৪র্থ বারের মতো ওসি প্রদীপ আরও একদিনের রিমান্ডে যাওয়ায় তাও পিছিয়ে গেছে বলে জানা গেছে। তদন্ত কমিটির প্রধান মিজান বলেন, এ হত্যাকাণ্ডের ঘটনায় ইতোপূর্বে সংশ্লিষ্ট ৬৭ জনের জবানবন্দি নেয়া হয়েছে। পাশাপাশি ইতোমধ্যে তদন্ত প্রতিবেদন অনেকটা গুছিয়ে শেষ পর্যায়ে নিয়ে আসা হয়েছে। শুধু ওসি প্রদীপের জবানবন্দির অপেক্ষায় প্রতিবেদন দাখিল করা যাচ্ছে না।গত ৩১ জুলাই কক্সবাজারের মেরিন ড্রাইভ রোডে টেকনাফের বাহারছড়া চেকপোস্টে পুলিশের গুলিতে নিহত হন সেনাবাহিনীর অবসরপ্রাপ্ত মেজর সিনহা মোহাম্মদ রাশেদ খান। ৫ আগস্ট নিহত সিনহার বোন শারমিন শাহরিয়া ফেরদৌস বাদী হয়ে কক্সবাজার সিনিয়র জুডিশিয়াল ম্যাজিস্ট্রেট আদালতে পরিদর্শক লিয়াকত আলীকে প্রধান, ওসি প্রদীপ কুমার দাশকে দুই নম্বর আসামি করে ৯ জনের বিরুদ্ধে হত্যা মামলা দায়ের করেন। ৬ আগস্ট বরখাস্ত হওয়া ওসি প্রদীপসহ সাত আসামি কক্সবাজার সিনিয়র জুডিশিয়াল ম্যাজিস্ট্রেট আদালতে আত্মসমর্পণ করেন। এ পর্যন্ত এই হত্যা মামলায় ১৩ জনকে আটক করেছে র‌্যাব।",20/9/2020,country-news
একই পরিবারের ৩ জনকে হত্যার অভিযোগে ওসি প্রদীপের বিরুদ্ধে আরেকটি মামলা,"একই পরিবারের তিনজনকে হত্যার অভিযোগে টেকনাফ থানার বরখাস্ত ওসি প্রদীপ কুমার দাশসহ ৪১ জনের বিরুদ্ধে নালিশি দরখাস্ত করা হয়েছে। টেকনাফে ৫০ লাখ টাকা না দেয়ায় দুই ভাই এবং এক ভাগ্নেকে ক্রসফায়ারের নামে হত্যার অভিযোগে হয় বলে এতে উল্লেখ করা হয়েছে।

সোমবার কক্সবাজার সিনিয়র জুডিশিয়াল ম্যাজিস্ট্রেট আমলী আদালত নং-৩ এ নালিশি দরখাস্তটি দায়ের করেন রাজিয়া মুন্নি (২২) নামে এক গৃহবধূ। এতে আসামি হিসেবে অভিযুক্ত ৩৫ জন পুলিশের সদস্য। বাকি ৬ জন মাদক ব্যবসায়ী, সন্ত্রাসী ও পুলিশের দালাল।



বাদী সুলতানা রাজিয়া মুন্নি টেকনাফ উপজেলা রঙ্গীখালী গাজী পাড়ার মৃত ছৈয়দ আলমের স্ত্রী।এ সংক্রান্ত আর কোনো মামলা আছে কিনা তদন্ত করে আগামী ১৫ সেপ্টেম্বরের মধ্যে প্রতিবেদন দিতে টেকনাফ থানাকে নির্দেশ দিয়েছেন বিচারক মোহাম্মদ হেলাল উদ্দীন।এজাহারে উল্লেখ করা হয়, গত ৬ মে রাত ২টার দিকে রঙ্গীখালী গাজী পাড়ার সৈয়দ আলম ও তার ভাই নূরুল আলম এবং তাদের ভাগ্নে আনসার সদস্য সৈয়দ হোসেন ওরফে আবদুল মোনাফকে ওসি প্রদীপ কুমার দাশের নেতৃত্বে একদল পুলিশ তুলে নিয়ে যায়। পরে পরিবারের কাছ থেকে ৫০ লাখ টাকা দাবি করেন ওসি প্রদীপ। টাকা দিতে অস্বীকৃতি জানালে ওই দিন ভোরে বন্দুকযুদ্ধের নামে একসঙ্গে তিনজনকেই ধানক্ষেতে হত্যা করা হয়।বাদীপক্ষের আইনজীবী কাশেম আলী সাংবাদিকদের এই তথ্যের সত্যতা নিশ্চিত করেছেন।",20/9/2020,country-news
‘ডাকাত ধরতে’ তল্লাশি চৌকিতে গিয়ে মেজর সিনহাকে গুলি করেন লিয়াকত,"‘ডাকাত ধরতে‘ তল্লাশি চৌকিতে গিয়ে মেজর (অব.) সিনহা মো. রাশেদ খানকে নিজেই গুলি করেন টেকনাফের বাহারছড়া পুলিশ ফাঁড়ির ইনচার্জ পরিদর্শক লিয়াকত আলী। রোববার আদালতে ১৬৪ ধারায় দেয়া স্বীকারোক্তিমূলক জবানবন্দিতে সিনহা হত্যা মামলার প্রধান আসামি লিয়াকত আলী এসব তথ্য জানান।
 


রোববার কক্সবাজারের সিনিয়র জুডিশিয়াল ম্যাজিস্ট্রেট তামান্না ফারাহর আদালতে টানা পৌনে ৫ ঘণ্টা ধরে জবানবন্দি দেন লিয়াকত।মামলার তদন্ত কর্মকর্তা র‌্যাব-১৫ এর সহকারী পুলিশ সুপার (এএসপি) খাইরুল ইসলাম সাংবাদিকদের বলেন, তিন দফা রিমান্ডে জিজ্ঞাসাবাদে পরিদর্শক লিয়াকত আলী সিনহা হত্যার ঘটনায় গুরুত্বপূর্ণ তথ্য দিয়েছেন। তিনি সুস্থ মস্তিষ্কে রোববার আদালতে এসে স্বীকারোক্তিমূলক জবানবন্দি দিতে রাজি হয়েছেন। লিয়াকত আলী ওই সময় টেকনাফের বাহারছড়া পুলিশ ফাঁড়ির ইনচার্জ ছিলেন। তিনি পুলিশের বরখাস্ত হওয়া পরিদর্শকও। আদালত সূত্র জানিয়েছে, মারিশবুনিয়া গ্রামের তিন ব্যক্তি লিয়াকত আলীকে ফোন করে সেনাবাহিনীর পোশাক পরা এক ব্যক্তির (সিনহা) কাছে আগ্নেয়াস্ত্র আছে এবং তিনি ডাকাত দলের সদস্য বলে জানায়। লিয়াকত আলী তাদের কথা বিশ্বাস করে চেকপোস্টে অবস্থান নিয়ে সিনহাকে গুলি করেন।জবানবন্দিতে লিয়াকত আলী এসব কথা বলার চেষ্টা করেছেন।রোববার সিনিয়র জুডিশিয়াল ম্যাজিস্ট্রেট তামান্না ফারাহর আদালতে তিনি স্বীকারোক্তিমূলক জবানবন্দি দেন। পরে আদালত তাকে কারাগারে প্রেরণ করেছেন বলে জানিয়েছেন কোর্ট পরিদর্শক প্রদীপ কুমার দাস।তিনি জানান, এর আগে দুপুর ১২টার দিকে বাহারছড়া তদন্ত কেন্দ্রের সাবেক আইসি পরিদর্শক লিয়াকত আলীকে আদালতে আনা হয়। বিকাল সাড়ে ৪টার দিকে জবানবন্দি শেষে তাকে কারাগারে পাঠানো হয়।আদালত সূত্র জানায়, জবানবন্দি গ্রহণের আগে কক্সবাজার সদর হাসপাতালে লিয়াকতের স্বাস্থ্য পরীক্ষা করা হয়।এর আগে এ হত্যা মামলায় এপিবিএনের এএসআই শাহজাহান, কনস্টেবল রাজীব ১৬৪ ধারায় স্বীকারোক্তিমূলক জবানবন্দি দিয়েছেন। জবানবন্দি শেষে তাদের কারাগারে পাঠিয়েছেন আদালত।গত বুধবার এ মামলার আসামি এপিবিএন কনস্টেবল আবদুল্লাহ স্বীকারোক্তিমূলক জবানবন্দি দেন। জবানবন্দি গ্রহণ শেষে তাকে কক্সবাজার জেলা কারাগারে পাঠানোর নির্দেশ দেয়া হয়।গত ১৭ আগস্ট এপিবিএনের তিন সদস্যকে জিজ্ঞাসাবাদের জন্য নেয়া হয় র‌্যাব-১৫ কার্যালয়ে। পরের দিন ১৮ আগস্ট এ মামলায় তাদের গ্রেফতার দেখিয়ে আদালতে ১০ দিনের রিমান্ডের আবেদন জানালে সাত দিনের রিমান্ড মঞ্জুর করেন আদালত।গত ৩১ জুলাই কক্সবাজারের মেরিন ড্রাইভ রোডে টেকনাফের বাহারছড়া চেকপোস্টে পুলিশের গুলিতে নিহত হন সেনাবাহিনীর অবসরপ্রাপ্ত মেজর সিনহা মোহাম্মদ রাশেদ খান। ৫ আগস্ট নিহত সিনহার বোন শারমিন শাহরিয়া ফেরদৌস বাদী হয়ে কক্সবাজার সিনিয়র জুডিশিয়াল ম্যাজিস্ট্রেট আদালতে পরিদর্শক লিয়াকত আলী, ওসি প্রদীপ কুমার দাশসহ নয়জনের বিরুদ্ধে হত্যা মামলা দায়ের করেন।৬ আগস্ট বরখাস্ত হওয়া ওসি প্রদীপসহ সাত আসামি কক্সবাজার সিনিয়র জুডিশিয়াল আদালতে আত্মসমর্পণ করেন।",20/9/2020,country-news
সিনহা হত্যা: আদালতে জবানবন্দি শেষে কারাগারে পরিদর্শক লিয়াকত,"সেনাবাহিনীর অবসরপ্রাপ্ত মেজর সিনহা মো. রাশেদ খান হত্যা মামলার আসামি টেকনাফের বাহারছড়া তদন্ত কেন্দ্রের সাবেক আইসি পরিদর্শক লিয়াকত আলী আদালতে ১৬৪ ধারায় স্বীকারোক্তিমূলক জবানবন্দি দিয়েছেন।



রোববার সিনিয়র জুডিশিয়াল ম্যাজিস্ট্রেট তামান্না ফারাহর আদালতে তিনি স্বীকারোক্তিমূলক জবানবন্দি দেন। পরে আদালত তাকে কারাগারে প্রেরণ করেছেন বলে জানিয়েছেন কোর্ট পরিদর্শক প্রদীপ কুমার দাস।তিনি জানান, এর আগে দুপুর ১২টার দিকে বাহারছড়া তদন্ত কেন্দ্রের সাবেক আইসি পরিদর্শক লিয়াকত আলীকে আদালতে আনা হয়। বিকাল সাড়ে ৪টার দিকে জবানবন্দি শেষে তাকে কারাগারে পাঠানো হয়।আদালত সূত্র জানায়, জবানবন্দি গ্রহণের আগে কক্সবাজার সদর হাসপাতালে লিয়াকতের স্বাস্থ্য পরীক্ষা করা হয়।মামলার তদন্তকারী কর্মকর্তা ও র‍্যাবের সহকারী পুলিশ সুপার (এএসপি) খাইরুল ইসলাম সাংবাদিকদের বলেন, সিনহা হত্যা মামলায় লিয়াকত আলী রোববার ১৬৪ ধারায় আদালতে স্বীকারোক্তিমূলক জবানবন্দি দিয়েছেন।এর আগে এ হত্যা মামলায় এপিবিএনের এএসআই শাহজাহান, কনস্টেবল রাজীব ১৬৪ ধারায় স্বীকারোক্তিমূলক জবানবন্দি দিয়েছেন। জবানবন্দি শেষে তাদের কারাগারে পাঠিয়েছেন আদালত।গত বুধবার এ মামলার আসামি এপিবিএন কনস্টেবল আবদুল্লাহ স্বীকারোক্তিমূলক জবানবন্দি দেন। জবানবন্দি গ্রহণ শেষে তাকে কক্সবাজার জেলা কারাগারে পাঠানোর নির্দেশ দেয়া হয়।গত ১৭ আগস্ট এপিবিএনের তিন সদস্যকে জিজ্ঞাসাবাদের জন্য নেয়া হয় র‌্যাব-১৫ কার্যালয়ে। পরের দিন ১৮ আগস্ট এ মামলায় তাদের গ্রেফতার দেখিয়ে আদালতে ১০ দিনের রিমান্ডের আবেদন জানালে সাত দিনের রিমান্ড মঞ্জুর করেন আদালত।গত ৩১ জুলাই কক্সবাজারের মেরিন ড্রাইভ রোডে টেকনাফের বাহারছড়া চেকপোস্টে পুলিশের গুলিতে নিহত হন সেনাবাহিনীর অবসরপ্রাপ্ত মেজর সিনহা মোহাম্মদ রাশেদ খান। ৫ আগস্ট নিহত সিনহার বোন শারমিন শাহরিয়া ফেরদৌস বাদী হয়ে কক্সবাজার সিনিয়র জুডিশিয়াল ম্যাজিস্ট্রেট আদালতে পরিদর্শক লিয়াকত আলী, ওসি প্রদীপ কুমার দাশসহ নয়জনের বিরুদ্ধে হত্যা মামলা দায়ের করেন।৬ আগস্ট বরখাস্ত হওয়া ওসি প্রদীপসহ সাত আসামি কক্সবাজার সিনিয়র জুডিশিয়াল আদালতে আত্মসমর্পণ করেন।",20/9/2020,country-news
