অনলাইন ক্লাসেই মারা গেলেন শিক্ষিকা,"করোনার কারণে স্কুল-কলেজ বন্ধ বিশ্বজুড়েই। বিকল্প হিসাবে অনলাইনে চলছে শিক্ষার্থীদের পড়াশোনা।



আর অনলাইনে ক্লাস নিতে নিতেই মৃত্যুর কোলে ঢলে পড়লেন এক শিক্ষিকা। প্রিয় শিক্ষিকাকে মনিটরের দিকে তাকিয়ে মারা যেতে দেখলেন শিক্ষার্থীরা।শনিবার ব্রিটিশ সংবাদমাধ্যম ডেইলি মেইল জানিয়েছে, শিক্ষিকার মৃত্যুর এই মর্মান্তিক ঘটনা ঘটেছে লাতিন আমেরিকার দেশ আর্জেন্টিনায়। সেখানে ডি লা এম্প্রেসা ইউনিভার্সিটিতে শিক্ষকতা করতেন তিনি। তিনি ছিলেন রাজনীতি ও আন্তর্জাতিক বিষয়ের শিক্ষক। তার নাম পাওলা দি সিমোন।ডেইলি মেইল আরও জানায়, মৃত ওই শিক্ষিকা করোনাভাইরাসে আক্রান্ত ছিলেন। আগস্টের শেষের দিকে করোনায় আক্রান্ত হন পাওলা। সেপ্টেম্বরের শুরুতে তার মধ্যে করোনার উপসর্গ দেখা দেয়। এমন শারীরিক পরিস্থিতিতেও নিজের ছাত্র-ছাত্রীদের পাঠদানে কোনো খামতি দেননি তিনি। জুমে ক্লাস চালিয়ে যাচ্ছিলেন পাওলা।বুধবার জুম লাইভে ক্লাস নেয়ার মাঝখানে শিক্ষার্থীরা লক্ষ্য করে যে, শ্বাস-প্রশ্বাসে সমস্যা হচ্ছিল পাওলার। কয়েখজন শিক্ষার্থী অ্যাম্বুলেন্স পাঠানোর জন্য বাসার ঠিকানাও চায় তার কাছে। এ সময় পাওলা একটা কথাই বলতে পেরেছিলেন - আমি পারব না!
",19/9/2020,international
করোনা: মেক্সিকোয় সবচেয়ে বেশি স্বাস্থ্যকর্মীর মৃত্যু,"করোনা মহামারীর বিরুদ্ধে লড়তে মেক্সিকোয় সবচেয়ে বেশি স্বাস্থ্যকর্মীর মৃত্যু হয়েছে। বৃহস্পতিবার এক প্রতিবেদনে অ্যামনেস্টি ইন্টারন্যাশনাল এমন দাবি করেছে।



এতে বলা হয়েছে– বিশ্বজুড়ে কোভিড ১৯-এ আক্রান্ত হয়ে অন্তত সাত হাজার স্বাস্থ্যকর্মীর মৃত্যু হয়েছে। যাদের মধ্যে মেক্সিকোতেই মারা গেছেন এক হাজার ৩২০ জন।অন্যান্য দেশের মধ্যে যুক্তরাষ্ট্র, ব্রাজিল ও ভারতে যথাক্রমে এক হাজার ৭৭, ৬৩৪ এবং ৫৭৩ স্বাস্থ্যকর্মী এ রোগে আক্রান্ত হয়ে মারা গেছেন।করোনার বিরুদ্ধে লড়তে সামনের সারির যোদ্ধা বলা হয় স্বাস্থ্যকর্মীদের। অসুস্থদের চিকিৎসাসেবার দায়িত্বে থাকায় তাদের রোগ সংক্রমিত হওয়ার ঝুঁকি অনেক বেশি।অ্যামনেস্টি ইন্টারন্যাশনালের ইকোনমিক অ্যান্ড সোশ্যাল জাস্টিসের প্রধান স্টিভ ককবার্ন বলেন, করোনাভাইরাসের মহামারী শুরুর পর বেশ কয়েক মাস কেটে গেছে। অথচ এখনও মেক্সিকো, ব্রাজিল ও যুক্তরাষ্ট্রে এ রোগে আক্রান্ত হয়ে স্বাস্থ্যকর্মীদের মৃত্যুর হার ভয়াবহ রকম বেশি।তিনি বলেন, তাই সব স্বাস্থ্যকর্মীর জন্য পর্যাপ্ত সুরক্ষাব্যবস্থা নিশ্চিত করতে বৈশ্বিক সহযোগিতা একান্ত জরুরি হয়ে পড়েছে। যাতে স্বাস্থ্যকর্মীরা নিজেদের জীবনকে ঝুঁকির মধ্যে না ফেলে স্বাস্থ্যসেবার মতো গুরুত্বপূর্ণ দায়িত্ব পালন চালিয়ে যেতে পারেন।",19/9/2020,international
ব্রাজিলে কমতে শুরু করেছে করোনা সংক্রমণ,"ব্রাজিলে করোনা সংক্রমণ কমতে শুরু করেছে বলে জানিয়েছে দেশটির স্বাস্থ্য মন্ত্রণালয়। আক্রান্তের সংখ্যায় যুক্তরাষ্ট্রের পরেই দক্ষিণ আমেরিকার দেশটির অবস্থান।



এনডিটিভির খবরে জানা গেছে, গত ২৪ ঘণ্টায় ব্রাজিলে নতুন করে ৪৪ হাজার রোগী করোনায় আক্রান্ত হয়েছে। এ সময়ে মারা গেছেন ৮৩৪ জন।দেশটিতে করোনাভাইরাসে আক্রান্তের সংখ্যা ৪০ লাখ ছাড়িয়েছে। বৃহস্পতিবার স্বাস্থ্য মন্ত্রণালয় বলেছে, বিশ্বে সর্বোচ্চ দ্বিতীয় ক্ষতিগ্রস্ত এ দেশটিতে সংক্রমণ কমতে শুরু করেছে।গত ২৬ ফেব্রুয়ারি থেকে সংক্রমণ শুরু হওয়ার পর থেকে ব্রাজিলে এ পর্যন্ত ৪০ লাখ ৪০ হাজার লোক আক্রান্ত হয়েছে এবং এক লাখ ২৪ হাজার ৬০০ লোকের মৃত্যু হয়েছে। যুক্তরাষ্ট্রের পর এ সংখ্যা দ্বিতীয় সর্বোচ্চ।স্বাস্থ্য মন্ত্রণালয় বলেছে, সম্প্রতি সংক্রমণ কমতে শুরু করেছে এবং ধারণা করা হচ্ছে– প্রতিদিন গড়ে এক হাজারের বেশি লোকের মৃত্যুর সময় মহামারী সর্বোচ্চ সীমা অতিক্রম করেছে।আগস্টের শেষ নাগাদ থেকে ব্রাজিলে দৈনিক গড়ে প্রায় ৮৭০ জনের মৃত্যু এবং প্রতিদিন গড়ে ৪০ হাজার লোক নতুন আক্রান্ত হচ্ছে।ব্রাসিলিয়া ইউনিভার্সিটির মহামারী বিশেষজ্ঞ মাউরিসিও সানচেজ বলেছেন, এই শুরু থেকে আশা করা যায় পরিস্থিতি উন্নয়নের দিকে যাচ্ছে।",19/9/2020,international
কোভিড-১৯: ব্রাজিলে আক্রান্ত ৪০ লাখ ছাড়াল,"করোনাভাইরাসের প্রাদুর্ভাব বেড়েই চলছে ব্রাজিলে। ইতিমধ্যে সংক্রমণ ৪০ লাখ ছাড়িয়ে গেছে লাতিন আমেরিকার দেশটিতে। সবশেষ চব্বিশ ঘণ্টায় প্রায় ৪৪ হাজারের বেশি মানুষ আক্রান্ত শনাক্ত হয়েছেন।



বিশ্বব্যাপী করোনায় আক্রান্ত ও মৃত্যুর তথ্য রাখা আন্তর্জাতিক ওয়েবসাইট ওয়ার্ল্ডোমিটারের তথ্যানুযায়ী, কোভিড-১৯ এ শুক্রবার সকাল সাড়ে ৯ টা পর্যন্ত ব্রাজিলে আক্রান্ত শনাক্ত হয়েছেন ৪০ লাখ ৪৬ হাজার ১৫০ জন। মৃত্যু হয়েছে ১ লাখ ২৫ হাজার ৭২৯ জনের। আর সুস্থ্ হয়ে উঠেছেন ৩২ লাখ ৪৭ হাজার ৪৭ হাজার ৬১০ জন।করোনাভাইরাসে সংক্রমণ ও মৃত্যুতে যুক্তরাষ্ট্রের পরেই ব্রাজিলের অবস্থান। ৬৩ লাখ ছাড়ানো আক্রান্ত নিয়ে শীর্ষে আছে যুক্তরাষ্ট্র।ব্রাজিলে প্রথম কোভিড-১৯ সংক্রমণের খবর আসে ২৬ ফেব্রুয়ারি। চব্বিশ ঘণ্টায় ব্রাজিলে আক্রান্তদের মধ্যে আরও ৮৩৪ জনের মৃত্যু হয়েছে। এই নিয়ে দেশটিতে করোনায় মোট মৃতের সংখ্যা দাঁড়িয়েছে ১ লাখ ২৪ হাজার।শনাক্তের মতো মৃত্যুর বৈশ্বিক তালিকায়ও দ্বিতীয়স্থানে লাতিন আমেরিকার দেশটি। ১ লাখ ৯১ হাজার মৃত্যু নিয়ে তাতেও শীর্ষে যুক্তরাষ্ট্র।তবে ব্রাজিলের স্বাস্থ্য মন্ত্রণালয়ের দাবি, দেশে করোনা সংক্রমণের হার গত কিছুদিন ধরে কমতির দিকে। তাদের বিশ্বাস, আক্রান্তের সর্বোচ্চ পর্যায়টা পেরিয়ে এসেছে তারা।কিছুদিন আগেও ব্রাজিলে করোনায় আক্রান্তদের মধ্যে প্রতিদিন ১ হাজারের বেশি মানুষের মৃত্যু হতো। আগস্ট থেকে প্রাণহানির সংখ্যাটা আটশোর ঘরে নেমে এসেছে।এদিকে, সবশেষ চব্বিশ ঘণ্টায় বিশ্বে করোনাভাইরাসে আক্রান্তের সংখ্যা বেড়ে ২ কোটি ৬৪ লাখ ছাড়িয়েছে; মৃত্যু বেড়ে দাঁড়িয়েছে ৮ লাখ ৭৩ হাজার।",19/9/2020,international
"বিশ্বের সবচেয়ে প্রবীণ দম্পতি, ৮০ বছর সংসার (ভিডিও)","প্রায় ৮০ বছর ধরে একসঙ্গে সংসার করে বিশ্বের সবচেয়ে প্রবীণ দম্পতি হিসেবে গিনেজ ওয়ার্ল্ড বুকে নাম লিখিয়েছেন এক দম্পতি। তারা হলেন, ইকুয়েডরের ১১০ বছর বয়সী নাগরিক জুলিও সিজার মোরা ও তার ১০৫ বছর বয়সী স্ত্রী ওয়াড্রামিনা ম্যাক্লোভিয়া। এ দম্পতি এখনো সুস্থ রয়েছেন।



সংবাদ মাধ্যম ইউএস ওয়ার্ল্ড জানিয়েছে, দুজনেই শিক্ষকতা করতেন। এখন অবসরে গেছেন। দুজনে মিলে ২১৪ বছর বেঁচে আছেন। গত শনিবারের হিসাব অনুযায়ী তাদের বিবাহিত জীবন ৭৯ বছর ৬ মাস ২২ দিন। তবে তাদের ভালোবাসার গোপন তথ্য ফাঁস করেছেন উভয়েই। তারা বলেছেন, উভয়ের মধ্যে ভালোবাসা + পরিপক্কতা + পারস্পরিক শ্রদ্ধা থাকতে হবে। সিএনএন জানিয়েছে, ১৯৪১ সালে ভালোবেসে একে অপরকে বিয়ে করেন। যদিও সেসময় দুই পরিবার থেকে তাদের এ সম্পর্ককে মেনে নেওয়া হয়নি। বিয়ের আগে তারা বন্ধু ছিলেন। বোনের বিয়েতে ভগ্নীপতির কাজিনের সঙ্গে বন্ধুত্বের সাত বছর পর বিবাহ বন্ধনে আবদ্ধ হন তারা। সালটি ছিল ১৯৪১ সালের ৭ ফেব্রুয়ারি। বর্তমানে ৫ ছেলে-মেয়ে ও ১১ নাতি-নাতনি ও তাদেরও ছেলে-মেয়ে মিলে বিশাল এক সংসার এ দম্পতির। ছেলে মেয়েদের সবাই কলেজ পর্যায়ের ডিগ্রি অর্জন করেছেন। দম্পতির এক মেয়ে অরা সিসিলিয়া জানান, তাদের মা-বাবা এখনও একসঙ্গে সিনেমা দেখেন, থিয়েটারে যান, বাগান করেন, এমনকি প্রাত:রাশ কিংবা রাতের খাবারের সময়েও পরিবারের সঙ্গে সময় দিতে পছন্দ করেন।গিনেজ বুকের এক বিবৃতিতে ওই দম্পতি জানান, সব সদস্যদের প্রতি ভালোবাসা, পারস্পরিক সম্মান, সততা ও শিক্ষাই পারে একটি পরিবারের সঠিক মূল্যবোধ ধরে রাখতে। ",19/9/2020,international
ভেনিজুয়েলায় শতাধিক বিরোধীদলীয় নেতাকে মুক্তি দিলেন মাদুরো,"ভেনিজুয়েলায় জাতীয় সংসদ নির্বাচনের আগে বেশ কয়েকজন মার্কিন সমর্থিত সংসদ সদস্যসহ শতাধিক বিরোধীদলীয় রাজনৈতিককে মুক্তি দিয়েছে দেশটির সরকার।



প্রেসিডেন্ট নিকোলাস মাদুরো দেশের বিদ্যমান রাজনৈতিক বিভাজন দূর করে জাতীয় সংহতি দৃঢ় করার পদক্ষেপ হিসেবে এ উদ্যোগ নিয়েছেন।খবর এএফপির।তার এ পরিকল্পনা অংশ হিসেবে বিরোধী বন্দীদের মুক্তি দেয়া হচ্ছে। প্রেসিডেন্ট মাদুরো নিজেই বিষয়টি নিশ্চিত করেছেন।তিনি বলেছেন, ল্যাটিন আমেরিকায় রাজনৈতিক ঐক্য ও সংহতি জোরদার করার জন্যই তিনি এ ব্যবস্থা নিয়েছেন।

যেসব বিরোধী বন্দিকে মুক্তি দেয়া হয়েছে তাদের বিরুদ্ধে সহিংস বিক্ষোভ, সামরিক অভ্যুত্থানের প্রচেষ্টা এবং দেশের মধ্যে বিদ্বেষ ছড়ানোসহ নানা ধরনের অপরাধমূলক তৎপরতার অভিযোগ ছিল।মুক্তিপ্রাপ্ত বন্দীদের মধ্যে বেশ কয়েকজন মার্কিন সমর্থিত সংসদ সদস্য রয়েছেন। কিন্তু প্রেসিডেন্ট মাদুরো তাদেরকে আইনের সুযোগ গ্রহণের সুবিধা দিয়েছেন।বিষয়টিকে ভেনিজুয়েলায় প্রশংসার দৃষ্টিতে দেখা হচ্ছে তবে বিরোধীদের অনেকেই এখনও প্রেসিডেন্ট মাদুরোর সমালোচনায় মুখর।  ",19/9/2020,international
চিলিতে ৬.৭ মাত্রার শক্তিশালী ভূমিকম্প,"ল্যাটিন আমেরিকার দেশ চিলির উত্তরাঞ্চলে মঙ্গলবার ৬.৭ মাত্রার শক্তিশালী একটি ভূমিকম্প আঘাত হেনেছে।



জার্মান রিসার্চ সেন্টারের ভূতাত্ত্বিক জরিপ কেন্দ্র এ তথ্য জানিয়েছে। খবর আরব নিউজ ও রয়টার্সের।

এর আগে চিলির ওই উপকূলীয় এলাকার ১০ কিলোমিটার ভূগর্ভে ৭ মাত্রার একটি ভূমিকম্প হয়।তাৎক্ষণিকভাবে ভূমিকম্পে ক্ষয়ক্ষতির পারিমাণ জানা যায়নি। ",19/9/2020,international
করোনার ধকল কাটিয়ে ওঠা ব্রাজিল প্রেসিডেন্টের কিডনিতে পাথর,"কোভিড-১৯ মহামারীর ধকল কাটিয়ে উঠতে না উঠতেই ফের দুঃসংবাদ ভর করেছে ব্রাজিল প্রেসিডেন্ট জাইর বোলসোনারোর কাঁধে। এবার তার কিনডিতে পাথর ধরা পড়েছে। এটি অপসারণে চলতি মাসের যে কোনো সময় তাকে অস্ত্রোপচার করানো লাগতে পারে। খবর বিবিসি ও সিএনএনের।



সিএনএন ব্রাজিলের খবরে বলা হয়েছে– আলট্রাসাউন্ড টেস্ট করার পর চিকিৎসকরা জানিয়েছেন, বোলসোনারোর কিনডিতে পাথর রয়েছে এবং সেটি শিমের দানার চেয়ে কিছুটা বড়। ক্যাথেটার ছাড়াই এটি অপসারণ করা যাবে। তবে এ বিষয়ে বিস্তারিত জানায়নি ব্রাজিলের প্রেসিডেন্ট অফিস।জুলাইয়ে করোনাভাইরাসে আক্রান্ত হন ৬৫ বছর বয়সী বোলসোনারো। এর পর দুই সপ্তাহ আইসোলেশনে থাকেন। সুস্থ হওয়ার পরই তিনি পুরোদমে কাজে যোগ দেন। জনসম্মুখে যাওয়া শুরু করেন। এর আগে কোভিড-১৯ মহামারীকে পাত্তাই দেননি তিনি। এটিকে সাধারণ ফ্লু বলে মন্তব্য করে দিব্যি ঘুরে বেড়ান মাস্ক ছাড়াই। এমনটি মোটর শোভাযাত্রাও করেন সমর্থকদের নিয়ে। এ নিয়ে ব্যাপক সমালোচিত হন ডানপন্থী এ নেতা।তবে অনেক দিন ধরে নানা ধরনের শারীরিক জটিলতায় ভুগছেন ৬৫ বছর বয়সী বোলসোনারো। ২০১৮ সালে প্রেসিডেন্ট নির্বাচনের প্রচারের সময় প্রতিপক্ষ সমর্থকের ছুরিকাঘাতে আহত হলে তার পেটে চারবার অস্ত্রোপচার করাতে হয়।

কিডনিতে পাথর ধরা পড়ার বিষয়টি বোলসোনারো নিজেই সিএনএন ব্রাজিলকে জানিয়ে বলেন, আমি হালকা ব্যথা অনুভব করছিলাম। এর পর চেকআপে যাই আমি। কিন্তু এখন ভালো আছি। বয়সের কারণে এমনটি হতে পারে।",19/9/2020,international
