‘জয় বাংলা টেলিমেডিসিন অ্যাপ’ উদ্বোধন মঙ্গলবার,"দেশের প্রান্তিক জনগোষ্ঠীর কাছে মোবাইল অ্যাপের মাধ্যমে চিকিৎসা সেবা পৌছে দেয়ার লক্ষ্যে বাংলাদেশ আওয়ামী লীগের বিজ্ঞান ও প্রযুক্তি বিষয়ক উপকমিটির উদ্যোগে ‘জয় বাংলা টেলিমেডিসিন অ্যাপ’ ডেভেলপ করা হয়েছে। এই অ্যাপের মাধ্যমে বিশেষজ্ঞ ডাক্তারদের কাছ থেকে বিনামূল্যে চিকিৎসা সেবা গ্রহণ করতে পারবেন দেশের মানুষ।



‘জয় বাংলা টেলিমেডিসিন অ্যাপটি’ আনুষ্ঠানিকভাবে মঙ্গলবার (১৫ সেপ্টেম্বর) অনলাইনে উদ্বোধন করবেন আওয়ামী লীগের সাধারণ সম্পাদক এবং সড়ক পরিবহন ও সেতু মন্ত্রী ওবায়দুল কাদের এমপি।অনুষ্ঠানে স্বাগত বক্তব্য রাখবেন আওয়ামী লীগের বিজ্ঞান ও প্রযুক্তি বিষয়ক সম্পাদক এবং উপকমিটির সদস্য সচিব প্রকৌশলী আবদুস সবুর। সভায় সভাপতিত্ব করবেন আওয়ামী লীগের উপদেষ্টামণ্ডলীর সদস্য ও উপকমিটির চেয়ারম্যান অধ্যাপক ড. হোসেন মনসুর।অনুষ্ঠানটি সঞ্চালনা করবেন আইইবি’র সহকারী সাধারণ সম্পাদক প্রকৌশলী রনক আহসান। আলোচক হিসেবে থাকবেন কানাডিয়ান ইউনিভার্সিটি অব বাংলাদেশের উপাচার্য অধ্যাপক প্রকৌশলী ড. মোহাম্মদ মাহফুজুল ইসলাম। এছাড়া অ্যাপ সম্পর্কে বিস্তারিত তুলে ধরবেন প্রকৌশলী আবু হাসান মাসুদ।আওয়ামী লীগের বিজ্ঞান ও প্রযুক্তি বিষয়ক সম্পাদক এবং উপকমিটির সদস্য সচিব প্রকৌশলী আবদুস সবুর বলেন, মহামারি করোনা ভাইরাসের শুরুতে ডাক্তাররা যখন চেম্বারে সরাসরি রোগীদের সেবা প্রদান করতে পারছিলেন না, তখন টেলিমেডিসিন সেবাই একমাত্র ভরসা হয়ে উঠেছিল। এর পরই আমরা ‘জয় বাংলা টেলিমেডিসিন অ্যাপ’ নিয়ে কাজ শুরু করি। এই অ্যাপটি বাংলাদেশের চিকিৎসা খাতে একটি নতুন অধ্যায় যুক্ত করবে। ‘জয় বাংলা টেলিমেডিসিন অ্যাপে’র মাধ্যমে রোগীরা চিকিৎকদের সঙ্গে ভিডিও কলের মাধ্যমে যোগাযোগ করতে পারবেন এবং প্রয়োজনীয় চিকিৎসা সেবা গ্রহণ করতে পারবেন।এছাড়াও অ্যাপে ক্যাটাগরিভিত্তিক বিশেষজ্ঞ ডাক্তারের তালিকা, এপয়েন্টমেন্ট সিস্টেম, মেডিকেল রেকর্ড আপলোড, প্রোফাইল ম্যানেজমেন্ট ইত্যাদি সুবিধা রয়েছে। অ্যাপে একটি ইন্টারেক্টিভ সোশ্যাল মিডিয়া সংযুক্ত করা হয়েছে। অ্যাপে রোগীদের তথ্য সংরক্ষিত থাকবে, ফলে এই তথ্য পরবর্তীতে রোগ নিয়ন্ত্রণে গবেষণার কাজে ব্যবহার করা যাবে। অ্যাপটি বর্তমানে এন্ড্রয়েড সংস্করণে রয়েছে। আশা করছি শিগগিরই আইওএস সংস্করণ যুক্ত করতে পারব।অনুষ্ঠানটি অনুষ্ঠানটি সরাসরি প্রচারিত হবে আওয়ামী লীগের অফিসিয়াল ফেসবুক পেইজ https://www.facebook.com/awamileague.1949 এবং অফিসিয়াল ইউটিউব চ্যানেলে https://www.youtube.com/user/myalbd. এছাড়া দৈনিক যুগান্তরসহ আরো কয়েকটি গণমাধ্যমের ফেসবুক পেজে সরাসরি প্রচারিত হবে।",21/9/2020,politics
আওয়ামী লীগ পৌর নির্বাচনে ত্যাগীদের মূল্যায়ন করবে,"করোনাভাইরাসের ধাক্কা শেষ না হতেই নির্বাচনী ব্যস্ততা বেড়েছে আওয়ামী লীগে। জাতীয় সংসদের শূন্য হওয়া ৫ আসনের উপনির্বাচনের সঙ্গে ডিসেম্বরে অনুষ্ঠেয় সারা দেশের পৌরসভা নির্বাচনের প্রস্তুতি শুরু করেছে দলটি।



তবে দলীয় না জোটগতভাবে নির্বাচনে অংশ নেবে- তা এখনও চূড়ান্ত হয়নি। তফসিল ঘোষণার পর জোটের বৈঠকে এটি চূড়ান্ত করা হবে। যদিও এ মুহূর্তে দলীয়ভাবেই যাবতীয় প্রস্তুতি নিচ্ছে ক্ষমতাসীনরা।পাশাপাশি আওয়ামী লীগ নেতৃত্বাধীন ১৪ দলীয় জোটের শরিকরাও পিছিয়ে নেই। আলাদাভাবে প্রাথমিক প্রস্তুতি শুরু করেছে জোটভুক্ত দলগুলো।তবে জোটগত বা দলীয়ভাবে যেটিই হোক না কেন- প্রার্থী মনোনয়নে তৃণমূলের জনপ্রিয়, ত্যাগী এবং দায়িত্ব পালনে সক্ষম- এমন নেতাদের মনোনয়ন দেয়া হবে এমনটি নিশ্চিত করেছেন আওয়ামী লীগের নীতিনির্ধারকরা। দলীয় সূত্রে জানা গেছে, বিগত সময়ের মতো এবারও স্থানীয় সরকার নির্বাচন ঘিরে সারা দেশে আওয়ামী লীগের প্রার্থীর ছড়াছড়ি। বিভিন্নভাবে নিজেদের উপস্থিতি জানান দিচ্ছেন তারা।পোস্টার-ব্যানারের পাশাপাশি সামাজিক যোগাযোগ মাধ্যমেও সরব মনোনয়নপ্রত্যাশীরা। স্থানীয় দলীয় সংসদ সদস্য ও নেতাকর্মীদের সঙ্গেও সখ্য বাড়ানোর চেষ্টা করছেন তারা। মনোনয়নের আশায় দৌড়-ঝাঁপ শুরু করেছেন কেন্দ্রীয় নেতা-মন্ত্রীদের বাসা-অফিসেও। জানতে চাইলে আওয়ামী লীগের প্রেসিডিয়াম সদস্য লে. কর্নেল (অব.) মুহাম্মদ ফারুক খান রোববার বিকালে যুগান্তরকে বলেন, গণতান্ত্রিক দেশে নির্বাচন চলমান প্রক্রিয়া। এরই ধারাবাহিকতায় সামনে পৌরসভা নির্বাচন হবে। গণমানুষের দল আওয়ামী লীগ সব সময় নির্বাচনের জন্য প্রস্তুত।এ নির্বাচনগুলোকে সামনে রেখেও আমাদের প্রস্তুতি রয়েছে। তিনি আরও বলেন, পৌরসভা নির্বাচনে আমাদের দলের তৃণমূলের জনপ্রিয়, সংগঠনের সঙ্গে সুসম্পর্ক রয়েছে এবং দায়িত্ব পালনে সক্ষম- এমন নেতাদেরই দলীয় মনোনয়ন বা সমর্থন দেয়া হবে।আওয়ামী লীগ সব সময় ত্যাগীদের মূল্যায়ন করে। স্থানীয় সরকার নির্বাচনগুলোতেও ত্যাগীদেরই মূল্যায়ন করা হবে। যাদের বিরুদ্ধে অভিযোগ বা বিতর্ক রয়েছে তাদের দলীয় মনোনয়ন দেয়া হবে না বলেও জানান তিনি।উপনির্বাচন বা স্থানীয় সরকার নির্বাচন দলগতভাবেই করে থাকে ১৪ দলীয় জোটের শরিকরা। আসন্ন পৌরসভা নির্বাচনেও দলগতভাবে নির্বাচনী প্রস্তুতি নিচ্ছেন তারা। দলীয় মনোনয়ন ও প্রার্থী বাছাই থেকে শুরু করে অন্যান্য কাজও আলাদাভাবেই করা হবে।তবে কোথাও জোটের শক্ত প্রার্থী থাকলে সেখানে মূল দল আওয়ামী লীগের কাছে ছাড় চাইবেন শরিক দলের নেতারা। নির্বাচনকালীন সেই বিষয়গুলো আলোচনা করে সিদ্ধান্ত নেয়া হবে।জানতে চাইলে ১৪ দলের অন্যতম শরিক বাংলাদেশের ওয়ার্কার্স পার্টির সভাপতি রাশেদ খান মেনন রোববার বিকালে যুগান্তরকে বলেন, এবার তো এ স্থানীয় সরকার নির্বাচনগুলো দলীয়ভাবে, দলীয় প্রতীকে অনুষ্ঠিত হবে।আমরাও দলীয়ভাবেই নির্বাচনের প্রস্তুতি নিচ্ছি। তবে কোনো জায়গায় কোনো শরিক দলের শক্তিশালী প্রার্থী থাকলে, সেটা আওয়ামী লীগসহ অন্য শরিকদের সঙ্গে আলোচনা করে সিদ্ধান্ত নেয়া হবে। স্থানীয় সরকার নির্বাচন সামনে রেখে দলীয় নেতাকর্মীদের প্রস্তুতি নিতে বলেছে জাতীয় সমাজতান্ত্রিক দল (জাসদ)। দলটির সাধারণ সম্পাদক শিরীন আখতার যুগান্তরকে বলেন, নির্বাচনের প্রস্তুতি নিতে আমাদের দলীয় নেতাকর্মীদের নির্দেশনা দিয়েছি।দলগতভাবে প্রস্তুতি নিচ্ছি। এক প্রশ্নের উত্তরে তিনি বলেন, স্থানীয় সরকার নির্বাচন সাধারণত জোটগত হয় না। তবে এখনও যেহেতু সময় আছে সমমনা রাজনৈতিক দলগুলোর মধ্যে বোঝাপড়া হতে পারে। খোঁজ নিয়ে জানা গেছে, দীর্ঘদিন ক্ষমতায় থাকায় বিগত সময়ের মতো এবারও সারা দেশে আওয়ামী লীগের দলীয় মনোনয়ন প্রত্যাশীর সংখ্যা অনেক বেশি।পৌরসভা নির্বাচনকে সামনে রেখে ইতোমধ্যে প্রতিটির বিপরীতে অন্তত ৩ থেকে ৫ জন দলীয় মনোনয়নপ্রত্যাশী বিভিন্নভাবে প্রচারণা শুরু করেছেন।২৩ বঙ্গবন্ধু এভিনিউয়ের আওয়ামী লীগ কেন্দ্রীয় কার্যালয় এবং দলীয় সভাপতির ধানমণ্ডির রাজনৈতিক কার্যালয়েও আসা-যাওয়া বাড়িয়ে দিয়েছেন তারা। সুযোগ পেলেই কেন্দ্রীয় নেতাদের কাছে গিয়ে বলছেন নিজেদের প্রার্থিতার কথা। জানতে চাইলে আওয়ামী লীগের প্রেসিডিয়াম সদস্য আবদুর রহমান রোববার বিকালে যুগান্তরকে বলেন, পৌরসভা নির্বাচনকে ঘিরে আমাদের প্রস্তুতি রয়েছে। এ নির্বাচনে তৃণমূলের ত্যাগী ও যোগ্যদেরই দলীয় মনোনয়ন দেয়া হবে।তিনি আরও বলেন, আর যারা দলের সিদ্ধান্তের বাইরে যাবেন বা বিদ্রোহী প্রার্থী হবেন তাদের বিষয়ে এবার আমরা সতর্ক। কারণ অন্যান্য বছরের চেয়ে এবারের প্রেক্ষাপট ভিন্ন। এবার আমাদের বিরোধী রাজনৈতিক দলগুলোও নির্বাচনে আসছে। এদিকে বিগত সময়ের স্থানীয় সরকার নির্বাচনগুলো পর্যালোচনা করে দেখা গেছে, আওয়ামী লীগের তৃণমূলে নির্বাচন ঘিরে ব্যাপক বিভক্তি তৈরি হয়।অনেক জায়গায় স্থানীয় সংসদ সদস্য, জেলা, উপজেলা ও ইউনিয়ন আওয়ামী লীগ নেতারা একে অপরের মুখোমুখি অবস্থান নেন। বিদ্রোহী প্রার্থীদের সমর্থনও দেন অনেকেই।মনোনয়ন পাওয়া ব্যক্তিদের বিরুদ্ধে দলের নেতারাই হাজারও অভিযোগ তোলেন। সর্বশেষ ২০১৬ সালের ইউনিয়ন পরিষদ নির্বাচনকে ঘিরেই দলীয় সভাপতির ধানমণ্ডির রাজনৈতিক কার্যালয়ে কয়েকশ’ অভিযোগ জমা পড়েছিল।সে সময় বঞ্চিতদের অভিযোগ গ্রহণের জন্য জেলাভিত্তিক ফাইলও তৈরি করা হয়েছিল।জানতে চাইলে আওয়ামী লীগের যুগ্ম সাধারণ সম্পাদক আ ফ ম বাহাউদ্দিন নাছিম রোববার বিকালে যুগান্তরকে বলেন, বাংলাদেশ আওয়ামী লীগ সব সময়ই নির্বাচনমুখী দল।সামনে পৌরসভা নির্বাচন। এ নির্বাচন অত্যন্ত গুরুত্বপূর্ণ। এ নির্বাচনে আমাদের স্থানীয় সরকার নির্বাচন মনোনয়ন বোর্ড দলের তৃণমূলের ত্যাগী ও যোগ্য নেতাদের মনোনয়ন দেবে।যারা দলের জন্য নিবেদিত এবং যে কোনো বিপদে-আপদে মানুষের পাশে দাঁড়ান এমন জনপ্রিয় নেতাদেরই মনোনয়ন দেয়া হবে।
",21/9/2020,politics
খালেদা জিয়ার ৪ মামলার স্থগিতাদেশ আপিলেও বহাল,"দুর্নীতির দুই মামলায় দণ্ডিত বিএনপি চেয়ারপারসন খালেদা জিয়ার বিরুদ্ধে থাকা নাশকতার তিন ও মানহানির এক মামলার কার্যক্রমের ওপর হাইকোর্টের দেয়া স্থগিতাদেশ বহাল রেখেছেন আপিল বিভাগ। একইসঙ্গে অগ্রাধিকার ভিত্তিতে হাইকোর্টের রুল শুনানি করতে বলা হয়েছে।



মামলাগুলো সচল চেয়ে রাষ্ট্রপক্ষের আবেদনের শুনানি শেষে রোববার বিচারপতি ইমান আলীর নেতৃত্বাধীন তিন সদস্যের আপিল বিভাগ এ আদেশ দেন। আদালতে রাষ্ট্রপক্ষে শুনানিতে ছিলেন অতিরিক্ত অ্যাটর্নি জেনারেল মমতাজ উদ্দিন ফকির। আর খালেদা জিয়ার পক্ষে শুনানিতে ছিলেন ব্যারিস্টার মাহবুব উদ্দিন খোকন।খালেদা জিয়ার আইনজীবী ব্যারিস্টার এহসানুর রহমান গণমাধ্যমকে এই তথ্য নিশ্চিত করেন।এর আগে ২০১৪ সালের নির্বাচনের আগে ও পরে গাড়ি ভাঙচুরসহ অগ্নিসংযোগের অভিযোগে খালেদা জিয়াকে হুকুমের আসামি করে নাশকতার মামলাগুলো দায়ের করা হয়। রাজধানীর দারুস সালাম থানায় নাশকতার অভিযোগে তিনটি এবং মুক্তিযুদ্ধে শহীদদের সংখ্যা নিয়ে বিরূপ মন্তব্যের অভিযোগ পৃথক আরেকটি মামলা হয়। এসব মামলা স্থগিত চেয়ে খালেদা জিয়ার পক্ষে হাইকোর্টে আবেদন জানানো হলে তা মঞ্জুর করা হয়। একইসঙ্গে মামলার স্থগিতের বিষয়ে রুল জারি করেন হাইকোর্ট। পরে হাইকোর্টের আদেশের বিরুদ্ধে আপিল বিভাগে আবেদন জানায় রাষ্ট্রপক্ষের আইনজীবীরা। প্রসঙ্গত, এই চার মামলাসহ খালেদা জিয়ার বিরুদ্ধে থাকা মামলাগুলোর মধ্যে মোট ১১ মামলার কার্যক্রমের ওপর স্থগিতাদেশ বহাল রাখলেন আপিল বিভাগ।",21/9/2020,politics
