সৌদি নারীদের জন্য ডিজিটাল কলেজ চালু,"নারী শিক্ষার্থীদের জন্য প্রথমবারের মতো দুটি ডিজিটাল কলেজ চালু করেছে সৌদি সরকার।



আরব নিউজের প্রতিবেদন থেকে জানা গেছে, নারীদের আধুনিক প্রযুক্তিবিষয়ক কাজে সম্পৃক্ত করতে বুধবার দেশটির শিক্ষামন্ত্রী হামাদ আল শেখ রাজধানী রিয়াদ ও জেদ্দায় ডিজিটাল কলেজ দুটির উদ্বোধন করেন।আরব নিউজের প্রতিবেদনে বলা হয়েছে, সৌদি আরবে এই প্রথম কেবল নারীদের প্রযুক্তিবিষয়ক শিক্ষা দানের জন্য ডিজিটাল কলেজ স্থাপন করা হল।এখানের প্রযুক্তিবিষয়ক নানা বিষয়ে অনার্স ও ডিপ্লোমা ডিগ্রি নেয়ার ব্যবস্থা থাকবে।নেটওয়ার্ক সিস্টেম ম্যানেজমেন্ট, মিডিয়া টেকনোলজি, সফটওয়ার, স্মার্ট সিটি, রোবটিকস টেকনোলজি, আর্টিফিসিয়াল ইন্টেলিজেন্টস, মেশিন লার্নিংসহ নানা বিষয় থাকবে কলেজ দুটিতে।",19/9/2020,international
কাতারকে নন-ন্যাটো মিত্রের মর্যাদা দিতে যাচ্ছে আমেরিকা,"ইসরাইলের সঙ্গে সম্পর্ক স্বাভাবিকে মধ্যপ্রাচ্যের দেশ সংযুক্ত আরব আমিরাত (ইউএই) ও বাহরাইনের সঙ্গে চুক্তির পর এবার কাতারকে নন-ন্যাটো মিত্র হিসেবে মর্যাদা দিতে যাচ্ছে আমেরিকা। আলজাজিরা।



নন-ন্যাটোর মিত্র হিসেবে ওয়াশিংটনের সঙ্গে প্রতিরক্ষা, নিরাপত্তা ও সুরক্ষাবিষয়ক সহযোগিতায় পারস্পরিক সম্পর্ক গড়ে উঠবে দোহার।একটি কনফারেন্স কলে উপসাগরীয় অঞ্চলের মার্কিন ডেপুটি অ্যাসিস্ট্যান্ট সেক্রেটারি টিমোথি লেন্ডারকিং বলেন, ‘কাতারকে গুরুত্বপূর্ণ নন-ন্যাটো মিত্র হিসেবে আমরা আশা করছি। বিষয়টি নিয়ে আমরা এগোচ্ছি।’মার্কিন পররাষ্ট্রমন্ত্রী মাইক পম্পেও এবং কাতারের পররাষ্ট্রমন্ত্রী শেখ মোহাম্মদ বিন আবদুল রহমান আল থানিসহ দুই দেশের গুরুত্বপূর্ণ কর্মকর্তারাএ সপ্তাহের শুরুতে ওয়াশিংটন ডিসিতে মিলিত হতে যাচ্ছেন বলে জানা গেছে। সামরিক ক্ষেত্রে নন-ন্যাটো মিত্র দেশগুলো (এমএনএনএ) যুক্তরাষ্ট্র থেকে যেসব সুবিধা পায় কাতারও সেটির অন্তর্ভুক্ত হবে। ",19/9/2020,international
ফিলিস্তিন সমস্যার সমাধান ছাড়া মধ্যপ্রাচ্যে শান্তি আসবে না: রাশিয়া,"রাশিয়া বলেছে, ইসরাইলি-ফিলিস্তিনি সংঘাতের অবসান ছাড়া মধ্যপ্রাচ্যে স্থায়ী শান্তি প্রতিষ্ঠার চিন্তা করা হবে ভুল।



মঙ্গলবার হোয়াইট হাউসে দীর্ঘ দিনের শত্রু দেশ বাহরাইন ও সংযুক্ত আরব আমিরাতের সঙ্গে ইসরাইলের সম্পর্ক স্বাভাবিক করার পর রাশিয়ার পররাষ্ট্র মন্ত্রণালয়ের বিবৃতিতে একথা বলা হয়।-খবর এএফপিররাশিয়া জানায়, এমন চুক্তির ফলে ইসরাইল ও আরব বিশ্বের অনেক দেশের মধ্যে সম্পর্ক স্বাভাবিক করার ক্ষেত্রে অগ্রগতি হলেও ফিলিস্তিন সমস্যা এখনো চরম পর্যায়ে রয়েছে। তারা জানায়, ফিলিস্তিন সমস্যার সমাধান খুঁজে বের করা ছাড়া মধ্যপ্রাচ্যের স্থায়ী স্থিতিশীলতা অর্জনের ক্ষেত্রে এটি একটি ভুল সিদ্ধান্ত হবে। 
মস্কো এ সংকট সমাধানের সমন্বিত প্রচেষ্টা জোরদারে আঞ্চলিক ও আন্তর্জাতিক নেতাদের প্রতি আহ্বান জানিয়েছে।পররাষ্ট্র মন্ত্রণালয়ের বিবৃতিতে বলা হয়, রাশিয়া এ ধরনের যৌথ প্রচেষ্টা চালানোর জন্য প্রস্তুত রয়েছে।এদিকে হোয়াইট হাউসের চিফ অব স্টাফ মার্ক মিডোসও বলেছেন, ইসরাইলের সঙ্গে সম্পর্ক স্বাভাবিকীকরণ করতে আরও পাঁচটি দেশ গুরুত্বসহকারে বিবেচনা করছে।এর আগে চলতি সপ্তাহে দখলদার রাষ্ট্রটির সঙ্গে শান্তি চুক্তি করেছে সংযুক্ত আরব আমিরাত ও বাহরাইন। বার্তা সংস্থা রয়টার্সের খবরে এমন তথ্য পাওয়া গেছে।বৃহস্পতিবার এয়ার ফোর্স ওয়ানে সাংবাদিকদের সঙ্গে আলাপকালে তিনি এসব তথ্য দিলেও সেই পাঁচটি দেশ নিয়ে বিস্তারিত কোনো বক্তব্য দেননি।উইসকনসিনে নির্বাচনী প্রচারে যোগ দিতে মার্কিন প্রেসিডেন্ট ডোনাল্ড ট্রাম্পকে বহন করে নিয়ে যাচ্ছিল এয়ার ফোর্স ওয়ান।মিডোস বলেন, তিনটি দেশই ওই অঞ্চলের। কিন্তু এর বেশি কিছু তিনি বলতে অস্বীকার করেন।আরও অনেক দেশ ইসরাইলের সঙ্গে সম্পর্ক স্বাভাবিক করতে চায় বলে আশাবাদ ব্যক্ত করেন ট্রাম্প। তবে সম্ভাব্য এসব দেশের মধ্যে ওমান একটি।দেশটির রাষ্ট্রদূত মঙ্গলবার হোয়াইট হাউসে ইসরাইলের সঙ্গে আমিরাতের শান্তি চুক্তির অনুষ্ঠানে উপস্থিত ছিলেন।সৌদি আরবও অবৈধ রাষ্ট্রটির সঙ্গে সম্পর্ক স্থাপনে অবশেষে রাজি হয়েছে বলে জানিয়েছেন ট্রাম্প।",19/9/2020,international
আরব বিশ্বাসঘাতকরা ইসরাইলের রক্তমাখা হাতে চুমু খাচ্ছে: ইরান ,"ফিলিস্তিনিদের সঙ্গে বিশ্বাসঘাতকতা করে ইহুদিবাদী ইসরাইলের সঙ্গে সম্পর্ক প্রতিষ্ঠার জন্য বাহরাইন ও সংযুক্ত আরব আমিরাতের নেতাদের একহাত নিয়েছে ইরান। দেশটির জাতীয় সংসদের স্পিকার বাকের কলিবফ বলেছেন, ইসরাইলের সঙ্গে সম্পর্ক স্বাভাবিক করার মাধ্যমে এসব আরব দেশ দখলদার ইসরাইলের অপরাধযজ্ঞে সহযোগিতা করছে।



বৃহস্পতিবার এক বিবৃতিতে বাকের কলিবফ বলেন, আল্লাহ ও মুসলমানদের শত্রুর সঙ্গে বন্ধুত্বের হাত বাড়ানোর ফলে আরব রাষ্ট্রগুলো অপমান ও দুর্দশা ছাড়া কিছুই পাবে না। তিনি আরব দেশগুলোকে এ ধরনের কর্মকাণ্ডের পরিণতির ভোগের ব্যাপারেও হুঁশিয়ার করেন।কলিবফ বলেন, মধ্যপ্রাচ্য, টেলিভিশন ও ইলেকশন শো-তে কী ঘটছে তা বিশ্ববাসীর কাছে বিশেষ করে মুসলিম উম্মাহ,আরব তরুণ ও নির্যাতিত ফিলিস্তিনিদের কাছে মোটেই নতুন কিছু নয়। কয়েক বছর ধরে আঞ্চলিক কয়েকটি সরকার ইহুদিবাদী সরকারের রক্তমাখা হাতে চুমু খাচ্ছে এবং নির্যাতিত ফিলিস্তিনি জনগণের মুখে আঁচড় কাটছে।তিনি বলেন, আরব বিশ্বাসঘাতকরা ফিলিস্তিনিদের জন্য আরেকটি নাকাবা দিবসের জন্ম দিয়েছে।
",19/9/2020,international
‘ইসরাইলের সঙ্গে সম্পর্ক স্থাপন করতে যাচ্ছে আরও ৫ দেশ’,"হোয়াইট হাউসের চিফ অব স্টাফ মার্ক মিডোসও বলেছেন, ইসরাইলের সঙ্গে সম্পর্ক স্বাভাবিকীকরণ করতে আরও পাঁচটি দেশ গুরুত্বসহকারে বিবেচনা করছে।



এর আগে চলতি সপ্তাহে দখলদার রাষ্ট্রটির সঙ্গে শান্তি চুক্তি করেছে সংযুক্ত আরব আমিরাত ও বাহরাইন। বার্তা সংস্থা রয়টার্সের খবরে এমন তথ্য পাওয়া গেছে।বৃহস্পতিবার এয়ার ফোর্স ওয়ানে সাংবাদিকদের সঙ্গে আলাপকালে তিনি এসব তথ্য দিলেও সেই পাঁচটি দেশ নিয়ে বিস্তারিত কোনো বক্তব্য দেননি।উইসকনসিনে নির্বাচনী প্রচারে যোগ দিতে মার্কিন প্রেসিডেন্ট ডোনাল্ড ট্রাম্পকে বহন করে নিয়ে যাচ্ছিল এয়ার ফোর্স ওয়ান।মিডোস বলেন, তিনটি দেশই ওই অঞ্চলের। কিন্তু এর বেশি কিছু তিনি বলতে অস্বীকার করেন।আরও অনেক দেশ ইসরাইলের সঙ্গে সম্পর্ক স্বাভাবিক করতে চায় বলে আশাবাদ ব্যক্ত করেন ট্রাম্প। তবে সম্ভাব্য এসব দেশের মধ্যে ওমান একটি। দেশটির রাষ্ট্রদূত মঙ্গলবার হোয়াইট হাউসে ইসরাইলের সঙ্গে আমিরাতের শান্তি চুক্তির অনুষ্ঠানে উপস্থিত ছিলেন।সৌদি আরবও অবৈধ রাষ্ট্রটির সঙ্গে সম্পর্ক স্থাপনে অবশেষে রাজি হয়েছে বলে জানিয়েছেন ট্রাম্প।",19/9/2020,international
এবার নোবেল শান্তি পুরস্কারের জন্য মনোনয়ন পেলেন নেতানিয়াহু,"মার্কিন প্রেসিডেন্ট ডোনাল্ড ট্রাম্পের পর এবার নোবেল শান্তি পুরস্কারের জন্য মনোনয়ন পেলেন ইসরাইলের প্রধানমন্ত্রী বেঞ্জামিন নেতানিয়াহু।



সম্পর্ক স্বাভাবিকীকরণে সংযুক্ত আরব আমিরাত ও বাহরাইনের সঙ্গে বহুল বিতর্কিত এক চুক্তির নোবেল পুরস্কারের জন্য তার নাম প্রস্তাব করেছেন ইতালির এক এমপি।বুধবার ইতালীয় সংসদ সদস্য পাওলো গ্রিমোলদি চলতি বছরের নোবেল শান্তি পুরস্কারের জন্য নেতানিয়াহুর নাম প্রস্তাব করেন। ইতালির অভিবাসী বিরোধী দল অ্যান্টি-মাইগ্রেন্ট লিগ পার্টির সদস্য গ্রিমোলদি ইহুদি ঘনিষ্ঠ বন্ধু বলে পরিচিত। খবর ব্লুমবার্গের।ইতালির এ সংসদ সদস্য এক টুইটার বার্তায় জানান, নোবেল কমিটি তার প্রস্তাব গ্রহণ করেছে বলে নিশ্চিত হয়েছেন তিনি।প্রস্তাবে গ্রিমোলদি দাবি করেছেন, আমিরাত-বাহরাইনের সঙ্গে ইসরাইলের চুক্তি ছাড়াও সৌদি আরবের সঙ্গে বন্ধন সুদৃঢ় করেছেন নেতানিয়াহু। এজন্য শান্তিতে তার নোবেল পুরস্কার পাওয়া উচিত।পৃথক আরেকটি টুইটে পাওলো গ্রিমোলদি জানিয়েছেন, ডোনাল্ড ট্রাম্পের সঙ্গে নেতানিয়াহু যৌথভাবে নোবেল পুরস্কার পাবেন বলে আশা করছেন তিনি।এর আগে, গত সপ্তাহে নোবেল শান্তি পুরস্কারের জন্য মনোনীত হন মার্কিন প্রেসিডেন্ট ট্রাম্প। সংযুক্ত আরব আমিরাতের সঙ্গে ইসরাইলের শান্তিচুক্তিতে মধ্যস্থতা করে তিনি এ পুরস্কারের জন্য মনোনয়ন পেয়েছেন।নরওয়ের রাজনীতিবিদ টিব্রিং-জেড্ডে পুরস্কারের জন্য ট্রাম্পের নাম প্রস্তাব করেন বলে জানিয়েছে আন্তর্জাতিক সংবাদমাধ্যমগুলো।প্রতি বছর বিভিন্ন দেশের আইনপ্রণেতা, সরকারের সদস্য ও শিক্ষাবিদরা নোবেল পুরস্কারের জন্য শত শত ব্যক্তির নাম প্রস্তাব করেন। সাধারণত অক্টোবরে পুরস্কারবিজয়ী ব্যক্তি বা প্রতিষ্ঠানের নাম ঘোষণা করে নরওয়েজিয়ান নোবেল কমিটি।",19/9/2020,international
‘মধ্যপ্রাচ্যে ইহুদিদের হস্তক্ষেপ বিপজ্জনক হবে’,"মধ্যপ্রাচ্যে ইহুদিবাদী রাষ্ট্র ইসরাইলের হস্তক্ষেপ বিপজ্জনক হবে এবং এই ক্ষতির দায়ভার সম্পর্ক স্থাপনকারীদেরকেই নিতে হবে বলে হুশিয়ার করেছে ইরান।



সংযুক্ত আরব আমিরাত, বাহরাইন এবং ইসরাইলের মধ্যকার সম্পর্কের বিষয়ে দেশটির সরকারি মুখপাত্র আলী রাবেই এক সংবাদ সম্মেলনে এ হুশিয়ারি দিয়েছেন। তিনি অভিযোগ করে বলেন, ইহুদিবাদী ইসরাইলের সঙ্গে সম্পর্ক স্থাপনে আরব দেশগুলোকে বাধ্য করতে শক্তি প্রয়োগ করছে যুক্তরাষ্ট্র। 

মঙ্গলবার হোয়াইট হাউসে ট্রাম্পের উপস্থিতিতে ইসরাইলের সঙ্গে বিতর্কিত এক চুক্তিতে স্বাক্ষর করে আমিরাত ও বাহরাইন। এ চুক্তিকে ‘মধ্যপ্রাচ্যে নতুন ভোর’ হিসেবে আখ্যা দিয়েছেন ট্রাম্প। এটাকে ‘শান্তি চুক্তি’ অভিহিত করে ইসরাইলি প্রধানমন্ত্রী বেনিয়ামিন নেতানিয়াহু বলেন, ‘এই দিনটি ইতিহাস পরিবর্তনের ক্ষণ, শান্তির নতুন দিগন্তের সূচনা।’ কিন্তু এই চুক্তিকে ‘পিঠে ছুরির মারা’র সঙ্গে তুলনা করে এর কঠোর নিন্দা জানিয়েছে ফিলিস্তিন।
",19/9/2020,international
এবার শান্তিতে নোবেলের জন্য মনোনয়ন পেলেন নেতানিয়াহু,"এবার শান্তিতে নোবেল পুরস্কারের জন্য মনোনয়ন পেলেন অবৈধ রাষ্ট্র ইসরাইলের প্রধানমন্ত্রী বেনিয়ামিন নেতানিয়াহু। সংযুক্ত আরব আমিরাত ও বাহরাইনের সঙ্গে সম্পর্ক স্বাভাবিকীরণের জন্য চুক্তি করায় তাকে এই মনোনয়ন দেয়া হয়েছে। এর আগে ইসরাইলের সঙ্গে আরব বিশ্বের সম্পর্ক উন্নয়নের সহযোগিতার জন্য মার্কিন প্রেসিডেন্ট ডোনাল্ড ট্রাম্পকে মনোনয়ন দেয়া হয়।



মার্কিন সংবাদমাধ্যম ব্লুমবার্গ জানায়, মঙ্গলবার হোয়াইট হাউজে ওই ঐতিহাসিক চুক্তি স্বাক্ষর হয়। গত বুধবার ইতালীয় সংসদ সদস্য ও অ্যান্টি মাইগ্রেন্ট লিগ পার্টির নেতা পাওলো গ্রিমোলদি এ বছর শান্তিতে নোবেল পুরস্কারের জন্য নেতানিয়াহুর নাম প্রস্তাব করেন।ইসরাইলের সাবেক যোগাযোগমন্ত্রী ও নেতানিয়াহুর লিকুড পার্টির নেতা আয়ুব কারা এক টুইট বার্তায় জানিয়েছেন, সংস্থাটির প্রধান বাহরাইন ও আমিরাতের সঙ্গে সম্পর্ক স্বাভাবিক করায় নোবেল শান্তি পুরস্কারের জন্য মনোনীত হয়েছেন। জেরুজালেম পোস্ট বলছে, ইতালির সংসদ সদস্য ইসরাইলিদের ঘনিষ্ঠ বন্ধু বলে পরিচিত। তিনি বহুবার ইসরাইল সফরে গিয়েছেন, যদিও নেতানিয়াহুর সঙ্গে তার কখনও সাক্ষাৎ হয়নি।",19/9/2020,international
