বরিশালে বৃষ্টিতে জলাবদ্ধতা,"বরিশালে টানা বৃষ্টিতে ব্যাপক জলাবদ্ধতার সৃষ্টি হয়েছে। তাছাড়া বৃষ্টির কারণে ভোগান্তিতে পড়েছে সাধারণ মানুষ।



সোমবার সকাল থেকেই গুঁড়ি গুঁড়ি বৃষ্টি শুরু হয় বরিশালে। টানা বৃষ্টির কারণে নগরীর পলাশপুর, আমানতগঞ্জ, বগুড়া রোড এলাকাসহ বিভিন্ন এলাকায় বৃষ্টির পানি জমে জলাবদ্ধতা ও জনভোগান্তির সৃষ্টি হয়।বরিশাল আবহাওয়া অফিসের সিনিয়র পর্যবেক্ষক প্রণব কুমার রায় বলেন, সোমবার সন্ধ্যা ৬টা পর্যন্ত গত ২৪ ঘণ্টায় ৫৯ দশমিক ৪ মিলিমিটার বৃষ্টিপাত রেকর্ড করা হয়েছে এবং বাতাসের সর্বোচ্চ গতিবেগ ছিল ৩০ কিলোমিটার। সাগরে লঘুচাপ হওয়ায় আরও বৃষ্টিপাত হওয়ার আশঙ্কা রয়েছে বলে জানান এই কর্মকর্তা।",22/9/2020,various
চট্টগ্রামে দোকান কর্মচারীকে পিটিয়ে হত্যা,"নগরীর রিয়াজউদ্দিন বাজারে টাকা চুরির অভিযোগে সোমবার বিকেলে রমজান আলী রাসেল নামে এক দোকান কর্মচারীকে পিটিয়ে হত্যা করা হয়েছে। রাসেলের বাসা সদরঘাট থানার আইস ফ্যাক্টরি রোড এলাকায়। বাবার নাম আফাজ আলী। তার বাড়ি নরসিংদী জেলায়। এ ঘটনায় দোকান মালিকের ভাই আরমান হোসেন ও দোকান কর্মচারী ইউনুসকে গ্রেফতার করেছে কোতোয়ালি থানা পুলিশ। তবে দোকানের মালিক আরাফাত পালিয়ে গেছে।



পুলিশ জানায়, রিয়াজউদ্দিন বাজারের পানবাজার সংলগ্ন আরাফাত স্টোরে চাকরি করতেন রাসেল। সোমবার দোকানের পণ্যের হিসাব করা হচ্ছিল। সেখানে গুঁড়ো দুধের কার্টন কম পাওয়া যায়। দোকান মালিক আরাফাতের ধারণা দোকান কর্মচারী রমজান আলী রাসেল চুরি করে গুঁড়ো দুধ বিক্রি করে টাকা মেরে দিয়েছে। এ নিয়ে দুপুরে গুদামে সালিশ বসে। সদরঘাটের বাসা থেকে রাসেলের বাবা-মাকেও ডেকে আনা হয়। সালিশের একপর্যায়ে রাসেলকে লাঠি দিয়ে মারধর করা হয়। খবর পেয়ে পুলিশ তাকে উদ্ধার করে চট্টগ্রাম মেডিকেল কলেজ হাসপাতালে প্রেরণ করলে চিকিৎসকরা মৃত ঘোষণা করেন।কোতোয়ালি জোনের এসি নোবেল চাকমা যুগান্তরকে বলেন, দোকান কর্মচারীকে পিটিয়ে হত্যার ঘটনায় দু’জনকে গ্রেফতার করা হয়েছে। জড়িত সবাইকে গ্রেফতার করা হবে। মালিককে গ্রেফতারেও অভিযান চলমান রয়েছে। এ ঘটনায় এখনও মামলা হয়নি।",22/9/2020,various
খুলনায় মেডিকেল বিশ্ববিদ্যালয় হচ্ছে,"খুলনায় হচ্ছে শেখ হাসিনা মেডিকেল বিশ্ববিদ্যালয়। এজন্য ‘শেখ হাসিনা মেডিকেল বিশ্ববিদ্যালয়, খুলনা, আইন, ২০২০’-এর খসড়া চূড়ান্ত অনুমোদন দিয়েছে মন্ত্রিসভা। এছাড়া বৈঠকে বাংলাদেশ পর্যটন কর্পোরেশন আইন-২০২০ সহ আরও দুটি অনুসমর্থনের প্রস্তাবে অনুমোদন দিয়েছে মন্ত্রিসভা। সোমবার প্রধানমন্ত্রী শেখ হাসিনার সভাপতিত্বে ভার্চুয়াল মন্ত্রিসভা বৈঠকে এ অনুমোদন দেয়া হয়। প্রধানমন্ত্রী গণভবন থেকে এবং সংশ্লিষ্ট মন্ত্রীরা সচিবালয়ে মন্ত্রিপরিষদ বিভাগ থেকে বৈঠকে যুক্ত হন। বৈঠক শেষে সচিবালয়ে সাংবাদিকদের উল্লিখিত তথ্য জানান মন্ত্রিপরিষদ সচিব খন্দকার আনোয়ারুল ইসলাম। তিনি বলেন, এর আগেও (১৩ জুলাই) এটি নীতিগত অনুমোদনের জন্য এসেছিল, তখন বিস্তারিত আলাপ-আলোচনা করে এটা অনুমোদন দেয়া হয়। লেজিসলেটিভ বিভাগের মতামত পাওয়ার পর স্বাস্থ্য শিক্ষা বিভাগ থেকে এটা চূড়ান্ত অনুমোদনের জন্য পাঠানো হয়েছে। স্নাতকোত্তর পর্যায়ে চিকিৎসা শিক্ষা ও গবেষণা এবং স্নাতক পর্যায়ে চিকিৎসা শিক্ষা কার্যক্রম পরিচালনার জন্য খুলনায় একটা মেডিকেল বিশ্ববিদ্যালয় প্রতিষ্ঠা করা প্রয়োজন। এটা প্রতিষ্ঠিত হলে খুলনা অঞ্চলের মধ্যে যত মেডিকেল কলেজ, নার্সিং ইন্সটিটিউট বা অন্য চিকিৎসা-সংক্রান্ত যেসব ইন্সটিটিউট থাকবে সবই এই খুলনা শেখ হাসিনা মেডিকেল বিশ্ববিদ্যালয়ের অধীনে চলে আসবে। এর আগে রাজশাহী, চট্টগ্রাম ও সিলেট মেডিকেল বিশ্ববিদ্যালয়ের জন্য যে আইন প্রণয়ন করা হয়েছিল এর সঙ্গে সামঞ্জস্য রেখে একই রকম আইন করা হয়েছে বলেও জানান মন্ত্রিপরিষদ সচিব।



আইনে মোট ৫৫টি ধারা রয়েছে জানিয়ে খন্দকার আনোয়ারুল ইসলাম বলেন, এতে বিশ্ববিদ্যালয় স্থাপন, এখতিয়ার এবং ক্ষমতার বিষয়ে বর্ণনা করা হয়েছে। পরিদর্শন ও আর্থিক বিষয়ে বিশ্ববিদ্যালয় মঞ্জুরি কমিশনের ভূমিকা উল্লেখ রয়েছে। বিশ্ববিদ্যালয় উপাচার্য, উপ-উপাচার্য, কোষাধ্যক্ষ, রেজিস্ট্রার, পরীক্ষা নিয়ন্ত্রক ও কর্মচারীদের নিয়োগ প্রক্রিয়া, ক্ষমতা ও দায়িত্ব বর্ণনা করা হয়েছে আইনে।রহিত হচ্ছে চিকিৎসা ডিগ্রি আইন : মন্ত্রিপরিষদ সচিব জানান, ‘চিকিৎসা ডিগ্রি (দ্য মেডিকেল ডিগ্রিস) (রহিতকরণ) আইন, ২০২০’ এর খসড়া নীতিগত অনুমোদন দিয়েছে মন্ত্রিসভা।সেইন্ট কিটস-ডোমেনিকার সঙ্গে কূটনৈতিক সম্পর্ক স্থাপন : দুই ক্যারিবীয় দ্বীপ রাষ্ট্র সেইন্ট কিটস অ্যান্ড নেভিস ও কমনওয়েলথ অব ডোমেনিকার মধ্যে কূটনৈতিক সম্পর্ক স্থাপন করতে যাচ্ছে বাংলাদেশ সরকার। এজন্য কূটনৈতিক সম্পর্ক স্থাপন সংক্রান্ত যৌথ ঘোষণাপত্রের খসড়া অনুসমর্থনের প্রস্তাব অনুমোদন দিয়েছে মন্ত্রিসভা। এ প্রসঙ্গে মন্ত্রিপরিষদ সচিব বলেন, পররাষ্ট্র মন্ত্রণালয় থেকে প্রস্তাব আনা হয়েছিল। ক্যারিবীয় দ্বীপপুঞ্জের অন্তর্গত দু’টি দ্বীপ নিয়ে সেইন্ট কিটস অ্যান্ড নেভিস একটা ছোট রাষ্ট্র। আমাদের সঙ্গে তাদের কূটনৈতিক সম্পর্ক নেই। যার ফলে আমাদের দেশের কিছু লোক ওখানে থাকে এবং কাজকর্ম করে। তাদের জন্য একটু প্রতিবন্ধকতার সম্মুখীন হতে হয়। দেশটি জাতিসংঘ, কমনওয়েলথ, আন্তর্জাতিক অপরাধ আদালত, ক্যারিবিয়ান কমিউনিটি, অর্গানাইজেশন অব ক্যারিবিয়ান স্টেটসসহ বিভিন্ন আন্তর্জাতিক সংস্থার সদস্য।",22/9/2020,various
শপথ নিলেন পিএসসির নতুন চেয়ারম্যান,"শপথ নিলেন বাংলাদেশ সরকারি কর্ম কমিশনের (পিএসসি) নতুন চেয়ারম্যান অবসরপ্রাপ্ত সিনিয়র সচিব মো. সোহরাব হোসাইন। সোমবার সুপ্রিমকোর্টের জাজেস লাউঞ্জে প্রধান বিচারপতি সৈয়দ মাহমুদ হোসেন তাকে শপথবাক্য পাঠ করান।



সুপ্রিমকোর্টের রেজিস্ট্রার জেনারেল মো. আলী আকবর অনুষ্ঠান পরিচালনা করেন। এ সময় পিএসসির বিভিন্ন পর্যায়ের কর্মকর্তা ছাড়াও উপস্থিত ছিলেন সুপ্রিমকোর্টের মুখপাত্র ও বিশেষ কর্মকর্তা মোহাম্মদ সাইফুর রহমান।সোহরাব হোসাইনকে ১৬ সেপ্টেম্বর পিএসসির চেয়ারম্যান হিসেবে নিয়োগ দেয়া হয়। ড. মোহাম্মদ সাদিকের স্থলাভিষিক্ত হলেন সোহরাব হোসাইন। পিএসসির চেয়ারম্যান একটি সাংবিধানিক পদ। সংবিধানের ১৩৮ (১) অনুচ্ছেদ অনুযায়ী রাষ্ট্রপতি চেয়ারম্যান নিয়োগ দেন। দায়িত্ব নেয়ার তারিখ থেকে পরবর্তী পাঁচ বছর বা বয়স ৬৫ বছর পূর্ণ হওয়া পর্যন্ত (যেটি আগে আসে) তিনি এ পদে দায়িত্ব পালন করবেন বলে আদেশে উল্লেখ করা হয়েছে।",22/9/2020,various
টাঙ্গাইলে এমপি তানভীর হাসান করোনায় আক্রান্ত,"টাঙ্গাইল-২ (গোপালপুর-ভূঞাপুর) আসনের সংসদ সদস্য তানভীর হাসান ছোট মনির করোনাভাইরাসে আক্রান্ত হয়েছেন। সোমবার ছোট মনিরসহ ১৭ জন নতুন করে করোনাভাইরাসে আক্রান্ত হন।



এর আগে টাঙ্গাইল-৮ (বাসাইল-সখীপুর) আসনের সংসদ সদস্য ও জেলা আওয়ামী লীগের সাধারণ সম্পাদক জোয়াহেরুল ইসলাম, টাঙ্গাইল-৭ (মির্জাপুর) আসনের সংসদ সদস্য একাব্বর হোসেন সপরিবারে করোনাভাইরাসে আক্রান্ত হয়েছিলেন। তারা এখন সুস্থ।এমপি ছোট মনির জানান, জ্বর অনুভব করায় নমুনা পরীক্ষা করে তিনি আক্রান্ত বলে জানতে পারেন। সোমবার বিকালে তিনি ঢাকার উদ্দেশ্যে রওনা হন। ঢাকায় বাংলাদেশ স্পেশালাইজড মেডিকেল হাসপাতালে ভর্তি হয়ে চিকিৎসা নেবেন বলে জানান।সর্বশেষ ২১ সেপ্টেম্বর পর্যন্ত জেলায় মোট আক্রান্ত রোগী তিন হাজার ১৭, এর মধ্যে দুই হাজার ৪১৪ জন সুস্থ হয়েছেন।",22/9/2020,various
ফেঞ্চুগঞ্জে প্রতিপক্ষকে ফাঁসাতে গিয়ে ফেঁসে গেলেন নিজেরাই,"সিলেটের ফেঞ্চুগঞ্জ উপজেলায় নিজ ঘরে আগুন দিয়ে প্রতিপক্ষকে ফাঁসাতে গিয়ে নিজেরাই ফেঁসে গেলেন। এ ঘটনায় তিনজনকে আটক করেছে পুলিশ। আটক ব্যক্তিরা হলেন- মৌলভীবাজার জেলার কুলাউড়া উপজেলার রাধানগর গ্রামের শেখ মনিরুল ইসলামের ছেলে শেখ মাহবুবুল আলম, বড় কাপন গ্রামের হাবিবুর রহমানের ছেলে মিনহাজুর রহমান ও নবীনগর গ্রামের রিয়াজ আহমদের ছেলে জাবির আহমদ নয়ন। রোববার রাতে উপজেলার ইসলামপুর গ্রামে এই ঘটনা ঘটে। জানা যায়, ইসলামপুর গ্রামের আমিরুল ইসলাম টিটুল ও ফখরুল ইসলামের মধ্যে দীর্ঘদিন ধরে বিরোধ চলছে। কয়েকদিন আগেও সংঘর্ষ হয়। এতে দু’পক্ষই থানায় মামলা করে। আমিরুল ইসলাম টিটুল প্রতিপক্ষকে ফাঁসাতে তার শ্যালক শেখ মাহবুবুল আলমকে দিয়ে নিজ ঘরে আগুন লাগিয়ে প্রতিপক্ষকে ফাঁসানোর চেষ্টা করেন। আগুন লাগানো ছাড়াও আসবাবপত্র ভাংচুর করে তা ভিডিওধারণ করা হয়। স্থানীয় লোকজন বিষয়টি ফেঞ্চুগঞ্জ থানা পুলিশকে জানান। খবর পেয়ে তাৎক্ষণিক পুলিশ ঘটনাস্থলে পৌঁছে শেখ মাহবুবুল আলম ও তার সহযোগীদের আটক করে। এ সময় পুলিশ কেরোসিনের বোতল, ব্যাগ ও মোটরসাইকেল জব্দ করে। ফেঞ্চুগঞ্জ থানার ওসি আবুল বাশার মোহাম্মদ বদরুজ্জামান জানান, সোমবার তাদেরকে আদালতে পাঠানো হয়েছে।



",22/9/2020,various
ছাত্রলীগের সশস্ত্র হামলায় যুবলীগ সদস্য রক্তাক্ত,"কলাপাড়া উপজেলার লালুয়ায় বানাতিবাজার মহল্লাপাড়া অটো স্ট্যান্ডের নিয়ন্ত্রণ প্রতিষ্ঠায় ছাত্রলীগ ক্যাডার সজিব মৃধার নেতৃত্বে হামলায় গুরুতর আহত হয়েছেন যুবলীগ সদস্য মহল্লাপাড়ার বাসিন্দা রবিউল গাজী (৩৫)। সোমবার দুপুরের দিকে ৮-১০ জনের একটি গ্রুপ রামদা ও ছুরি নিয়ে এই হামলা চালায়। রবিউলকে প্রথমে কলাপাড়া হাসপাতালে, পরে উন্নত চিকিৎসার জন্য পটুয়াখালী হাসপাতালে পাঠানো হয়েছে। রবিউল গাজীর নিয়ন্ত্রিত অটো স্ট্যান্ডের দখল নিতে এমন সশস্ত্র হামলার ঘটনা ঘটে বলে স্থানীয়রা জানিয়েছেন। রবিউলের হাতে-পায়ে কোপের জখম রয়েছে। সন্ত্রাসীরা প্রকাশ্যে রামদা, ছুরি, রড নিয়ে হামলা চালানোর সময় স্থানীয়দের মধ্যে আতঙ্ক নেমে আসে। কলাপাড়া থানার ওসি মোস্তাফিজুর রহমান জানান, পুলিশ পাঠানো হয়েছে। জড়িতদের শনাক্ত করে আইনের আওতায় আনা হবে।



",22/9/2020,various
"কাসেম শিখদার সভাপতি, দীন মোহাম্মদ সম্পাদক","বাংলাদেশ উন্মুক্ত বিশ্ববিদ্যালয়ের তথ্য ও গণসংযোগ বিভাগের পরিচালক আবুল কাসেম শিখদারকে সভাপতি এবং বাংলাদেশ কৃষি বিশ্ববিদ্যালয়ের জনসংযোগ ও প্রকাশনা দফতরের উপপরিচালক কৃষিবিদ দীন মোহাম্মদ দীনুকে সাধারণ সম্পাদক করে বাংলাদেশ পাবলিক বিশ্ববিদ্যালয় জনসংযোগ সমিতির দুই বছরমেয়াদি কার্যনির্বাহী পরিষদের ২১ সদস্যবিশিষ্ট কমিটি গঠন করা হয়েছে। অন্য কর্মকর্তারা হচ্ছেন সহ-সভাপতি মাহমুদ আলম, আহমেদ সুমন, যুগ্ম সাধারণ সম্পাদক মো. সামছুল আলম (শিবলী), কোষাধ্যক্ষ মো. জাহাঙ্গীর কবীর, বিভাগীয় সম্পাদক সাংগঠনিক মো. বশিরুল ইসলাম, দফতর বাবুল হোসেন (বাবু), প্রশিক্ষণ খলিলুর রহমান, প্রচার মোহাম্মদ আল-আমিন খান, প্রকাশনা ইফতেখার হোসাইন (রাজু), সাহিত্য ও মো. এহতেরামুল হক, ক্রীড়া মুহাম্মদ রাশেদুল ইসলাম, তথ্যপ্রযুক্তি মোহাম্মদ শহীদুল ইসলাম (শিমুল), কার্যকরী সদস্য মো. আনিসুর রহমান, মো. ফয়জুল করিম, মো. আতাউল হক, দিবাকর বড়ুয়া, মো. গোলাম মুরতুজা, মাহবুব আলম, মো. তরিকুল ইসলাম রুবেল।



",22/9/2020,various
তীরবিহীন সাগর!,"উত্তর আটলান্টিকের সারগ্যাসো সাগরই পৃথিবীর একমাত্র সাগর, যার কোনো তীর নেই। তীরের বদলে সাগরটিকে ঘিরে আছে আটলান্টিক মহাসাগরের চার ধরনের স্রোত। সাগরটির পশ্চিমে গালফ স্ট্রিম, উত্তরে আটলান্টিক কারেন্ট, পূর্বে ক্যানারি কারেন্ট এবং দক্ষিণে নর্থ-ইকুয়েটোরিয়াল কারেন্ট। চারটি স্রোতের মাঝে থাকা সারগ্যাসো সাগরের পানি স্থির ও প্রবাহহীন। তাই উত্তাল আটলান্টিক মহাসাগরের সব চেয়ে শান্ত অঞ্চল এ সাগর। এটি দৈর্ঘ্যে ৩২০০ কিলোমিটার এবং প্রস্থে ১১০০ কিলোমিটার।



",22/9/2020,various
