রাশিয়াকে ঠেকাতে সিরিয়ায় সেনা বাড়াচ্ছে যুক্তরাষ্ট্র,"যুদ্ধবিধস্ত সিরিয়ায় নতুন করে সেনা মোতায়ন করছে যুক্তরাষ্ট্র। রুশ বাহিনীর সঙ্গে একাধিকবার যুদ্ধে জড়িয়ে পড়ার পর এ সিদ্ধান্ত নেয়া হয়েছে।



সিরিয়ার উত্তরপূর্বাঞ্চলে যুক্তরাষ্ট্র বাড়তি ছয়টি অস্ত্র সজ্জিত ট্যাংক এবং শতাধিক সেনা পাঠিয়েছে বলে বিবিসি জানিয়েছে। শুক্রবার ‘ইউএস সেন্ট্রাল কমান্ড’র এক মুখপাত্র বলেন, যুক্তরাষ্ট্র সিরিয়ায় অন্য কোনো দেশের সঙ্গে সংঘাতে জড়াতে চায় না। তবে প্রয়োজনে অবশ্যই যৌথ বাহিনীকে সুরক্ষা দেবে।গৃহযুদ্ধ বিধ্বস্ত সিরিয়ার উত্তরপূর্বাঞ্চলে মার্কিন এবং রুশ বাহিনী নিয়মিত টহল দেয়। এ বছর দুই বাহিনী বেশ কয়েকবার মুখোমুখি হওয়ায় ওই অঞ্চলে উত্তেজনা বেড়েছে।গত মাসের শেষ দিকে মার্কিন সেনাদের একটি দল রাশিয়ার একটি সাঁজোয়া যানের মুখোমুখি হয়ে গেলে লড়াইয়ে সাত মার্কিন সেনা আহত হয়। এ ঘটনার জন্য যুক্তরাষ্ট্র এবং রাশিয়া সরকার পরষ্পরকে দায়ী করেছে।সিরিয়ার উত্তরপূর্বাঞ্চলে এখনো প্রায় পাঁচশ’ মার্কিন সেনা মোতায়েন আছে। তারা সেখানে ইসলামিক স্টেটের বিরুদ্ধে লড়াইয়ে কুর্দি বাহিনীকে সহায়তা করে।অন্যদিকে রুশ বাহিনী সিরিয়ার প্রেসিডেন্ট বাশার আল আসাদের হয়ে লড়াই করে।
",19/9/2020,international
"ফিলিস্তিনিদের বিক্ষোভ মিছিলে ইসরাইলের গুলি, আহত ৩","অধিকৃত ফিলিস্তিনের পবিত্র আল-কুদস শহরে সংযুক্ত আরব আমিরাত ও বাহরাইনের বিরুদ্ধে বিশ্বাসঘাতকতার অভিযোগ এনে বিক্ষোভ করেছেন ফিলিস্তিনি জনগণ।



ইসরাইলের সঙ্গে সম্পর্ক স্বাভাবিক করার চুক্তি সইয়ের প্রতিবাদে ওই বিক্ষোভ মিছিলের আয়োজন করা হয়।এতে ইসরাইলি বাহিনী গুলি চালালে কমপক্ষে ৩ ফিলিস্তিনি আহত হয়েছেন।খবর বার্তা সংস্থা আল-শিহাবের।জেরুজালেমে পবিত্র আল-আকসা মসজিদ কম্পাউন্ডের কাছে শুক্রবার জুমা নামাজের পর বিক্ষোভে অংশ নেন হাজারো ফিলিস্তিনি।বিক্ষোভে অংশ নেয়া মুসল্লিরা বিশাল একটি ব্যানার বহন করেন যাতে লেখা ছিল- ইসরাইলের সঙ্গে সম্পর্ক স্বাভাবিক করার পদক্ষেপ বিশ্বাসঘাকতা। গত মঙ্গলবার বাহরাইন ও সংযুক্ত আরব আমিরাত মার্কিন প্রেসিডেন্টের সরকারি বাসভবন হোয়াইট হাউসে ইসরাইলের সঙ্গে আনুষ্ঠানিক চুক্তি সই করে। এ ঘটনাকে বহু আরব ও মুসলিম দেশ ফিলিস্তিনিদের সঙ্গে মহা বিশ্বাসঘাতকতা বলে মন্তব্য করেছে।এদিকে, শুক্রবার অধিকৃত পশ্চিম তীরের জেনিন শহরে ইসরাইলি সেনাদের গ্রেনেড হামলায় ৫৪ বছর বয়সী এক ফিলিস্তিনি নিহত হয়েছেন।",19/9/2020,international
ইসরাইলের সহযোগিতায় পরমাণু কর্মসূচিতে সৌদি: ইরান,"ইসরাইলের সহযোগিতায় সৌদি আরব গোপনে পরমাণু অস্ত্রভাণ্ডার গড়ে তোলার চেষ্টা করেছে বলে অভিযোগ ইরানের।



সৌদি আরবকে পরমাণু অস্ত্রবিস্তার রোধ চুক্তি বা এনপিটি’তে স্বাক্ষর করতে বাধ্য করার জন্য আন্তর্জাতিক আণবিক শক্তি সংস্থা বা আইএইএ’র প্রতিও আহ্বান জানিয়েছে তেহরান। খবর পার্সটুডের।আইএইএ’তে নিযুক্ত ইরানের স্থায়ী প্রতিনিধি কাজেম গারিবাবাদি শুক্রবার ওই সংস্থার নির্বাহী পরিষদের বৈঠকে এ আহ্বান জানান।তিনি বলেন, আইএইএ সৌদি আরবের গোপন পরমাণু স্থাপনাগুলো পরিদর্শনের ইচ্ছা প্রকাশ করলেও বৃহৎ শক্তিগুলোর মদতে রিয়াদ সে অনুরোধ উপেক্ষা করে যাচ্ছে। ইরানের এই কূটনীতিক হুঁশিয়ারি উচ্চারণ করে বলেন, সৌদি আরবের পরমাণু কর্মসূচিতে ইতিহাসের পুনরাবৃত্তি লক্ষ্য করা যাচ্ছে; এর আগে ইহুদিবাদী ইসরাইল যে পথে তার পরমাণু কর্মসূচি পরিচালিত করেছে রিয়াদও ঠিক সে পথ অনুসরণ করছে।তিনি বলেন, ইসরাইলের মতো সৌদি আরব একথা বোঝানোর চেষ্টা করছে যে, তারা এনপিটিতে সই করেনি বলে তার পক্ষে যা খুশি তাই করা সম্ভব।একইসঙ্গে তিনি সৌদি আরবকে গোপন পরমাণু কর্মসূচি পরিচালনায় সহযোগিতাকারী দেশগুলোকেও সতর্ক করে দিয়ে বলেন, যেকোনো দেশ সৌদি আরবকে সহযোগিতা করার আগে যেন এ বিষয়ে নিশ্চিত হয় যে, রিয়াদ পরমাণু কর্মসূচি পরিচালনার ক্ষেত্রে সব আন্তর্জাতিক আইন মেনে চলছে।",19/9/2020,international
সৌদি নারীদের জন্য ডিজিটাল কলেজ চালু,"নারী শিক্ষার্থীদের জন্য প্রথমবারের মতো দুটি ডিজিটাল কলেজ চালু করেছে সৌদি সরকার।



আরব নিউজের প্রতিবেদন থেকে জানা গেছে, নারীদের আধুনিক প্রযুক্তিবিষয়ক কাজে সম্পৃক্ত করতে বুধবার দেশটির শিক্ষামন্ত্রী হামাদ আল শেখ রাজধানী রিয়াদ ও জেদ্দায় ডিজিটাল কলেজ দুটির উদ্বোধন করেন।আরব নিউজের প্রতিবেদনে বলা হয়েছে, সৌদি আরবে এই প্রথম কেবল নারীদের প্রযুক্তিবিষয়ক শিক্ষা দানের জন্য ডিজিটাল কলেজ স্থাপন করা হল।এখানের প্রযুক্তিবিষয়ক নানা বিষয়ে অনার্স ও ডিপ্লোমা ডিগ্রি নেয়ার ব্যবস্থা থাকবে।নেটওয়ার্ক সিস্টেম ম্যানেজমেন্ট, মিডিয়া টেকনোলজি, সফটওয়ার, স্মার্ট সিটি, রোবটিকস টেকনোলজি, আর্টিফিসিয়াল ইন্টেলিজেন্টস, মেশিন লার্নিংসহ নানা বিষয় থাকবে কলেজ দুটিতে।",19/9/2020,international
কাতারকে নন-ন্যাটো মিত্রের মর্যাদা দিতে যাচ্ছে আমেরিকা,"ইসরাইলের সঙ্গে সম্পর্ক স্বাভাবিকে মধ্যপ্রাচ্যের দেশ সংযুক্ত আরব আমিরাত (ইউএই) ও বাহরাইনের সঙ্গে চুক্তির পর এবার কাতারকে নন-ন্যাটো মিত্র হিসেবে মর্যাদা দিতে যাচ্ছে আমেরিকা। আলজাজিরা।



নন-ন্যাটোর মিত্র হিসেবে ওয়াশিংটনের সঙ্গে প্রতিরক্ষা, নিরাপত্তা ও সুরক্ষাবিষয়ক সহযোগিতায় পারস্পরিক সম্পর্ক গড়ে উঠবে দোহার।একটি কনফারেন্স কলে উপসাগরীয় অঞ্চলের মার্কিন ডেপুটি অ্যাসিস্ট্যান্ট সেক্রেটারি টিমোথি লেন্ডারকিং বলেন, ‘কাতারকে গুরুত্বপূর্ণ নন-ন্যাটো মিত্র হিসেবে আমরা আশা করছি। বিষয়টি নিয়ে আমরা এগোচ্ছি।’মার্কিন পররাষ্ট্রমন্ত্রী মাইক পম্পেও এবং কাতারের পররাষ্ট্রমন্ত্রী শেখ মোহাম্মদ বিন আবদুল রহমান আল থানিসহ দুই দেশের গুরুত্বপূর্ণ কর্মকর্তারাএ সপ্তাহের শুরুতে ওয়াশিংটন ডিসিতে মিলিত হতে যাচ্ছেন বলে জানা গেছে। সামরিক ক্ষেত্রে নন-ন্যাটো মিত্র দেশগুলো (এমএনএনএ) যুক্তরাষ্ট্র থেকে যেসব সুবিধা পায় কাতারও সেটির অন্তর্ভুক্ত হবে। ",19/9/2020,international
ফিলিস্তিন সমস্যার সমাধান ছাড়া মধ্যপ্রাচ্যে শান্তি আসবে না: রাশিয়া,"রাশিয়া বলেছে, ইসরাইলি-ফিলিস্তিনি সংঘাতের অবসান ছাড়া মধ্যপ্রাচ্যে স্থায়ী শান্তি প্রতিষ্ঠার চিন্তা করা হবে ভুল।



মঙ্গলবার হোয়াইট হাউসে দীর্ঘ দিনের শত্রু দেশ বাহরাইন ও সংযুক্ত আরব আমিরাতের সঙ্গে ইসরাইলের সম্পর্ক স্বাভাবিক করার পর রাশিয়ার পররাষ্ট্র মন্ত্রণালয়ের বিবৃতিতে একথা বলা হয়।-খবর এএফপিররাশিয়া জানায়, এমন চুক্তির ফলে ইসরাইল ও আরব বিশ্বের অনেক দেশের মধ্যে সম্পর্ক স্বাভাবিক করার ক্ষেত্রে অগ্রগতি হলেও ফিলিস্তিন সমস্যা এখনো চরম পর্যায়ে রয়েছে। তারা জানায়, ফিলিস্তিন সমস্যার সমাধান খুঁজে বের করা ছাড়া মধ্যপ্রাচ্যের স্থায়ী স্থিতিশীলতা অর্জনের ক্ষেত্রে এটি একটি ভুল সিদ্ধান্ত হবে। 
মস্কো এ সংকট সমাধানের সমন্বিত প্রচেষ্টা জোরদারে আঞ্চলিক ও আন্তর্জাতিক নেতাদের প্রতি আহ্বান জানিয়েছে।পররাষ্ট্র মন্ত্রণালয়ের বিবৃতিতে বলা হয়, রাশিয়া এ ধরনের যৌথ প্রচেষ্টা চালানোর জন্য প্রস্তুত রয়েছে।এদিকে হোয়াইট হাউসের চিফ অব স্টাফ মার্ক মিডোসও বলেছেন, ইসরাইলের সঙ্গে সম্পর্ক স্বাভাবিকীকরণ করতে আরও পাঁচটি দেশ গুরুত্বসহকারে বিবেচনা করছে।এর আগে চলতি সপ্তাহে দখলদার রাষ্ট্রটির সঙ্গে শান্তি চুক্তি করেছে সংযুক্ত আরব আমিরাত ও বাহরাইন। বার্তা সংস্থা রয়টার্সের খবরে এমন তথ্য পাওয়া গেছে।বৃহস্পতিবার এয়ার ফোর্স ওয়ানে সাংবাদিকদের সঙ্গে আলাপকালে তিনি এসব তথ্য দিলেও সেই পাঁচটি দেশ নিয়ে বিস্তারিত কোনো বক্তব্য দেননি।উইসকনসিনে নির্বাচনী প্রচারে যোগ দিতে মার্কিন প্রেসিডেন্ট ডোনাল্ড ট্রাম্পকে বহন করে নিয়ে যাচ্ছিল এয়ার ফোর্স ওয়ান।মিডোস বলেন, তিনটি দেশই ওই অঞ্চলের। কিন্তু এর বেশি কিছু তিনি বলতে অস্বীকার করেন।আরও অনেক দেশ ইসরাইলের সঙ্গে সম্পর্ক স্বাভাবিক করতে চায় বলে আশাবাদ ব্যক্ত করেন ট্রাম্প। তবে সম্ভাব্য এসব দেশের মধ্যে ওমান একটি।দেশটির রাষ্ট্রদূত মঙ্গলবার হোয়াইট হাউসে ইসরাইলের সঙ্গে আমিরাতের শান্তি চুক্তির অনুষ্ঠানে উপস্থিত ছিলেন।সৌদি আরবও অবৈধ রাষ্ট্রটির সঙ্গে সম্পর্ক স্থাপনে অবশেষে রাজি হয়েছে বলে জানিয়েছেন ট্রাম্প।",19/9/2020,international
জম্মু-কাশ্মীরের জন্য ভারতের ১৩৫০ কোটির প্যাকেজ,"ভারত নিয়ন্ত্রিত জম্মু ও কাশ্মীরের জন্য ১৩৫০ কোটির প্যাকেজ ঘোষণা করেছে ভারত। এর আওতায় আগামী এক বছরের জন্য পানি ও বিদ্যুৎ বিলের ৫০ শতাংশ ছাড়া পাবেন স্থানীয় বাসিন্দারা। আর ব্যবসার জন্য যারা ব্যাংক ঋণ নিয়েছেন, আগামী ৬ মাসের জন্য তাদের প্রত্যেককে সুদের ওপর ৫ শতাংশ করে ছাড় দেওয়া হবে। খবর আনন্দবাজারের।



শনিবার ভারত শাসিত জম্মু-কাশ্মীরের জন্য অতিরিক্ত ১৩৫০ কোটি টাকার আর্থিক প্যাকেজের ঘোষণা করেন সেখানকার লেফটেন্যান্ট গভর্নর (উপ রাজ্যপাল) মনোজ সিনহা। তাতেই উপত্যকার সাধারণ মানুষ, ছোট ও মাঝারি ব্যবসায়ী এবং পর্যটন শিল্পের জন্য একাধিক পদক্ষেপের ঘোষণা করেন তিনি।মনোজ সিনহা বলেন, ‘জম্মু-কাশ্মীরের জন্য ১৩৫০ কোটি টাকার আর্থিক প্যাকেজে অনুমোদন দিয়েছি আমরা। উপত্যকার ব্যবসায়ী সম্প্রদায় কঠিন পরিস্থিতির মধ্য দিয়ে যাচ্ছেন। তাদের জন্য এই ঘোষণা করতে পেরে খুশি আমি। এর আওতায় আত্মনির্ভর ভারত প্রকল্প এবং স্থানীয় প্রশাসনের নেওয়া পদক্ষেপের বাইরেও অতিরিক্ত সুযোগ সুবিধা পাবেন তারা।’২০২১ সালের মার্চ মাস পর্যন্ত ঋণগ্রহীতাদের কোনও স্ট্যাম্প ডিউটিও দিতে হবে না বলে জানান তিনি।সংবাদ সংস্থা এএনআই-কে দেওয়া সাক্ষাৎকারে মনোজ সিনহা বলেন, ‘চলতি অর্থবর্ষে বিনা শর্তে ব্যবসায়ী সম্প্রদায়ের ঋণগ্রহীতাদের সুদের ওপর ৫ শতাংশ ছাড় দেওয়ার সিদ্ধান্ত নিয়েছি আমরা। আগামী ছ’মাস তাঁরা এই সুবিধা পাবেন। এতে তাদের ভার খানিকটা হলেও লাঘব হবে এবং রোজগারের সুযোগ বাড়বে বলে ধারণা আমাদের।’তিনি আরও বলেন, ‘আগামী এক বছরের জন্য জল ও বিদ্যুতের বিলের উপর ৫০ শতাংশ ছাড় দেওয়া হবে। একই সঙ্গে ২০২১-এর মার্চ পর্যন্ত স্ট্যাম্প ডিউটি দিতে হবে না ঋণগ্রহীতাদের।’মনোজ সিনহা বলেন, ‘‘তাঁত ও হস্তশিল্পের মানুষের জন্য ১ লক্ষ টাকা থেকে বাড়িয়ে ক্রেডিট কার্ডে সর্বোচ্চ খরচের সীমা ২ লক্ষ টাকা পর্যন্ত বেঁধে দেওয়া হচ্ছে। সুদের উপর ৭ শতাশ ছাড় পাবেন তাঁরা। ১ অক্টোবর থেকে মহিলা ও অল্পবয়সি ব্যবসায়ীদের জন্য উপত্যকার ব্যাঙ্কগুলিতে বিশেষ ডেস্ক চালু করা হবে।’’ প্রয়োজনে সেখানে তাঁদের কাউন্সেলিংয়ের ব্যবস্থাও করা হবে বলে জানান তিনি।ভারত সরকারের এ সিদ্ধান্তে সন্তুষ্ট নন স্থানীয়রাতবে সরকারের এই ঘোষণায় তারা সন্তুষ্ট নন জম্মু-কাশ্মীরের অধীবাসীরা। তাদের যে ক্ষতি হয়েছে এর তুলনায় এ প্যাকেজ খুবই নগন্য।জম্মু-কাশ্মীর আপনি পার্টির প্রেসিডেন্ট আলতাফ বুখারি বলেন, ৩৭০ ধারা প্রত্যাহার এবং করোনার ধাক্কা, দুইয়ে মিলিয়ে যে পরিমাণ ক্ষতি হয়েছে, সরকারের এই প্যাকেজ তার সামনে কিছুই নয়।আলতাফ বুখারি বলেন, ‘সব মিলিয়ে ৪০ হাজার কোটি টাকার বেশি ক্ষতি হয়েছে আমাদের। তার সামনে ১৩৫০ কোটি টাকার প্যাকেজ সমুদ্রে এক ফোঁটা জলের চেয়ে বেশি নয়।’",19/9/2020,international
