মিয়ানমার থেকে এলো ২০ টন পেঁয়াজ,"কক্সবাজারের টেকনাফে মিয়ানমার থেকে প্রায় দুই হাজার বস্তা (২০ টন) পেঁয়াজ এসেছে। শুক্রবার ছোট ট্রলারে এই পেঁয়াজ টেকনাফ স্থলবন্দর ঘাটে এসে পৌঁছায়। বন্দরসংশ্লিষ্টরা জানিয়েছেন, আজ খালাস শেষে পেঁয়াজগুলো ট্রাকে দেশের বিভিন্ন স্থানে পাঠানো সম্ভব হবে।



এদিকে দেশি পেঁয়াজে সয়লাব দেশের অন্যতম উৎপাদনকারী জেলা কুষ্টিয়ার বাজার। ভারত পেঁয়াজ রফতানি বন্ধ করে দেয়ায় দেশটির ঘোজাডাঙা বন্দরে আটকা পড়েছে পেঁয়াজ বোঝাই ৩০০ ট্রাক। ব্যুরো ও প্রতিনিধিদের পাঠানো খবর-টেকনাফ (কক্সবাজার) : টেকনাফ স্থলবন্দর পরিচালনাকারী প্রতিষ্ঠান ইউনাইটেড ল্যান্ড পোর্টের ব্যবস্থাপক জসিম উদ্দিন চৌধুরী জানান, প্রায় তিন মাস পর মিয়ানমার থেকে পেঁয়াজ আমদানি হয়েছে। ইতোমধ্যে পেঁয়াজগুলো ট্রলার থেকে খালাসের প্রক্রিয়া শুরু হয়েছে। কাগজপত্র হাতে না আসায় এখনও পেঁয়াজের সঠিক পরিমাণ জানা যাচ্ছে না। তবে ২০ মেট্রিক টনের বেশি হতে পারে। সিঅ্যান্ডএফ প্রতিষ্ঠান সেভেন স্টার এন্টারপ্রাইজের তত্ত্বাবধানে কানিজ এন্টারপ্রাইজ নামে একটি প্রতিষ্ঠান পেঁয়াজগুলো আমদানি করে। আমদানিকারক প্রতিষ্ঠানের স্বত্বাধিকারী উসমান গণি বলেন, প্রথম ধাপে দুই হাজার বস্তা পেঁয়াজ টেকনাফ বন্দরে এসে পৌঁছেছে। আরও পেঁয়াজ আসার পথে রয়েছে।সেভেন স্টার এন্টারপ্রাইজের ব্যবস্থাপক মো. আরাফাত বলেন, শুক্রবার ছুটির দিন হওয়ায় আমদানির কাগজপত্র (আইজিএম) জমা দেয়া সম্ভব হয়নি। শনিবার (আজ) কাগজপত্র জমা দিয়ে রোববারের দিকে পেঁয়াজগুলো দেশীয় বাজারে সরবরাহ করা যাবে।টেকনাফ স্থলবন্দরের শুল্ক কর্মকর্তা মোহাম্মদ আবছার উদ্দিন বলেন, মিয়ানমার থেকে পেঁয়াজ আমদানি করতে ব্যবসায়ীদের উৎসাহিত করা হচ্ছে। আমদানি করা পেঁয়াজ দ্রুত খালাস করে বাজারে পৌঁছানো হবে।কুষ্টিয়া : কুষ্টিয়ায় চাহিদার চেয়ে দ্বিগুণের বেশি পেঁয়াজ উৎপাদিত হয়। এখানকার গ্রামাঞ্চলের হাটে প্রতিদিন হাজার হাজার কেজি পেঁয়াজ নিয়ে আসছেন কৃষকরা। দাম ভালো পাওয়ায় তারা ফসল বিক্রি করে হাসিমুখে ঘরে ফিরছেন। শুক্রবার সকালে জেলার বৃহৎ পেঁয়াজের হাট কুমারখালী উপজেলার পান্টি কলেজ মাঠে দেখা যায়, পেঁয়াজে সয়লাব বাজার। প্রায় দুই কিলোমিটারজুড়ে পেঁয়াজভর্তি ভ্যানের দীর্ঘ সারি। প্রতিটি ভ্যানে পাঁচ থেকে আট মণ করে পেঁয়াজ রয়েছে। ব্যবসায়ীরা জানান, এদিন ফজরের নামাজের পর থেকেই শুরু হয় হাট। সকাল ১০টার দিকে বেচাকেনা শেষ হয়ে যায়। হাটে সবচেয়ে ভালো মানের পেঁয়াজ পাইকারি প্রতি মণ বিক্রি হয়েছে তিন হাজার ২০০ টাকায়। এছাড়া প্রকার ভেদে প্রতি মণ বিক্রি হয়েছে দুই হাজার ৮০০ থেকে তিন হাজার ২০০ টাকা। গুটি পেঁয়াজ (বীজ) প্রতি মণ বিক্রি হয়েছে তিন হাজার ৫০০ টাকায়।কুমারখালী মোহননগর গ্রামের কৃষক আখতারুজ্জামান বলেন, নিজের জমিতে উৎপাদন করা পেঁয়াজ বিক্রি করতে এসেছি। দুই হাজার ৯০০ টাকা মণ দরে ১০ মণ বিক্রি করেছি। ভারতীয় পেঁয়াজ না এলে দেশের কৃষকরা অনেক লাভবান হবে। তিনি আরও বলেন, এলাকার বাড়িতে বাড়িতে প্রচুর পেঁয়াজের মজুদ রয়েছে। বেশি দাম পাওয়ার আশায় কৃষকরা ঘরে রেখে আস্তে আস্তে বিক্রি করছেন।সাতক্ষীরা : সাতক্ষীরার ভোমরা স্থলবন্দরে পাঁচ দিন ধরে পেঁয়াজের চালান আসছে না। এ বন্দরের উল্টো দিকে ভারতের ঘোজাডাঙা স্থলবন্দরে প্রায় ৩০০ ট্রাক পেঁয়াজ নিয়ে বাংলাদেশে প্রবেশের অপেক্ষায় রয়েছে। আমদানিকারকরা জানিয়েছেন, এরই মধ্যে ওই পেঁয়াজে পচন ধরেছে। ফলে তারা মারাত্মক ক্ষতির মুখে পড়বেন। এদিকে ভ্রাম্যমাণ আদালত ভোমরা বন্দরে অভিযান চালিয়ে পেঁয়াজ মজুদ রাখার অভিযোগে কয়েকজন ব্যবসায়ীকে জরিমানা করেছেন।রংপুর : নগরীসহ জেলার সর্বত্র খুচরা বাজারে লাফিয়ে লাফিয়ে বাড়ছে পেঁয়াজের দাম। দু’দিনের ব্যবধানে কেজিতে পেঁয়াজের দাম বেড়েছে ৪০ থেকে ৫০ টাকা। হঠাৎ করে পেঁয়াজের এমন মূল্যবৃদ্ধিতে ক্ষোভ প্রকাশ করেছেন ক্রেতারা। শুক্রবার ভারতীয় পেঁয়াজ ৮০ টাকা ও দেশি পেঁয়াজ ১০০ টাকা কেজি দরে বিক্রি হয়েছে।দিনাজপুর : পেঁয়াজ আমদানি বন্ধ হয়ে যাওয়ার সঙ্গে সঙ্গে এক দিনেই বেড়ে দাম দ্বিগুণ হলেও ভারত থেকে আবার পেঁয়াজ আসছে- এমন খবরে জেলায় পেঁয়াজের দাম কেজিতে ২০ টাকা কমেছে। দাম বাড়ার পেছনে বাজারের মধ্যস্বত্ব ব্যবসায়ীদের দায়ী করছেন পেঁয়াজ আমদানিকারকরা।গৌরনদী (বরিশাল) : গৌরনদী উপজেলার টরকী বন্দর, গৌরনদী বন্দর, বাটাজোড় বাজার, মাহিলাড়া বাজারে শুক্রবার খুচরায় প্রতি কেজি পেঁয়াজ ৭৫ থেকে ৮৫ টাকা কেজি দরে বিক্রি হয়েছে।",22/9/2020,economics
বিকল্প দেশ থেকে পেঁয়াজ আমদানির হিড়িক,"ভারত পেঁয়াজ রফতানি বন্ধ করে দেয়ায় বিকল্প দেশ থেকে পণ্যটি আনার হিড়িক পড়েছে। চট্টগ্রাম বন্দর দিয়ে পেঁয়াজ আমদানির অনুমতিপত্র (আইপি) নিচ্ছেন ব্যবসায়ীরা। ১৫ দিনে ২১৭টি আইপি নেয়া হয়েছে। এর বিপরীতে ৭৯ হাজার ৩৯০ টন পেঁয়াজ আমদানির কথা রয়েছে। ২ থেকে ৩ সপ্তাহ পর এসব পেঁয়াজ সমুদ্রপথে দেশে আসতে শুরু করবে। তবে মিয়ানমারের পেঁয়াজ আরও আগে চলে আসতে পারে।



বন্দরসংশ্লিষ্ট সূত্র জানায়, কয়েক দিন ধরে আইপি আবেদন বেড়ে গেছে। বিশেষ করে সোমবার ভারত পেঁয়াজ রফতানি বন্ধের ঘোষণা দিলে অন্য দেশ থেকে পণ্যটির আমদানির আবেদন বেড়ে যায়। গত বছরও এ সময়ে ভারত থেকে আসা বন্ধ হয়ে গেলে পেঁয়াজের সংকট দেখা দেয়। দাম বাড়তে থাকে লাফিয়ে লাফিয়ে। ওই সময় প্রতি কেজি পেঁয়াজ সর্বোচ্চ ৩০০ টাকা পর্যন্ত বিক্রি হয়েছিল খুচরা বাজারে।গতবার সংকটকালে তড়িঘড়ি করে অনেকে আমদানি অনুমতিপত্র নিয়েছিলেন। তবে সময় স্বল্পতাসহ নানা জটিলতায় তাদের অনেকে আমদানি করতে পারেননি। গতবারের অভিজ্ঞতা থেকে এবার পেঁয়াজ পরিস্থিতির ওপর নজর রাখছিলেন আমদানিকারকরা। আগেই তারা প্রস্তুতি নিয়ে রেখেছিলেন। তাই ভারতীয় পেঁয়াজ আসা বন্ধ হওয়ার সঙ্গে সঙ্গে তারা এবার বিকল্প বাজার থেকে পেঁয়াজ আনতে জোর তৎপরতা শুরু করেছেন।চট্টগ্রাম সমুদ্রবন্দরের উদ্ভিদ সংঘনিরোধ কেন্দ্রের (কোয়ারেন্টাইন) উপ-পরিচালক আসাদুজ্জামান বুলবুল যুগান্তরকে জানান, ভারত রফতানি বন্ধের ঘোষণা দেয়ার পর থেকে পেঁয়াজের জন্য আইপি আবেদন স্বাভাবিক সময়ের চেয়ে কয়েকগুণ বেড়ে গেছে। ৩ সেপ্টেম্বর একটি আইপি ইস্যু হয়েছিল। পরের দু’দিন হয়নি। ৬ সেপ্টেম্বর ইস্যু হয় পাঁচটি। মঙ্গলবার ৬৮টি আইপি ইস্যু হয়েছে। এর বিপরীতে ৩০ হাজার ৮১২ টন পেঁয়াজ আমদানির ঘোষণা দেয়া হয়েছে। বুধবার ৪৯টি আইপির মাধ্যমে ১৭ হাজার ৫৬৬ টন পেঁয়াজ আনার অনুমতি নিয়েছেন বিভিন্ন আমদানিকারক। আর বৃহস্পতিবার ৬৭টি আইপির বিপরীতে আরও ২১ হাজার ৯১১ টন পেঁয়াজ আমদানির অনুমতি নেয়া হয়েছে। ৩ সেপ্টেম্বর থেকে ১৭ সেপ্টেম্বর পর্যন্ত ২১৭টি আইপির বিপরীতে ৭৯ হাজার ৩৯০ টন পেঁয়াজ আমদানির অনুমতিপত্র নিয়েছেন আমদানিকারকরা।আসাদুজ্জামান বুলবুল আরও বলেন, যারা পেঁয়াজের আইপি নিতে আসছেন, দেশের চাহিদার কথা মাথায় রেখে তাদের দ্রুত সময়ের মধ্যে অনুমতি দেয়া হচ্ছে। উদ্ভিদ সংঘনিরোধ কেন্দ্রের তথ্যমতে, এখান থেকে আইপি নেয়া প্রতিষ্ঠানগুলোর বেশিরভাগই চট্টগ্রামকেন্দ্রিক। এর মধ্যে রয়েছে- ট্রেড লিংক, চৈতি এন্টারপ্রাইজ, শাহ জব্বারিয়া এন্টারপ্রাইজ, নাজ ট্রেডিং, ফরহাদ ট্রেডিং, আঁখি এন্টারপ্রাইজ। এসব প্রতিষ্ঠান চীন, মিয়ানমার, পাকিস্তান, মিসর, নেদারল্যান্ডস ও নিউজিল্যান্ড থেকে পেঁয়াজ আমদানি করতে চায়।ভোগ্যপণ্য আমদানিকারকরা জানান, মিয়ানমার থেকে পেঁয়াজ ২ থেকে ৩ দিনের মধ্যেই আনা সম্ভব। অন্য দেশগুলোর পেঁয়াজ বাজারে আসতে ২০-২৫ দিন সময় লাগতে পারে। বিকল্প দেশ থেকে পেঁয়াজ আসা শুরু হলে সংকট থাকবে না। তাই পেঁয়াজ নিয়ে আতঙ্কিত হওয়ার কারণ নেই।চট্টগ্রাম চেম্বার অব কমার্স অ্যান্ড ইন্ডাস্ট্রির সভাপতি মাহবুবুল আলম যুগান্তরকে বলেন, অনেকে আতঙ্কিত হয়ে প্রয়োজনের অতিরিক্ত পেঁয়াজ কিনছেন। পণ্যটি পচনশীল। তাই যারা প্রয়োজনের বেশি কিনবেন তাদের অপচয় হবে। চাহিদা বেড়ে যাওয়ায় বাজারে সৃষ্টি হয়েছে কৃত্রিম সংকট। পর্যাপ্ত পেঁয়াজ বিভিন্ন দেশ থেকে আসছে। আমদানিকারকরা তৎপর হয়ে উঠেছেন। গতবার অনেক আমদানিকারক ভারতের বিকল্প দেশ থেকে পেঁয়াজ আনতে গিয়ে হোঁচট খেয়েছিলেন। এবার তেমনটি হবে না। তাদের অভিজ্ঞতা হয়েছে। আগে থেকে প্রস্তুতি ছিল। বিদেশি রফতানিকারকদের সঙ্গে এরই মধ্যে তাদের একটা সম্পর্ক তৈরি হয়েছে। তাই আশা করছি, এবার কম সময়ে বিদেশি পেঁয়াজ বাজারে আসবে।সংশ্লিষ্টরা জানান, দেশে পেঁয়াজের চাহিদার বড় একটি অংশ পূরণ হয় ভারত থেকে আমদানির মাধ্যমে। ভারতীয় পেঁয়াজ দেশে আসে স্থলবন্দরগুলো দিয়ে। জাহাজে সমুদ্রপথে পেঁয়াজ আনতে ১০-১৫ দিন সময় লাগে। এ সময়ে পচে যাওয়ার আশঙ্কা থাকে। তাই চট্টগ্রাম সমুদ্রবন্দর দিয়ে খুব বেশি পেঁয়াজ আমদানি হয় না। চট্টগ্রামের ভোগ্যপণ্যের বৃহৎ পাইকারি বাজারে প্রতিদিন পেঁয়াজের জোগান আসে স্থলবন্দরগুলো থেকে।চট্টগ্রাম কাস্টম হাউসের তথ্যমতে, চট্টগ্রাম বন্দর দিয়ে ১ জুন থেকে ৫ সেপ্টেম্বর পর্যন্ত ৪ মাসে পেঁয়াজ আমদানি হয়েছে ১৮ লাখ ২৪ হাজার কেজি। যার আমদানিমূল্য প্রায় ৫ কোটি টাকা। ১২টি আমদানিকারক প্রতিষ্ঠান এসব পেঁয়াজ এনেছে।এদিকে চট্টগ্রামের খাতুনগঞ্জের পাইকারি আড়তগুলোতে এখনও বেশি দামে পেঁয়াজ বিক্রি হচ্ছে। পাইকারিতে প্রতি কেজি পেঁয়াজ বিক্রি হচ্ছে ৫৫-৬০ টাকায়। খুচরায় বিক্রি হচ্ছে ৭৫-৮০ টাকায়।আড়তদাররা জানান, খাতুনগঞ্জে এখনও পেঁয়াজ আসছে। আড়তগুলোতে পর্যাপ্ত পেঁয়াজ রয়েছে। সেই তুলনায় বৃহস্পতিবার ক্রেতা ছিল কম।",22/9/2020,economics
