পাহাড়ে শত কোটি টাকার ক্ষতি,"করোনাভাইরাসের কারণে ৫ মাস ধরে বন্ধ খাগড়াছড়ির সবকটি পর্যটন ও বিনোদন কেন্দ্র। একই অবস্থা রাঙামাটি ও বান্দরবানে। এতে করে চরম অচলাবস্থা সৃষ্টি হয়েছে পর্যটনের ওপর নির্ভরশীল পেশাজীবীদের। পাহাড়ের পর্যটন খাতে শত কোটি টাকার ক্ষতি হয়েছে।



পর্যটন কেন্দ্র বন্ধ থাকায় আর্থিক ক্ষতির সম্মুখীন হোটেল মোটেল ও পর্যটন সংশ্লিষ্ট ব্যবসায়ীরা। এতে করে চরম দুর্ভোগে দিন কাটছে অনেকের। খাগড়াছড়িতে ভ্রমণ নিষেধাজ্ঞা থাকায় এবার ঈদেও কোনো পর্যটক আসতে পারবে না।কেবল খাগড়াছড়িতে হোটেল মোটেল ব্যবসায়ীদের দাবি করোনায় পর্যটন খাতে ক্ষতি হয়েছে প্রায় ৫০ কোটি টাকা। এখানে হোটেল মোটেলের সংখ্যা প্রায় ৫০টি। এছাড়া রাঙামাটি সাজেকে রয়েছে শতাধিক রিসোর্ট ও কটেজ। সাজেকে যেতে পর্যটকরা খাগড়াছড়ি আসে। তবে এখানকার স্থানীয় অর্থনীতিও বেশ চাঙ্গা থাকত।সাজেকগামী পর্যটকদের কেন্দ্র করে খাগড়াছড়িতে ভালো ব্যবসা করত রেস্টুরেন্ট ও হোটেলসহ পর্যটন সংশ্লিষ্টরা। তবে করোনাভাইরাসের সংক্রমণ পাল্টে দিয়েছে সবকিছু। টানা ৫ মাস বন্ধে পুঁজি হারিয়ে অনেকে ক্ষতিগ্রস্ত হয়েছে।বলা যায়, করোনায় বিপর্যস্ত পার্বত্য চট্টগ্রামের পর্যটন। গত দুই দশকে গড়ে উঠা পাহাড়ের পর্যটন সবচে কঠিন সময় মোকাবেলা করছে। প্রতি বছর ঈদের পরবর্তী দুই সপ্তাহ পাহাড়ে প্রচুর পর্যটক সমাগত থাকলেও এবার তা নেই। আলুটিলা গুহা, রিছাং ঝরনা, জেলা পরিষদ পার্কসহ বিভিন্ন পর্যটন কেন্দ্রে সুনসান নীরবতা।

খাগড়াছড়ির আলুটিলার কয়েকজন পর্যটন সংশ্লিষ্ট ব্যবসায়ী জানান,  করোনার পর থেকে এখানে কোনো পর্যটক নেই। দোকানে বেচাকেনা বন্ধ। সংসার চালানো খুবই কঠিন গেছে। গত মাস ৫ মাসে ৭ থেকে ৮ লাখ টাকার ক্ষতি হয়েছে। রেস্টুরেন্টে স্টাফদের বসিয়ে বসিয়ে বেতন দিতে হচ্ছে। আগে জেলার প্রধান পর্যটন কেন্দ্র আলুটিলায় প্রতিদিন ৩ থেকে ৪ পর্যটকরা আসলেও এখন কেউ নেই। পর্যটকরা না আসায় আমাদের লোকসান হচ্ছে।খাগড়াছড়ির গাইরিং হোটেলের ব্যবস্থাপক নয়ন ত্রিপুরা জানান, গত ৫ মাস ধরে আমাদের এখানে কোনো পর্যটক আসছে না। এ কারণে প্রতিমাসে ৩ থেকে ৪ লক্ষ টাকা লোকসান হচ্ছে। হোটেলে ১৫ জন স্টাফ আছে তাদের বেতন ভাতা দিতে হচ্ছে। এভাবে চললে আমরা বড় ধরনের ক্ষতির মুখে পড়ব। খাগড়াছড়িতে প্রায় ৫০টি ছোট বড় হোটেলে মোটেল রয়েছে, প্রত্যেকটির একই অবস্থা।’এদিকে পর্যটক না আসায় বেকার হয়ে পড়েছে শত শত পরিবহন শ্রমিক। খাগড়াছড়ি-সাজেক সড়কে পর্যটক নিয়ে চলাচল করে প্রায় ৩ শতাধিক জিপ ( চাঁদের গাড়ি), মাহেন্দ্র পিকআপ, সিএনজি। মার্চের পর থেকে খাগড়াছড়ি-সাজেক সড়কে পর্যটকবাহী যান চলাচল বন্ধ রয়েছে। এতে বেকার হয়ে পরেছে পরিবহন শ্রমিকরা।খাগড়াছড়িতে মাহেন্দ্র পিকআপ চালক প্রদীপ ত্রিপুরা জানান, ‘ঈদ মৌসুমে  প্রচুর পর্যটকের সমাগম হত। প্রতিদিন অন্তত দেড় শতাধিক গাড়ি সাজেকে যাতায়াত করত। পর্যটক না আসায় বেকার সময় কাটাচ্ছি। অনেকে কিস্তিতে গাড়ি কিনেছে। কিন্তু পর্যটক না আসায় কোনো আয় নেই। কিস্তি পরিশোধে অনেকে হিমশিম খাচ্ছে। খাগড়াছড়ি পর্যটন মোটেলের ইউনিট ব্যবস্থাপক একেএম রফিকুল ইসলাম বলেন, ‘করোনার কারণে সবচেয়ে বেশি বিপর্যস্ত খাত পর্যটন। গত ৫ মাসে প্রায় ৫০ কোটি টাকার ক্ষতি হয়েছে। করোনা পরিস্থিতি উন্নতি হলেও পর্যটন খাতে মানুষের আস্থা ফেরাতে আরও এক বছর সময় লাগবে। ফলে দীর্ঘমেয়াদী ক্ষতির মুখে আমরা আছি।’তবে এখনো পর্যটন কেন্দ্রগুলো খুলে দেয়ার ব্যাপারে কোনো সিদ্ধান্ত নেয়নি জেলা প্রশাসন। খাগড়াছড়ির জেলা প্রশাসক প্রতাপ চন্দ্র বিশ্বাস জানান, ‘দেশে করোনা সংক্রমণের কারণে খাগড়াছড়ির সব পর্যটন কেন্দ্রগুলো বন্ধ ঘোষণা করা হয়। পর্যটন কেন্দ্র খোলার বিষয়ে এখনো কোনো সিদ্ধান্ত হয়নি।’",20/9/2020,country-news
খাগড়াছড়িতে গৃহবধূকে গলা কেটে হত্যা,"খাগড়াছড়ির রামগড় উপজেলায় রাশেদা আক্তার (২০) নামে এক গৃহবধূকে গলা কেটে হত্যার অভিযোগ পাওয়া গেছে। মঙ্গলবার ভোররাতে উপজেলার মধ্যম বলিপাড়া এলাকায় নিজ বাড়ির বাইরে থেকে তার লাশ উদ্ধার করে পুলিশ।



এ সময় নিহতের স্বামী ওমর ফারুক (২৮)কে অজ্ঞান অবস্থায় রামগড় হাসপাতালে ভর্তি করা হলে হয়েছে। স্থানীয়রা জানায়, মঙ্গলবার ভোররাতে সোনাইপুল বাজারের ফল ব্যবসায়ী বলিপাড়ার ফারুক ও তার পরিবারের সদস্যদের ডাকাত ডাকাত বলে আত্মচিৎকারে এগিয়ে গেলে ঘরের বাইরে ফারুকের স্ত্রীর অর্ধ উলঙ্গ গলাকাটা রক্তাক্ত লাশ এবং বাড়ির সামনে অজ্ঞান অবস্থায় স্বামী ফারুককে পড়ে থাকতে দেখা যায়। পরে পুলিশকে খবর দেয়া হলে লাশটি উদ্ধার করে এবং ফারুককে হাসপাতালে চিকিৎসার জন্য পাঠানো হয়। ৩ বছর আগে পারিবারিকভাবে তাদের বিয়ে হয়। তাদের ১৮ মাস বয়সী একটি পুত্র সন্তান রয়েছে।পারিবারিক কলহে মেয়েকে পরিকল্পিতভাবে হত্যার অভিযোগ জানিয়ে নিহতের পিতা দেলোয়ার হোসেন জানান, ব্যবহৃত গহনা ও গরু বিক্রি করে ব্যবসার জন্য টাকা যোগাড়ের অজুহাতে মেয়ের সঙ্গে স্বামী ও তার পরিবারের দ্বন্দ্ব চলছিল। এ সব বিষয়ে গত ৩ মাস আগে সামাজিকভাবে একবার বিচারও হয়েছিল। সুষ্ঠুভাবে তদন্ত করলে মেয়ে হত্যার আসল ঘটনা বেরিয়ে আসবে। তিনি মেয়ে হত্যার বিচার দাবি করেছেন।রামগড় সার্কেলের অতিরিক্ত পুলিশ সুপার সৈয়দ মোহাম্মদ ফরহাদ জানান, প্রাথমিক আলামতে বহিরাগত সম্পৃক্ততার কিছু পাওয়া যায়নি। তবে হত্যাকাণ্ডের পেছনে পারিবারিক সংশ্লিষ্টতার আলামত পাওয়া গেছে। তদন্তে বিস্তারিত জানা যাবে। মেয়ের পিতা বাদী হয়ে একটি হত্যা মামলা দায়ের করেছেন। লাশ ময়নাতদন্তের জন্য খাগড়াছড়িতে পাঠানো হয়েছে। ",20/9/2020,country-news
চিকিৎসার জন্য ডেকে পল্লী চিকিৎসককে খুন,"খাগড়াছড়ির মাটিরাঙায় চিকিৎসার জন্য ডেকে নূর মোহাম্মদ টিপু নামে এক পল্লী চিকিৎসকে খুন করেছে দুর্বৃত্তরা।



শুক্রবার দুপুরে উপজেলার সাপমারা ব্রিজের নিচে পাহাড়ি ছড়া থেকে তার লাশ উদ্ধার করে পুলিশ। নিহত নূর মোহাম্মদ টিপু মৃত রহমত আলীর ছেলে। তার নিজ বাড়ি চাঁদপুর হলেও ১০ বছর ধরে তিনি মাটিরাঙার ১০ নম্বর এলাকায় বসবাস করতেন।নিহতের স্বজনরা জানান, শুক্রবার ভোরে তিনজন যুবক এসে অসুস্থ স্ত্রীকে চিকিৎসা করার জন্য নূর মোহাম্মদ টিপুকে ডেকে নিয়ে যায়। রোগীর অবস্থা খারাপ বলে টিপুকে দ্রুত বাড়ি থেকে বের করে নেয় ওই যুবকরা। এরপর থেকে তার আর খোঁজ পাওয়া যায়নি। মোবাইল বন্ধ থাকায় তাকে খোঁজাখুঁজি করা শুরু হয়। এরপর শুক্রবার দুপুরের দিকে নিহত নূর মোহাম্মদ টিপুর লাশ ব্রিজের নিচে দেখতে পেয়ে পুলিশকে খবর দেয় স্থানীয়রা। পুলিশ এসে নিহত টিপুর লাশ উদ্ধার করে। মাটিরাঙা থানার ওসি শামসুউদ্দিন ভূঁইয়া জানান, ধারণা করা হচ্ছে অন্য কোনো স্থানে তাকে শ্বাসরোধ করে হত্যার পর হাত-পা বেঁধে সাপমারা ব্রিজ এলাকায় ফেলে যায়। মাথায় আঘাতের চিহ্ন‎ আছে। জড়িতদের ধরতে কাজ শুরু করছে পুলিশ। লাশ ময়নাতদন্তের জন্য খাগড়াছড়ি সদর হাসপাতালে পাঠানো হয়েছে।
",20/9/2020,country-news
খাগড়াছড়িতে পিসিপি নেতাকে লক্ষ্য করে গুলি,"খাগড়াছড়ির লক্ষ্মীছড়ি উপজেলায় জেএসএস সমর্থিত পাহাড়ি ছাত্র পরিষদের(পিসিপি) সাবেক নেতা উষা মারমাকে (২৬) লক্ষ্য করে গুলি করেছে সন্ত্রাসীরা।



 শনিবার সকাল ৯টার দিকে শিলাছড়ি এলাকা তংতুল্লা পাড়ায় এ ঘটনা ঘটে।গুলিবিদ্ধ উষা মারমাকে লক্ষ্মীছড়ি হাসপাতালে নিয়ে আসা হলে সেখানে দায়িত্বরত চিকিৎসক প্রাথমিক চিকিৎসা দিয়ে তাকে চট্টগ্রাম মেডিকেল কলেজ হাসপাতালে স্থানাস্তর করেন।নিহত উষা মারমা তংতুল্লা পাড়ার কংচাইরি মারমার ছেলে। তিনি পাহাড়ি ছাত্র পরিষদের নেতা ছিলেন। তবে এখন কোনো পার্টির সঙ্গে জড়িত নয় বলে নিকটত্মীয়রা জানান। লক্ষ্মীছড়ি হাসপাতালের মেডিকেল অফিসার ডা. সাইফুল ইসলাম জানান, উষা মারমার ডান পায়ে দুটি গুলি বিদ্ধ হয়েছে। এখানে আধুনিক সরঞ্জামাদি না থাকায় তাকে চমেকে পাঠানো হয়েছে। হাসপাতালে আসার আগে তার প্রচুর রক্তক্ষরণ হয়েছে।সূত্র জানায়, তংতুল্লা পাড়ায় একটি চায়ের দোকানে আড্ডারত অবস্থায় একদল সন্ত্রাসী এলোপাতাড়ি গুলি ছুড়লে পালানোর সময় উষা মারমা গুলিবিদ্ধ হন।লক্ষ্মীছড়ি থানার ওসি হুমায়ূন কবীর জানান, ঘটনাস্থলে পুলিশ ফোর্স পাঠানো হয়েছে। উক্ত এলাকায় নিরাপত্তা জোরদার করা হয়েছে।এখনো পর্যন্ত কোনো পক্ষ থেকে লিখিত অভিযোগ পাওয়া যায়নি। আধিপত্য বিস্তারকে কেন্দ্র করে এ ঘটনা ঘটে থাকতে পারে।",20/9/2020,country-news
রামগড়ে যুবককে কুপিয়ে হত্যা,"রামগড়ে মো. ওমর ফারুক (২৮) নামে যুবককে বাজার থেকে বাড়ি ফেরার পথে কুপিয়ে হত্যা করেছে দুর্বৃত্তরা। গত শনিবার রাত ১১টায় উপজেলার কালাডেবা এলাকায় নিজ বাড়ির সামনে এ ঘটনা ঘটে।



নিহত ওমর ফারুক একই এলাকার আলী নেওয়াজের একমাত্র পুত্র সন্তান বলে জানা গেছে। নিহতের বন্ধু সাইফুল জানান, রাতে কয়েকজন মিলে বাজারে আড্ডা দিয়ে যার যার বাড়িতে চলে যাই। পরে শুনতে পাই ফারুক বাড়ির নিকটবর্তী রাস্তায় আহত অবস্থায় পড়ে আছে। আমরা ফারুককে প্রথমে রামগড় হাসপাতালে এবং পররর্তীকালে চট্টগ্রাম মেডিকেলে নিয়ে যাই। আইসিইউতে নেয়ার সঙ্গে সঙ্গে তার মৃত্যু হয়। তার মাথায় আঘাতের কারণে প্রচুর রক্তক্ষরণ হয়। ফারুকের বাবা আলী নেওয়াজ বলেন, আমার ছেলে হাটহাজারীতে ওষুধ কোম্পানির চাকরির সুবাদে মাঝে মধ্যে বাড়িতে আসলেও ২/১ দিন থেকে চলে যায়। কারো সঙ্গে আমার ও ছেলের কোনো শক্রতা ছিল না। রোববার বিয়ের জন্য পাত্রী দেখতেও যাওয়ার কথা ছিল ফারুকের। অবিলম্বে খুনিদের বের করে শাস্তির দাবি জানান তিনি। রামগড় সার্কেলের অতিরিক্ত পুলিশ সুপার সৈয়দ মোহাম্মদ ফরহাদ বলেন, অজ্ঞাতনামা সন্ত্রাসীরা এ ঘটনা ঘটিয়েছে। পুলিশ ঘটনার তদন্ত ও অভিযান শুরু করেছে শিগগিরই হত্যাকাণ্ডের রহস্য উন্মোচিত হবে। এ ঘটনায় হত্যা মামলা রুজু করা হয়েছে।",20/9/2020,country-news
ঈদ পর্যন্ত বন্ধ খাগড়াছড়ির সব পর্যটন স্পট,"করোনার সংক্রমণ এড়াতে ঈদুল আজহা পর্যন্ত খাগড়াছড়ির সব পর্যটন কেন্দ্র বন্ধ রাখার সিদ্ধান্ত নেয়া হয়েছে।



শনিবার রাতে খাগড়াছড়ির জেলা প্রশাসক প্রতাপ চন্দ্র বিশ্বাস বিষয়টি নিশ্চিত করেছেন।তিনি জানান, সারা দেশেই করোনার সংক্রমণ বাড়ছে। এই পরিস্থিতিতে সংক্রমিত এলাকা থেকে পর্যটকদের যাতায়াত বাড়লে জেলায় সংক্রমণ বাড়ার ঝুঁকি রয়েছে।এ অবস্থায় ঈদুল আজহা পর্যন্ত খাগড়াছড়ির সব পর্যটন কেন্দ্র বন্ধ থাকবে। সংক্রমণ রোধে এ সময় ভ্রমণকে নিরুৎসাহিত করা হবে।প্রতি বছর ঈদ কেন্দ্র পাহাড়ি এই জনপদে প্রচুর পর্যটক ছুটে আসেন। জেলার প্রধান পর্যটন কেন্দ্র আলুটিলা গুহা, রিছাং ঝরনা, জেলা পরিষদ পার্কসহ চেনা-অচেনা পর্যটন কেন্দ্রে বিপুল পর্যটকের সমাগম ঘটে।এ সময় হোটেল-মোটেল ব্যবসাও চাঙ্গা থাকে। তবে এবার ভিন্ন চিত্র। পর্যটক না থাকায় বন্ধ রয়েছে খাগড়াছড়ির সব হোটেল-মোটেল। মার্চের ৮ তারিখে দেশের করোনা শনাক্ত হওয়ার পর ১৮ মার্চ খাগড়াছড়ির সব পর্যটন কেন্দ্র অনির্দিষ্টকালের জন্য বন্ধ ঘোষণা করেছে জেলা প্রশাসন।একই সময় থেকে রাঙামাটির সাজেক পর্যটন কেন্দ্রও বন্ধ রয়েছে। ঈদেও খাগড়াছড়ি থেকে কোনো পর্যটকবাহী গাড়ি সাজেকে যাতায়াত করবে না।",20/9/2020,country-news
