"জাপানি বিজ্ঞানীদের নতুন জাতের ধান উদ্ভাবন, উপকৃত হবে বাংলাদেশ","প্রাকৃতিক দুর্যোগের টেনশনে থাকা বাংলাদেশি কৃষকদের সুখবর জানিয়েছে জাপানি বিজ্ঞানীরা। তাদের উদ্ভাবিত একটি নতুন জাতের লবণ সহিষ্ণু ধান বাংলাদেশ ও ভিয়েতনামের মতো প্রাকৃতিক দুর্যোগ প্রবণ অঞ্চলে কৃষকদের উপকারে আসতে পারে বলে জানিয়েছে তারা।



জিনগত উন্নতির পথ খুঁজে বের করে এই ধানটি তৈরি করেছে জাপানের জাতীয় কৃষি গবেষণা প্রতিষ্ঠান এনএআরও।টোকিওর প্রাচীন ঐতিহ্যবাহী প্রভাবশালী সংবাদ সংস্থা কিয়োডো নিউজ এ তথ্য জানিয়েছে। জাতীয় কৃষি গবেষণা প্রতিষ্ঠান এনএআরও’র বরাত দিয়ে গত রোববার প্রকাশিত প্রতিবেদনে বলা হয়, জাপানের বিজ্ঞানীরা এমন এক জিন খুঁজে পেয়েছেন যা মূল বৃদ্ধির ‘অ্যাঙ্গেল’ নির্ধারণে ভূমিকা রাখে। বৈশ্বিক জলবায়ু পরিবর্তনের এই দিনগুলোতে এই আবিষ্কার আরও নতুন জাতের সন্ধান দেবে বলে আশা প্রতিষ্ঠানটির বিজ্ঞানীদের।গবেষক দলটিকে উদ্ধৃত করে প্রতিবেদনে বলা হয়েছে, ২০৫০ সাল নাগাদ জাপানের উপকূলীয় এলাকাসহ পৃথিবীর কয়েকটি দেশের অর্ধেকের বেশি আবাদি জমি লবণের কারণে ক্ষতিগ্রস্ত হবে। বাংলাদেশ এবং ভিয়েতনাম ইতিমধ্যে ক্ষতিগ্রস্ত হয়েছে। বাংলাদেশের দক্ষিণাঞ্চলে এখনই ধানের উৎপাদন অনেকাংশে কমে গেছে।‘ধানগাছের শিকড় জমির অবস্থা অনুযায়ী কীভাবে বেড়ে উঠবে তা এই জিনের মাধ্যমে নকশা করা সম্ভব,’ জানিয়ে সংস্থাটির প্রধান বিজ্ঞানী ইউসাকু উগা বলেন, ‘লবণাক্ত জমিতে এর ফলন কয়েক গুণ বাড়বে। অন্য জমিতেও সাধারণ ধানের মতো ফলন দেবে।’এই জিনটি পাওয়া গেছে ইন্দোনেশিয়ার এক প্রকার ধানে, যার শিকড়গুলো স্থল পৃষ্ঠের বরাবর বেড়ে ওঠে।খরা এবং উচ্চ মাত্রায় লবণাক্তযুক্ত মাটি ধানের চারাকে পানিতে বেড়ে উঠতে দেয় না। মাটি আবার অনেক শক্ত হয়। যার কারণে লবণের আধিক্য চারাগাছগুলোর অক্সিজেন কমিয়ে দেয়। এই পরিবেশে ধানগাছ মাটির পৃষ্ঠতল বরাবর বেড়ে উঠতে পারলে বেশি প্রাণবন্ত হয়।বিজ্ঞানীরা ২০১৫ সাল থেকে টানা চার বছর সাসানিশিক ধান এবং ইন্দোনেশিয়ান ধানের শংকর প্রক্রিয়া পর্যবেক্ষণ করেন।তারা বলছেন, জেনেটিক্যালি উন্নত এই ধান লবণাক্ত পানিতে ১৫ শতাংশ বেশি ফলন দেবে।
",22/9/2020,international
নারিকেলের উৎপাদন কমার কারণ জানতে গাছে চড়লেন লংকান মন্ত্রী!,"শ্রীলংকা নারিকেল উৎপাদনে বিশ্বে চার নম্বর স্থানে আছে। তবে হঠাৎ করেই দেশটিতে নারিকেলের উৎপাদন কমে গেছে।



চাহিদা অনুযায়ী উৎপাদন না হওয়ায় উদ্বিগ্ন হয়ে পড়েছে লংকান সরকার। আর সে জন্যই সাধারণ মানুষকে এর উৎপাদন কমার কারণ বোঝাতে নারিকেলগাছে উঠে পড়লেন শ্রীলংকার নারিকেলবিষয়ক প্রতিমন্ত্রী অরুণদিকা ফার্নান্দো। খবর টাইমস অব ইন্ডিয়ার।গাছে বসে নারিকেল নিয়ে বিভিন্ন বিষয় তুলে ধরেন তিনি। প্রতিমন্ত্রী জানান, স্থানীয় শিল্প এবং ঘরোয়া বাজারে নারিকেলের চাহিদা অনেক গুণ বেড়ে গেছে। এ জন্য বর্তমানে দেশজুড়ে ৭০ কোটি নারিকেলের ঘাটতি দেখা দিয়েছে।অরুণদিকা ফার্নান্দো বলেন, যেসব জমি পড়ে আছে, সেগুলোতে যাতে নারিকেল চাষ করা যায়, সে জন্য সরকার সব ধরনের চেষ্টা চালাবে।
সাম্প্রতিক সময়ে নারিকেল উৎপাদনে বড় ধাক্কা খেয়েছে শ্রীলংকা। চলতি বছরের জানুয়ারি থেকে জুন পর্যন্ত, অর্থাৎ প্রথম ছয় মাসে ১৩৬ দশমিক ৭ কোটি নারিকেল উৎপাদিত হয়েছে, যা গত বছরের ওই সময়ের তুলনায় ১৩ দশমিক ৬ শতাংশ কম।একদিকে উৎপাদন কমে যাওয়া এবং অন্যদিকে চাহিদা বৃদ্ধি পাওয়ায় এ দ্বীপরাষ্ট্রে নারিকেলের দাম এখন আকাশচুম্বী। আর এ জন্য সাধারণ মানুষের মধ্যে ক্ষোভ বাড়ছে। ",22/9/2020,international
চীনা উপদেষ্টাকে ছেড়ে দিল মার্কিন এজেন্সি,"চীনের বৈদেশিক নিরাপত্তাবিষয়ক মন্ত্রণালয়ের (মিনিস্ট্রি অব স্টেট সিকিউরিটি-এমএসএস) কাজ করা এক চীনা উপদেষ্টাকে ছেড়ে দিয়েছে মার্কিন গোয়েন্দারা। চীনা কোম্পানির নাক গলানোর অভিযোগের মধ্যেই এমন ঘটনা ঘটল। মার্কিন সাইবার সিকিউরিটি অ্যান্ড ইনফ্রাস্টাকচার সিকিউরিটি এজেন্সি শুক্রবার এমএসএসের ওই উপদেষ্টাকে ছেড়ে দেয়। এমএসএসের সহযোগী এজেন্সি ও কন্ট্রাকটরদেরও ছেড়ে দেয়া হয়েছে। খবর জাস্টআর্থ নিউজের।



দ্য সাইবার ওয়ারের প্রতিবেদন অনুযায়ী- চীনা সংস্থাগুলো ওপেন সোর্সের মাধ্যমে তথ্য সংগ্রহ করে এবং গোপন কাজের সঙ্গে জড়িত। গার্ডিয়ানে প্রকাশিত এক প্রতিবেদন অনুসারে, বিশ্বব্যাপী লাখ লাখ মানুষের ব্যক্তিগত তথ্য (ডাটাবেজ) মুছে ফেলা হয়েছে।চীনা প্রতিষ্ঠান এসব তথ্য সংগ্রহ করেছিল। সম্প্রতি ফাঁস হওয়া তথ্যভাণ্ডার থেকে জানা যায়, চীনের সামরিক ও গোয়েন্দা নেটওয়ার্কের সঙ্গে এই ডাটাবেজের যোগসূত্র ছিল। ডাটাবেজে দেশটির ২০ কোটি ৪০ লাখ মানুষের তথ্য সংরক্ষিত ছিল। বিশেষজ্ঞরা বলেন, সামাজিক যোগাযোগ মাধ্যমের সহায়তায় চীনা ডাটা কোম্পানি জিনহুয়া পাবলিক ওপেন সোর্সের মাধ্যমে ডাটাগুলো সংগ্রহ করেছিল।চীনের দক্ষিণ-পূর্বাঞ্চলীয় শহর শেনজেনভিত্তিক প্রতিষ্ঠান হল জেনহুয়া ডাটা কোম্পানি।",22/9/2020,international
"শ্রীলঙ্কায় গাছে উঠে বক্তব্য দিলেন নারকেল মন্ত্রী, অতঃপর...","শ্রীলংকায় এ বছর নারকেলের ফলন কম। আর এই বিষয়টিই সাধারণ মানুষকে বোঝাতে অবিশ্বাস্য কাণ্ড ঘটালেন শ্রীলঙ্কার নারকেল প্রতিমন্ত্রী অরুণডিকা ফার্নান্দো। তড়তড় করে চড়ে পড়লেন নারকেল গাছে! সেখান থেকেই জনতার উদ্দেশে ভাষণ দিলেন তিনি।



বেশ অবাক করার মতোই ঘটনা। নারকেল গাছে ওঠা মোটেও সহজ কাজ নয়। এর জন্য বিশেষ পদ্ধতি জানা প্রয়োজন। কিন্তু সেই অসাধ্য সাধন করে তাক লাগিয়েছেন শ্রীলঙ্কার নারকেল মন্ত্রী অরুণডিকা ফার্নান্দো। সেখানে চড়েই তিনি জানান, দ্বীপরাষ্ট্রে এবার ৭০০ মিলিয়ন নারকেলের অভাব রয়েছে। এর জন্য মূলত দুটি কারণ তুলে ধরেছেন তিনি। প্রথমত, স্থানীয় শিল্পাঞ্চলে এর চাহিদা বিপুল। এবং দ্বিতীয়ত, স্থানীয়রা বাসিন্দারাও আগের তুলনায় বেশি নারকেল খাচ্ছেন।স্থানীয় সংবাদমাধ্যমের বরাতে এনডিটিভির খবর অনুযায়ী, ফার্নান্দো বলেছেন, “নারকেলের অভাব পূরণ করতে উদ্যোগী সরকার। আমরা ঠিক করেছি, আরও অনেক জমিকে নারকেল উৎপাদনের কাজে লাগাব। তাতে ফলন বাড়বে। আর ফলন বাড়লে দেশের চাহিদা মেটানোর পর তা রপ্তানিও করা যাবে। এতেই দেশের আর্থিক উন্নতি হবে।” কিন্তু বর্তমানে যেখানে নারকেলের আকাল দেখা দিয়েছে, তাতে বেশ সমস্যায় পড়েছেন শ্রীলঙ্কাবাসীরা। এই সমস্যা মেটাতে নারকেলের দাম কমিয়ে দেওয়ার সিদ্ধান্ত নিতে চলেছে সে দ্বীপরাষ্ট্রের সরকার বলেও জানান মন্ত্রী।গাছে উঠে নিজের মন্তব্য রাখা পর্যন্ত কোনও সমস্যা না হলেও গাছ থেকে নামতে গিয়ে রীতিমত ঘামছুটে গেছে মন্ত্রীর। তাঁর দলের সদস্য-সমর্থকদের কথায়, অরুণডিকা ফার্নান্দোকে নারকেল গাছ থেকে নামাতে রীতিমতো হিমশিম খেয়ে হয় তাঁদের। নিউজ ফার্স্ট জানিয়েছে, বক্তব্য শেষে মন্ত্রীকে নারিকেল গাছ থেকে নামাতে বেশ বেগ পেতে হয়েছে সমর্থকদের। পরে তাকে এক অদ্ভ‚তদর্শন যন্ত্রের মাধ্যমে গাছ থেকে নামিয়ে আনা হয়। ",22/9/2020,international
ভিয়েতনামে নিয়মিত আন্তর্জাতিক ফ্লাইট পুনরায় চালু,"ভিয়েতনামে শনিবার সকাল থেকে নিয়মিত আন্তর্জাতিক ফ্লাইট পুনরায় চালু হয়েছে।



করোনা মহামারীর কারণে পাঁচ মাস বন্ধ থাকার পর এটি আবার চালু করা হয়।ভিয়েতনাম এয়ারলাইনসের প্রথম ফ্লাইটটি রাজধানী হ্যানয় থেকে জাপানের রাজধানী টোকিওর উদ্দেশ্যে ছেড়ে গেছে। বিমানটিতে ৬০ জন আরোহী ছিল। এদের অধিকাংশই ভিয়েতনামী ছাত্র ও কর্মী। এছাড়া এই বিমানে জাপানি নাগরিকও ছিল। ভিয়েতনাম বার্তা সংস্থার খবরে এ কথা বলা হয়।গত মার্চ মাসের শেষ দিকে ভিয়েতনাম সব আন্তর্জাতিক ফ্লাইট বন্ধ করে দেয়।দেশটিতে এ পর্যন্ত এক হাজার ৬৮ জন করোনা ভাইরাসে আক্রান্ত হয়েছেন। গত দুসপ্তাহেরও বেশি সময় ধরে স্থানীয় পর্যায়ে কোন সংক্রমণের খবর পাওয়া যায়নি বলে দেশটির স্বাস্থ্য মন্ত্রণালয় জানিয়েছে।",22/9/2020,international
অতিবেগুনি রশ্মি করোনা ধ্বংস করে: দাবি জাপানি গবেষকদের,"সম্প্রতি একদল বিজ্ঞানী দাবি করছেন, অতিবেগুনি রশ্মির সাহায্যে করোনাভাইরাসের জীবাণু সমূলে ধ্বংস করা সম্ভব।



আমেরিকান জার্নাল অব ইনফেকশন কন্ট্রোলে প্রকাশিত একটি প্রতিবেদনে হিরোশিমা বিশ্ববিদ্যালয়ের একদল বিজ্ঞানীর এই গবেষণাপত্রটি প্রকাশিত হয়েছে। খবর জি নিউজের।গবেষণাপত্রে বিজ্ঞানীদের দাবি, নির্দিষ্ট তরঙ্গদৈর্ঘ্যের অতিবেগুনি রশ্মির সাহায্যে ভাইরাসের জীবাণু সমূলে ধ্বংস করা গেলেও তা মানব শরীরের ক্ষেত্রে ক্ষতিকর নয়।হিরোশিমা বিশ্ববিদ্যালয়ের বিজ্ঞানীরা আরও বলেন, ২২২ ন্যানোমিটার তরঙ্গদৈর্ঘ্যের অতিবেগুনি রশ্মির সাহায্যে করোনার জীবাণু সমূলে ধ্বংস করা সম্ভব।বিজ্ঞানীদের দাবি, ২২২ ন্যানোমিটার তরঙ্গদৈর্ঘ্যের অতিবেগুনি রশ্মির প্রয়োগে ৯৯.৭ শতাংশ করোনার জীবাণুকেই ধ্বংস করা সম্ভব।গবেষণাপত্রে হিরোশিমা বিশ্ববিদ্যালয়ের গবেষক হিরোকি কিতাগাওয়া জানান, ভিট্রো পরীক্ষায় দেখা গিয়েছে ঠিক কী ভাবে নির্দিষ্ট তরঙ্গদৈর্ঘ্যের অতিবেগুনি রশ্মির বিকিরণে সার্স-কোভ-২ ভাইরাসকে নিষ্ক্রিয় করাহিয়েছে।এই পরীক্ষাটি করা হয়েছে ইউভিসি ল্যাম্পের সাহায্যে। একটি প্লেটে ভাইরাস মিশ্রিত দ্রবণের উপর অতিবেগুনি রশ্মি প্রয়োগ করে দেখেন গবেষকরা। বিজ্ঞানীরা জানান, ২২২ ন্যানোমিটার তরঙ্গদৈর্ঘ্যের অতিবেগুনি রশ্মি ৩০ সেকেন্ড ধরে প্রয়োগ করলে ৯৯.৭ শতাংশ করোনা জীবাণুকেই নিষ্ক্রিয় করা যাচ্ছে।জাপানের বিজ্ঞানীদের দাবি, ২২২ ন্যানোমিটার তরঙ্গদৈর্ঘ্যের অতিবেগুনি রশ্মি মানুষের চোখ অথবা ত্বকের কোনও ক্ষতি করে না।মানব দেহর অন্য জীবিত কোষের জন্যেও এই নির্দিষ্ট তরঙ্গদৈর্ঘ্যের অতিবেগুনি রশ্মি ক্ষতিকারক নয়। তবে গবেষকদের মতে, এই তরঙ্গদৈর্ঘ্যের অতিবেগুনি রশ্মির কার্যকারিতা ও সুরক্ষার বিষয়টি নিয়ে আরও গবেষণা প্রয়োজন।",22/9/2020,international
পদত্যাগের কয়েকদিন পর যুদ্ধ সমাধিমন্দির পরিদর্শন অ্যাবের,"জাপানের প্রধানমন্ত্রী হিসেবে এ সপ্তাহে পদত্যাগ করা শিনজো অ্যাবে শনিবার একটি যুদ্ধ সমাধিক্ষেত্র পরিদর্শন করেছেন।



প্রতিবেশী দেশগুলো এটিকে টোকিওর অতীতের কঠোর সামরিক ব্যবস্থার প্রতীক হিসেবে দেখে থাকে। বার্তা সংস্থা এএফপির খবরে এমন তথ্য জানা গেছে।অ্যাবে সর্বশেষ ২০১৩ সালের ডিসেম্বরে এ বিতর্কিত সমাধিক্ষেত্র পরিদর্শন করেন। এ ঘটনায় যুদ্ধকালীন শত্রু দেশ চীন ও দক্ষিণ কোরিয়া অ্যাবের কঠোর সমালোচনা করে এবং ঘনিষ্ঠ মিত্র দেশ যুক্তরাষ্ট্রের পক্ষ থেকে এক ব্যতিক্রমী কূটনৈতিক তিরষ্কার জানানো হয়।অ্যাবে শনিবার টোকিওর মধ্যাঞ্চলে অবস্থিত ওই সমাধিক্ষেত্রে কাঠের করিডোর বরাবর হেঁটে চলার নিজের একটি ছবি পোস্ট করেছেন। ছবিতে ডার্ক স্যুট পরিহিত অ্যাবেকে সাদা পোশাকের এক শিন্ত পুরোহিতকে পাহারা দিতে দেখা যায়।জাতীয়তাবাদী এ রাজনীতিবিদ বলেন, আজ আমি ইয়াসুকুনি সমাধিক্ষেত্রে আমার শ্রদ্ধা জ্ঞাপন এবং প্রধানমন্ত্রী হিসেবে আমার পদত্যাগপত্র যুদ্ধে জীবন বিসর্জন দেয়া বীর সৈনিকদের মূলনীতির প্রতি উৎসর্গ করছি।অ্যাবে গত মাসের শেষের দিকে স্বাস্থ্যজনিত জটিলতার কারণে পদত্যাগের ঘোষণা দেন এবং বুধবার ইয়োশিহিদ সুগা তার স্থলাভিষিক্ত হন।",22/9/2020,international
