বিদেশে থেকেও দুই শিক্ষক স্বপদে বহাল,"রামগঞ্জ উপজেলার সিরন্দী গ্রামের খাতুনে জান্নাত মহিলা দাখিল মাদ্রাসার আরবি শিক্ষক মাওলানা আতাউর রহমান ও ইংরেজি শিক্ষক রেশমা আক্তার গত দুই বছর থেকে আমেরিকা ও সুইডেনে বসবাস করলেও তারা ওই মাদ্রাসায় এখনও স্বপদে বহাল রয়েছেন। মাদ্রাসা সুপার মাওলানা মুরাদ হোসেন ও মাধ্যমিক শিক্ষা কর্মকর্তা মোনাজের হোসেনকে ম্যানেজ করেই ওই দুই শিক্ষক স্বপদে বহাল রয়েছেন বলে শিক্ষার্থীদের অভিভাবকরা ২০ সেপ্টেম্বর সকালে মাদ্রাসার সামনে উপস্থিত হয়ে বিক্ষোভ শেষে এসব অভিযোগ করেন। জানা যায়, ১৯৯০ সালে গ্রামের লোকজন ঐক্যবদ্ধ হয়ে বাঁশ, কাঠ ও টিন দিয়ে খাতুনে জান্নাত মহিলা মাদ্রাসাটি স্থাপন করেন। সেই থেকে ধারদেনা করে পরিচালিত হওয়ার এক পর্যায়ে সরকারি এমপিওভুক্ত হয়। এরপর মাওলানা মুরাদ হোসেন সুপার হিসেবে নিয়োগ পাওয়ার পর থেকে মাদ্রাসাটিতে বারবার সরকারি বরাদ্দ পাওয়ার পরও চরম অনিয়মের কারণে প্রতিষ্ঠানটিতে উন্নয়নের কোনো ছোঁয়া লাগেনি। এ ব্যাপারে মাদ্রাসার সুপার মাওলানা মুরাদ হোসেন বলেন, ‘ওই দুই শিক্ষক করোনাকালীন, মাতৃত্বকালীন, মেডিকেলসহ সব ধরনের ছুটিতে রয়েছেন। হুট করে কোনো শিক্ষককে চাকরিচ্যুত করা সম্ভব নয়। গত এক মাস আগে থেকে ম্যানেজিং কমিটির সিদ্ধান্ত মোতাবেক তাদের বেতন-ভাতা স্থগিত করা হয়েছে। তাছাড়া ওই দুই শিক্ষককে তড়িঘড়ি করে কারণ দর্শানোর নোটিশ করলে তারা আমাদের বিরুদ্ধে মামলা করতে পারেন। তাই একটু ভেবেচিন্তে কাজ করতে হবে।’ রামগঞ্জ উপজেলা মাধ্যমিক শিক্ষা কর্মকর্তা মো. মোনাজের হোসেন বলেন, ‘আমার জানামতে শিক্ষকরা একটানা তিন বছর ধরে ছুটি নিতে পারবেন। তবে ওই সময়ের ভেতর কর্মস্থলে যোগদান করলে কোনো সমস্যা নেই। কিন্তু ছুটিকালীন কোনো বেতন-ভাতা নেয়া যাবে না।’



",22/9/2020,various
পরিপত্রের দোহাইয়ে ভর্তিতে আদায় ১৫ লাখ টাকা,"বাকেরগঞ্জ সরকারি কলেজের একাদশ শ্রেণিতে ভর্তিতে পরিপত্রের দোহাই দিয়ে শিক্ষার্থীদের কাছ থেকে প্রায় ১৫ লাখ টাকা নেয়ার অভিযোগ উঠছে কলেজ কর্তৃপক্ষে বিরুদ্ধে।



জানা গেছে, গত ১৩ অক্টোবর থেকে একাদশ শ্রেণির ভর্তি কার্যক্রম শুরু হয়। জনতা ব্যাংক বাকেরগঞ্জ শাখায় কলেজের ব্যাংক অ্যাকাউন্টে কলেজের স্লিপে বিজ্ঞান বিভাগে ২ হাজার ৪৯৫ টাকা, বাণিজ্যিক ও মানবিক বিভাগে ২ হাজার ৪৪৫ টাকা করে জমা নেয়া হচ্ছে। এ পর্যন্ত সাড়ে প্রায় ৫০০ শিক্ষার্থী ভর্তি নেয়া হয়েছে।বাংলাদেশ আন্তঃশিক্ষা বোর্ড সমন্বয় সাব-কমিটি ২০২০-২১ একাদশ শ্রেণির ভর্তির নীতিমালা অনুযায়ী ভর্তি ফি নিতে হবে। এক্ষেত্রে উপজেলা শহরের বেসকারি কলেজে এক হাজার টাকা নেয়ার বিধান রয়েছে।এ বিষয়ে জানতে চাইলে বরিশাল শিক্ষা বোর্ডের এক জ্যেষ্ঠ কর্মকর্তা যুগান্তরকে জানান, ‘মূলত বেসরকারি কলেজের লাগাম টানতে এ নীতিমালা করা হয়েছে।ইতিপূর্বে বেশকিছু বেসরকারি কলেজের বিরুদ্ধে ভর্তির সময় অতিরিক্ত টাকার নেয়ার অভিযোগ আছে। যার ফলে বাংলাদেশ আন্তঃশিক্ষা বোর্ড সমন্বয় সাব-কমিটি প্রতি বছর একটি নিতিমালা করে দেন।তবে সরকারি কলেজে বেসরকারি কলেজের চেয়ে বেশি নেয়ার সুযোগ নেই।’ তবে কলেজ কর্তৃপক্ষের ভাষ্য, সরকারি পরিপত্রে যা আছে সে অনুযায়ী টাকা নেয়া হচ্ছে।কিন্তু কলেজ কর্তৃপক্ষ পরিপত্রের দোহাই দিয়ে যে ২৬টি খাতে টাকা নিচ্ছে তা কলেজ বন্ধ থাকায় বেশিরভাগই অর্থহীন বলে মনে করেন অভিভাবক মহল।ওই খাতগুলোর মধ্যে রয়েছে- জুলাই ২০১৯ থেকে জুন ২০২০ গ্রন্থাগার ফি, বিজ্ঞানাগার ফি, অর্ধবার্ষিক ও বার্ষিক পরীক্ষার ফি, উন্নয়ন ফি, আইসিটি ফি, চিকিৎসাসেবা তহবিল, সাহিত্য ও সাংস্কৃতিক ফি।শিক্ষার্থী ও অভিভাবকরা বলছেন, করোনাকালীন কলেজ বন্ধ থাকার পরও একইভাবে ২৬টি খাতে টাকা নেয়ার কোনো যুক্তি নেই। কলেজ বন্ধ থাকার কারণে এর মধ্যে কিছু খাত আছে যা একেবারেই অহেতুক।এ ব্যাপারে কলেজের অধ্যক্ষ মো. জসিম উদ্দিন বলেন, ‘পরিপত্র অনুযায়ী টাকা নেয়া হচ্ছে। এখানে অতিরিক্ত কোনো টাকা নেয়ার সুযোগ নেই। প্রয়োজন হলে কলেজে এসে পরিপত্র দেখে যেতে পারেন।’",22/9/2020,various
মালেকসহ ২০ জনের সম্পদের হিসাব তলব,"বিপুল পরিমাণ অবৈধ সম্পদ অর্জনের অভিযোগ যাচাই করতে স্বাস্থ্য অধিদফতর ও দেশের কয়েকটি মেডিকেল কলেজ হাসপাতালের ১২ কর্মকর্তা-কর্মচারী এবং তাদের স্বামী/স্ত্রীসহ ২০ জনের সম্পদের হিসাব চেয়েছে দুদক। তালিকায় স্বাস্থ্য অধিদফতরের সাবেক মহাপরিচালক আবুল কালাম আজাদের গাড়িচালক শতকোটি টাকার মালিক আবদুল মালেকের নামও রয়েছে। দুদক পরিচালক সৈয়দ ইকবাল হোসেনের স্বাক্ষরে সোমবার তাদের ঠিকানায় চিঠি পাঠানো হয়েছে। নোটিশ পাওয়ার ২১ কার্যদিবসের মধ্যে সবাইকে তাদের স্থাবর-অস্থাবর সম্পদের হিসাব ও পোষ্যদের নামে থাকা সম্পদের হিসাব দিতে বলা হয়েছে। বিষয়টি যুগান্তরকে নিশ্চিত করেছেন দুদকের পরিচালক (জনসংযোগ) প্রণব কুমার ভট্টাচার্য।



যাদের সম্পদের হিসাব চাওয়া হয়েছে: স্বাস্থ্য অধিদফতরের হিসাবরক্ষণ কর্মকর্তা মো. মজিবুল হক মুন্সি ও তার স্ত্রী রিফাত আক্তার, অধিদফতরের ডাটা এন্ট্রি অপারেটর তোফায়েল আহমেদ ভূইয়া ও তার স্ত্রী খাদিজা আক্তার, গাড়িচালক মো. আবদুল মালেক ও তার স্ত্রী নার্গিস বেগম, গোপালগঞ্জ ৫০ শয্যা জেনারেল হাসপাতালের প্রশাসনিক কর্মকর্তা মো. ওবাইদুর রহমান ও তার স্ত্রী বিলকিস রহমান, ফরিদপুর মেডিকেল কলেজের স্টাফ নার্স রেহেনা আক্তার, রংপুর মেডিকের কলেজ হাসপাতালের হিসাবরক্ষক মো. ইমদাদুল হক ও তার স্ত্রী উম্মে রুমান ফেন্সী, জাতীয় হৃদরোগ ইনস্টিটিউটের প্রশাসনিক কর্মকর্তা (চলতি দায়িত্ব) মো. মাহমুদুজ্জামান ও তার স্ত্রী সাবিনা ইয়াছমিন, গাজীপুর শহীদ তাজউদ্দীন মেডিকেল কলেজ হাসপাতালের স্টোর অফিসার মো. নাজিম উদ্দিন ও তার স্ত্রী ফিরোজা বেগম, স্বাস্থ্য অধিদফতরের অফিস সহকারী (হাসপাতাল ও ক্লিনিকসমূহ) কামরুল হাসান ও তার স্ত্রী ডা. উম্মে হাবিবা, গোপালগঞ্জ শেখ সায়েরা খাতুন মেডিকেল কলেজের স্টেনোগ্রাফার-কাম-কম্পিউটার অপারেটর মো. সাইফুল ইসলাম, স্বাস্থ্য অধিদফতরের বরিশাল বিভাগীয় কার্যালয়ের সহকারী প্রধান পরিসংখ্যান কর্মকর্তা মীর রায়হান আলী ও রাজশাহী মেডিকেল কলেজ হাসপাতালের হিসাবরক্ষক মো. আনোয়ার হোসেন। এ ২০ জনের মধ্যে গাড়িচালক আবদুল মালেককে গ্রেফতার করেছে র‌্যাব। তার স্বীকারোক্তি মোতাবেক ৪টি ফ্ল্যাট, ১০টি প্লট, কামারপাড়ায় ১ বিঘা জমি, ১০ কাঠা জায়গার ওপর ৭তলা বাড়ি ও ১০তলা বাণিজ্যিক ভবন, গবাদি পশুর বৃহৎ খামার, মেয়ের নামে মাছের ঘের ও পরিবহন ব্যবসা রয়েছে। এই সম্পদের পরিমাণ প্রায় শতকোটি টাকা।দুদক পরিচালক সৈয়দ ইকবাল হোসেন স্বাক্ষরিত নোটিশে বলা হয়েছে, ‘২০০৪ সালের দুর্নীতি দমন কমিশন আইনের ধারা ২৬-এর উপধারা (১) দ্বারা অর্পিত ক্ষমতাবলে তাদের নিজের এবং তাদের ওপর নির্ভরশীল ব্যক্তিবর্গের স্বনামে/বেনামে অর্জিত যাবতীয় স্থাবর/অস্থাবর সম্পত্তির হিসাব দিতে হবে। এছাড়া সবার দায়দেনা, আয়ের উৎস ও তা অর্জনের বিস্তারিত বিবরণী এ আদেশ প্রাপ্তির ২১ কার্যদিবসের মধ্যে নির্ধারিত ছকে দাখিল করার নির্দেশ দেয়া হল। নির্ধারিত সময়ের মধ্যে সম্পদবিবরণী দাখিল করতে ব্যর্থ হলে অথবা মিথ্যা বিবরণী দাখিল করলে দুদক আইনের ২৬(২) উপধারায় তাদের বিরুদ্ধে ব্যবস্থা নেয়া হবে।’",22/9/2020,various
নেপালের ভূখণ্ড দখল করে চীনের ভবন নির্মাণ!,"নেপালের ভূখণ্ড দখল করে ৯টি ভবন নির্মাণের অভিযোগ উঠেছে চীনের বিরুদ্ধে। নেপালের হুমলা জেলার লাপচা-লিমি এলাকায় ওই ভবনগুলো নির্মাণ করা হয়েছে বলে জানিয়েছেন সহকারী জেলা (হুমলা) কর্মকর্তা ডালবাহাদুর হামাল। খবর ইকোনমিক টাইমস ও জাস্টআর্থনিউজসহ বিভিন্ন সংবাদমাধ্যমের। খবরে বলা হয়, ডালবাহাদুর হামাল ৩০ আগস্ট থেকে ৯ সেপ্টেম্বর পর্যন্ত ওই এলাকা পরিদর্শন করেন। লামা-লিমি দুর্গম এলাকা হওয়ায় সেখানে সরকারের তেমন কোনো নজরদারি বা প্রভাব নেই। এই সুযোগে চীন নেপাল সীমান্তের অন্তত এক কিলোমিটার ভেতরে ঢুকে ওইসব ভবন নির্মাণ করে। বিষয়টি নিয়ে ডালবাহাদুর হামাল নেপালের স্বরাষ্ট্র মন্ত্রণালয়ে একটি প্রতিবেদন দিয়েছেন। সেখান থেকে তা দেশটির পররাষ্ট্র মন্ত্রণালয়ে পাঠানো হয়েছে।



ওই পরিদর্শন দলে থাকা একজন নাম প্রকাশ না করে সংবাদমাধ্যমকে বলেন, ‘চীনের তৈরি ভবনগুলো দূর থেকেও দেখা যায়। আমরা প্রথমে লাপচা-লিমি এলাকায় চীন একটি বিল্ডিং তৈরি করেছে বলে খবর পেয়েছিলাম। কিন্তু গোটা এলাকা দূর থেকে ঘুরে দেখে আরও আটটি নতুন বিল্ডিং দেখতে পেয়েছি।’কিছুদিন আগে একই এলাকা পরিদর্শনে যান নামখা গ্রামের পৌরসভা চেয়ারম্যান বিষ্ণু বাহাদুর লামা। তিনি সংবাদমাধ্যমকে জানিয়েছেন, সম্প্রতি সীমান্তবর্তী এলাকায় এতগুলো ভবন কে তৈরি করেছে, তা জানতে সেখানে যান তিনি। তবে তাকে ওই অঞ্চলে প্রবেশ করতে দেয়নি চীনের সেনাবাহিনী। পরে বহু দূর থেকে চীনের ওইসব ভবনের ছবি তোলেন তিনি।হুমলার প্রধান জেলা কর্মকর্তা চিরঞ্জিবী গিরি জানিয়েছেন, তারা ঘটনাটি শুনেছেন। নেপালি সেনা, পুলিশ ও জাতীয় তদন্ত সংস্থার কর্মকর্তা এবং নামখা গ্রামের পৌরসভা চেয়ারম্যানকে নিয়ে তারা লাপচা-লিমি এলাকা পরিদর্শনে যাওয়ার প্রস্তুতি নিচ্ছেন।এর আগে গেল জুনে নেপালের ভূমি ও কৃষি মন্ত্রণালয় থেকে প্রকাশিত একটি রিপোর্টে জানা যায়, ডোলাখা, গোর্খা, দারচুলা, হুমলা, সিন্ধুপালচক, সঙ্খুওয়াভা ও রাসুয়া জেলার বেশ কয়েকটি গ্রাম এবং ফাঁকা এলাকায় আধিপত্য বিস্তার করেছে চীন। ডোলাখা জেলায় আন্তর্জাতিক সীমান্ত থেকে দেড় হাজার মিটার ভেতরে ঢুকে নেপালের বিস্তীর্ণ অঞ্চল নিজেদের দখলে নিয়েছে তারা। পরে অবশ্য নেপালের বিদেশ মন্ত্রণালয়ের তরফে একটি বিবৃতি প্রকাশ করে জানানো হয়, তাদের দেশের জমি চীন দখল করছে বলে যে খবর সংবাদমাধ্যমে প্রকাশিত হচ্ছে তা পুরোপুরি ভিত্তিহীন। এ বিষয়ে তাদের দেশের কৃষি ও পশুপালন মন্ত্রণালয়ের যে রিপোর্টের কথা উল্লেখ করা হচ্ছে তারও কোনো অস্তিত্ব নেই।",22/9/2020,various
তিস্তার পানি বণ্টন নিয়ে ইতিবাচক অগ্রগতি হয়েছে,"তিস্তাসহ অভিন্ন নদীর পানি বণ্টনের আলোচনায় ইতিবাচক অগ্রগতি হয়েছে বলে জানিয়েছেন আওয়ামী লীগ সাধারণ সম্পাদক এবং সড়ক পরিবহন ও সেতুমন্ত্রী ওবায়দুল কাদের। তিনি বলেন, প্রতিবেশী দেশের সঙ্গে সুসম্পর্ক ও পারস্পরিক বোঝাপড়া ভালো থাকলে যে কোনো সমস্যার সমাধান সহজতর হয়। সীমান্ত সমস্যা ও ছিটমহল বিনিময়ের মতো দীর্ঘকালীন সমস্যার সমাধান তারই উদাহরণ।



সোমবার দুপুরে সচিবালয়ে বাংলাদেশে ভারতের হাইকমিশনার রীভা গাঙ্গুলি দাশের বিদায়ী সৌজন্য সাক্ষাৎ শেষে ব্রিফিংয়ে তিনি এসব কথা জানান। এ সময় ভারতীয় ঋণ কর্মসূচির আওতায় দেশের সড়ক অবকাঠামো উন্নয়ন, বিআরটিসি’র জন্য বাস ও ট্রাক এবং সড়ক উন্নয়নে যন্ত্রপাতি সংগ্রহে অর্থায়নের জন্য প্রধানমন্ত্রীর পক্ষ থেকে ভারত সরকারকে ধন্যবাদ জানান মন্ত্রী।তিনি বলেন, বাংলাদেশ ও ভারতের মধ্যে বন্ধুত্বপূর্ণ সম্পর্ক বহুমাত্রিক। একুশ বছর দু’দেশের মধ্যে সম্পর্কের যে কৃত্রিম দেয়াল ছিল, তা এখন আর নেই। দু’দেশের সরকার এবং জনগণের মাঝে সম্পর্ক উন্নয়নে বাংলাদেশ ও ভারতের প্রধানমন্ত্রী অত্যন্ত উদার এবং ভবিষ্যৎমুখী। দেশের সড়ক যোগাযোগ অবকাঠামো উন্নয়নে ভারতীয় ঋণ কর্মসূচির আওতায় গৃহীত প্রকল্পসমূহ এগিয়ে নিতে সড়ক পরিবহন ও সেতু মন্ত্রণালয়ের সহযোগিতার জন্য হাইকমিশনার মন্ত্রীকে ধন্যবাদ জানান।",22/9/2020,various
