‘বঙ্গবন্ধুকে জাতির পিতা ঘোষণা করতে চেয়েছিলেন এরশাদ’,"জাতীয় পার্টির চেয়ারম্যান জিএম কাদের বলেছেন, ‘জাতীয় পার্টির প্রতিষ্ঠাতা এইচএম এরশাদ বঙ্গবন্ধুকে জাতির পিতা ঘোষণা করতে চেয়েছিলেন। তবে রাজনৈতিক প্রেক্ষাপটে সেটা সম্ভব হয়নি। রাজনৈতিক বাস্তবতার কারণে অনেক সময় সত্য কথা ও কাজ করা যায় না। সে কারণেই শেষ পর্যন্ত বঙ্গবন্ধুকে জাতির পিতা ঘোষণা করতে পারেননি এইচএম এরশাদ।’



শনিবার জাতীয় শোক দিবস উপলক্ষে জাতীয় পার্টি আয়োজিত এক আলোচনা সভায় তিনি এসব কথা বলেন।তিনি বলেন, বঙ্গবন্ধু কোনো দলের নয়; তিনি জাতির সম্পদ। দেশের স্বার্থে কোন আপোষ করেননি। তাই দেশের সকল রাজনীতিকদের তার কাছ থেকে শিক্ষা নেয়া উচিত। বঙ্গবন্ধু জাতিকে ঐক্যবদ্ধ নয়; সম্মোহিত করেছেন। উদ্বুদ্ধ করেছেন। তার কথায় প্রাণ দিয়েছে লাখো মানুষ। বঙ্গবন্ধুর কাছ থেকে দেশপ্রেম শিখতে হবে। বঙ্গবন্ধু কাউকে ছাড় দিয়ে কথা বলতেন না। বঙ্গবন্ধুর ভাল দিকগুলো সবার গ্রহণ করতে হবে।এসময়, করোনা পরিস্থিতিতে স্বাস্থ্যখাতের সমন্বয়হীনতা দূর করতে কমিটি গঠন করার আহ্বান জানিয়ে জিএম কাদের বলেন, স্বাস্থ্যমন্ত্রীকে বলতে শুনেছি কোভিড হাসপাতালগুলো নন কোভিড করা হবে। আবার নানা জায়গায় শুনছি হাসপাতাল খালি করো শোক দিবস পালন করা হবে। এটা জাতির পিতার শিক্ষা নয়।",21/9/2020,politics
কাউন্সিলে নির্ধারণ হবে হেফাজতের পরবর্তী আমীর,"হেফাজতে ইসলামের আমীর আল্লামা আহমদ শফীর মৃত্যুর পর পরবর্তী আমীর কে হবেন তা নিয়ে শুরু হয়েছে আলোচনা। এখনও পর্যন্ত এ বিষয়ে সুস্পষ্টভাবে কারও নাম প্রকাশ্যে আসেনি। তবে শিগগিরই আমীর নির্বাচনের প্রক্রিয়াটি শুরু হয়ে যেতে পারে বলে আভাস মিলেছে।



আর তা হবে কাউন্সিলের মাধ্যমে। সংগঠনটির মহাসচিব আল্লামা জুনায়েদ বাবু নগরী জানিয়েছেন, কাউন্সিলের মাধ্যমে আল্লামা শফীর উত্তরসূরি নির্ধারণ করা হবে।শুক্রবার মধ্য রাতে হেফাজতের প্রধান কার্যালয় হাটহাজারী দারুল উলুম মুঈনুল ইসলাম মাদ্রাসায় সাংবাদিকদের সঙ্গে আলাপকালে তিনি এ তথ্য জানান। ২০১০ সালের ১৯ জানুয়ারি দারুল উলুম মুঈনুল ইসলাম মাদ্রাসার মহাপরিচালক আল্লামা আহমদ শফীর নেতৃত্বে যাত্রা শুরু করে কওমি মাদ্রাসাভিত্তিক অরাজনৈতিক সংগঠন হেফাজতে ইসলাম। শুরু থেকেই এর কার্যালয় হিসেবে ব্যবহৃত হচ্ছে হাটহাজারী মাদ্রাসা। প্রতিষ্ঠার পর থেকে আল্লামা শফী সংগঠনটির আমীর ও একই মাদ্রাসার শিক্ষক জুনায়েদ বাবু নগরী মহাসচিবের দায়িত্ব পালন করে আসছেন।শুক্রবার সন্ধ্যায় ঢাকার একটি হাসপাতালে চিকিৎসাধীন অবস্থায় ইন্তেকাল করেন হেফাজত আমীর আহমদ শফী।",21/9/2020,politics
শরীর পারমিট না করলেও ডা. জাফরুল্লাহ থেমে থাকেন না: স্ত্রী ,"গণস্বাস্থ্য কেন্দ্রের প্রতিষ্ঠাতা ট্রাস্টি ডা. জাফরুল্লাহ চৌধুরীর স্ত্রী শিরীন হক জানিয়েছেন, তার স্বামী শারীরিকভাবে সুস্থ নন। তবে শরীর পারমিট না করলেও ডা. জাফরুল্লাহ থেমে থাকেন না।



শনিবার গণমাধ্যমকে তিনি একথা জানান।নারী নেত্রী শিরীন হক বলেন, ডা. জাফরুল্লাহ শারীরিক জটিলতার কারণে শুক্রবার নিয়মিত ডায়ালাইসিস নিতে পারেননি। তারপরও দায়িত্ববোধ থেকেই তিনি ছুটে বেড়াচ্ছেন, মানুষের জন্য কাজ করছেন। তার যে শারীরিক অবস্থা তাতে বিশ্রামের কোনো বিকল্প নেই।ভারতের পেঁয়াজ রফতানি বন্ধের প্রতিবাদসহ কয়েকটি দাবিতে গত বৃহস্পতিবার দুপুরে জাতীয় প্রেস ক্লাবের সামনে এক মানববন্ধনে বক্তব্য দেয়ার কিছুক্ষণের মধ্যেই অসুস্থ হয়ে হঠাৎ বসে পড়েন ডা. জাফরুল্লাহ। সেখান থেকে তাকে গণস্বাস্থ্য নগর হাসপাতালে নেয়া হয়।এ বিষয়ে শিরিন হক বলেন, গতকাল (শুক্রবার) সারাদিন চিকিৎসকদের পরামর্শে বিশ্রামে ছিলেন ডা. জাফরুল্লাহ। তার রক্ত চাপ ছিল স্বাভাবিকের চেয়ে কম। এ কারণে কিডনি জটিলতায় শুক্রবার তিনি যে নিয়মিত ডায়ালাইসিস নেন, তা দেয়া সম্ভব হয়নি।দেশে করোনাভাইরাস সংক্রমণ শুরু হওয়ার পর থেকেই প্রাণঘাতী ভাইরাসটি শনাক্তে কিটসহ বিভিন্ন বিষয় নিয়ে ঝাঁপিয়ে পড়েন ডা. জাফরুল্লাহ। একপর্যায়ে নিজেই করোনায় আক্রান্ত হন। প্লাজমা থেরাপি ও নিয়মিত চিকিৎসা নেয়ার পর তিনি করোনামুক্ত হন। কিন্তু করোনায় তার ফুসফুসের নিউমোনিয়া, হৃদরোগসহ বেশকিছু শারীরিক জটিলতা সৃষ্টি করে।তার স্ত্রী শিরীন হক বলেন, তিনি (ডা. জাফরুল্লাহ) মূলত মানসিক শক্তির জোরে কাজ করে চলেছেন। মন দিয়েই কাজ করেন। কিন্তু, এখন তার অনেক বেশি বিশ্রাম প্রয়োজন।",21/9/2020,politics
হাটহাজারীর আন্দোলনরত শিক্ষার্থীদের সঙ্গে ভিপি নুরের সংহতি,"চট্টগ্রামের হাটহাজারী মাদ্রাসায় আন্দোলনরত শিক্ষার্থীদের সঙ্গে সংহতি প্রকাশ করেছেন ঢাকা বিশ্ববিদ্যালয় কেন্দ্রীয় ছাত্র সংসদের (ডাকসু) সাবেক ভিপি নুরুল হক নুর।



তিনি বলেন, আমরা ৫ মে’র মতো আরেকটি ঘটনার আশঙ্কা করছি। আজকে যদি হাটহাজারীতে কোনো হামলা হয় তাহলে পুরো ঢাকা শহর অচল করে দেয়া হবে।বৃহস্পতিবার শিক্ষাপ্রতিষ্ঠানে সরকারদলীয় প্রভাব মুক্ত রাখার জন্য এবং হাটহাজারী মাদ্রাসার ছাত্রদের আন্দোলনের প্রতি সমর্থন জানিয়ে ‘ঢাকা বিশ্ববিদ্যালয়ের শিক্ষার্থী’ ব্যানারে আয়োজিত এক মানববন্ধনে তিনি এসব কথা বলেন। মানববন্ধনে আরও বক্তব্য দেন- যুব অধিকার পরিষদের সদস্য সচিব ফরিদুল হক, ছাত্র অধিকার পরিষদের যুগ্ম-আহ্বায়ক সোহরাব হোসেন, ঢাকা বিশ্ববিদ্যালয় শাখার সভাপতি বিন ইয়ামিন মোল্লা, জাহাঙ্গীরনগর বিশ্ববিদ্যালয়ের সভাপতি আরমান হোসাইন, ইশা ছাত্র আন্দোলনের পাবলিক বিশ্ববিদ্যালয় সম্পাদক এম সুহেব হোসেনসহ আরও অনেকে।নুরুল হক নুর বলেন, ছাত্ররা তাদের যৌক্তিক দাবি-দাওয়া নিয়ে আন্দোলন করতেছে। কোনো সুস্থ বিবেক সম্পন্ন মানুষ বলতে পারবে না যে তাদের দাবিগুলো অযৌক্তিক। আমি তাদের দাবিগুলো পড়েছি। সেখানে মাদ্রাসার যে সর্বোচ্চ নীতিনির্ধারণী সভা ‘মজলিসে শুরা’ রয়েছে তাদের ওপর দায়িত্ব অর্পণ করার আহ্বান জানিয়েছে। 
",21/9/2020,politics
ভারতের তীব্র সমালোচনায় ডা. জাফরুল্লাহ,"হঠাৎ পেঁয়াজ রফতানি বন্ধ করে দেয়ায় ভারতের তীব্র সমালোচনা করেছেন গণস্বাস্থ্য কেন্দ্রের প্রতিষ্ঠাতা ট্রাস্টি ডা. জাফরুল্লাহ চৌধুরী। তিনি বলেন, ভারত নজর দিয়েছে কী করে বাংলাদেশকে অর্থনৈতিকভাবে পর্যুদস্ত করা যায়। তারা ষড়যন্ত্র করছে। সেজন্য তারা সব আন্তর্জাতিক নিয়মাবলী অস্বীকার করে হঠাৎ পেঁয়াজ রফতানি বন্ধ করে দিয়েছে।



ডা. জাফরুল্লাহ বলেন, এভাবে চলতে পারে না। ভারতকে একটা ফাইনাল ওয়ার্নিং দেয়া দরকার। আমাদের এর বিরুদ্ধে সোচ্চার হতে হবে। চলুন আমরা সবাই একত্রিত হয়ে ভারতের বিরুদ্ধে রুখে দাঁড়াই।বৃহস্পতিবার রাজধানীর জাতীয় প্রেস ক্লাবের সামনে ‘রণাঙ্গনের মুক্তিযোদ্ধা’ ও ‘মুক্তিযুদ্ধের প্রজন্মের' উদ্যোগে আয়োজিত এক মানববন্ধনে তিনি এসব কথা বলেন। পেঁয়াজসহ নিত্যপ্রয়োজনীয় দ্রব্যমূল্য বৃদ্ধি ও সরকারের নতজানু পররাষ্ট্র নীতির প্রতিবাদে এ মানববন্ধন হয়।ডা. জাফরুল্লাহ চৌধুরী বলেন, ভারত বাংলাদেশের জনগণকে বিচ্ছিন্ন করতে চায়। তারা সুকৌশলে আমার দেশের দুই নেত্রীকে বন্দি করে রেখেছে। খালেদা জিয়াকে গুলশানে এবং শেখ হাসিনাকে আমলা দ্বারা আবদ্ধ করে রেখেছে। এভাবে চলতে পারে না।বিএনপির যুগ্ম মহাসচিব সৈয়দ মোয়াজ্জেম হোসেন আলাল বলেন, এই সরকার বলে ভারতের সঙ্গে বাংলাদেশের রক্তের সস্পর্ক। অথচ ভারত-বাংলাদেশ সীমান্তে বিএসএফের গুলিতে প্রায়শই মানুষ হত্যা করা হচ্ছে। পৃথিবীর অন্য কোনো দেশের সীমান্তে এভাবে মানুষ হত্যা হয় না। সরকারের নতজানু পররাষ্ট্র নীতিই এজন্য দায়ী।নাগরিক ঐক্যের আহ্বায়ক মাহমুদুর রহমান মান্না বলেন, দেশে সমস্ত জিনিসের দাম বেড়েছে। দেশে কোনো বিনিয়োগ নেই, দেশে কোনো শিক্ষা ব্যবস্থা নেই। কোনো স্কুল-কলেজ খুলে না, বিনা পরীক্ষায় পাস। দেশের অর্থনীতির অবস্থা কী? সরকারের কাছে টাকা নেই। সরকারের প্রধানমন্ত্রী বলছেন- বাংলাদেশ ব্যাংকের রিজার্ভ থেকে কিছু টাকা দাও। সবাই বলছে রিজার্ভ থেকে কি টাকা দেয়া যায়, কেউ দেয় না কখনও। এখন কোনো কথা বলছেন না। কী করবে? তাদের কাছে টাকাই তো নেই।তিনি বলেন, ফরিদপুরে ছাত্রলীগের সভাপতি-সাধারণ সম্পাদক মাত্র দুই বছরে দুই হাজার কোটি টাকা কামাই করেছে। ওরা চোর, ডাকাত, লুটেরা- দেশের টাকা লুটপাট করে বিদেশে পাঠাচ্ছে। এ সরকারকে জনগণ আর চায় না।
",21/9/2020,politics
