কোভিড-১৯: ব্রাজিলে আক্রান্ত ৪০ লাখ ছাড়াল,"করোনাভাইরাসের প্রাদুর্ভাব বেড়েই চলছে ব্রাজিলে। ইতিমধ্যে সংক্রমণ ৪০ লাখ ছাড়িয়ে গেছে লাতিন আমেরিকার দেশটিতে। সবশেষ চব্বিশ ঘণ্টায় প্রায় ৪৪ হাজারের বেশি মানুষ আক্রান্ত শনাক্ত হয়েছেন।



বিশ্বব্যাপী করোনায় আক্রান্ত ও মৃত্যুর তথ্য রাখা আন্তর্জাতিক ওয়েবসাইট ওয়ার্ল্ডোমিটারের তথ্যানুযায়ী, কোভিড-১৯ এ শুক্রবার সকাল সাড়ে ৯ টা পর্যন্ত ব্রাজিলে আক্রান্ত শনাক্ত হয়েছেন ৪০ লাখ ৪৬ হাজার ১৫০ জন। মৃত্যু হয়েছে ১ লাখ ২৫ হাজার ৭২৯ জনের। আর সুস্থ্ হয়ে উঠেছেন ৩২ লাখ ৪৭ হাজার ৪৭ হাজার ৬১০ জন।করোনাভাইরাসে সংক্রমণ ও মৃত্যুতে যুক্তরাষ্ট্রের পরেই ব্রাজিলের অবস্থান। ৬৩ লাখ ছাড়ানো আক্রান্ত নিয়ে শীর্ষে আছে যুক্তরাষ্ট্র।ব্রাজিলে প্রথম কোভিড-১৯ সংক্রমণের খবর আসে ২৬ ফেব্রুয়ারি। চব্বিশ ঘণ্টায় ব্রাজিলে আক্রান্তদের মধ্যে আরও ৮৩৪ জনের মৃত্যু হয়েছে। এই নিয়ে দেশটিতে করোনায় মোট মৃতের সংখ্যা দাঁড়িয়েছে ১ লাখ ২৪ হাজার।শনাক্তের মতো মৃত্যুর বৈশ্বিক তালিকায়ও দ্বিতীয়স্থানে লাতিন আমেরিকার দেশটি। ১ লাখ ৯১ হাজার মৃত্যু নিয়ে তাতেও শীর্ষে যুক্তরাষ্ট্র।তবে ব্রাজিলের স্বাস্থ্য মন্ত্রণালয়ের দাবি, দেশে করোনা সংক্রমণের হার গত কিছুদিন ধরে কমতির দিকে। তাদের বিশ্বাস, আক্রান্তের সর্বোচ্চ পর্যায়টা পেরিয়ে এসেছে তারা।কিছুদিন আগেও ব্রাজিলে করোনায় আক্রান্তদের মধ্যে প্রতিদিন ১ হাজারের বেশি মানুষের মৃত্যু হতো। আগস্ট থেকে প্রাণহানির সংখ্যাটা আটশোর ঘরে নেমে এসেছে।এদিকে, সবশেষ চব্বিশ ঘণ্টায় বিশ্বে করোনাভাইরাসে আক্রান্তের সংখ্যা বেড়ে ২ কোটি ৬৪ লাখ ছাড়িয়েছে; মৃত্যু বেড়ে দাঁড়িয়েছে ৮ লাখ ৭৩ হাজার।",22/9/2020,international
"বিশ্বের সবচেয়ে প্রবীণ দম্পতি, ৮০ বছর সংসার (ভিডিও)","প্রায় ৮০ বছর ধরে একসঙ্গে সংসার করে বিশ্বের সবচেয়ে প্রবীণ দম্পতি হিসেবে গিনেজ ওয়ার্ল্ড বুকে নাম লিখিয়েছেন এক দম্পতি। তারা হলেন, ইকুয়েডরের ১১০ বছর বয়সী নাগরিক জুলিও সিজার মোরা ও তার ১০৫ বছর বয়সী স্ত্রী ওয়াড্রামিনা ম্যাক্লোভিয়া। এ দম্পতি এখনো সুস্থ রয়েছেন।



সংবাদ মাধ্যম ইউএস ওয়ার্ল্ড জানিয়েছে, দুজনেই শিক্ষকতা করতেন। এখন অবসরে গেছেন। দুজনে মিলে ২১৪ বছর বেঁচে আছেন। গত শনিবারের হিসাব অনুযায়ী তাদের বিবাহিত জীবন ৭৯ বছর ৬ মাস ২২ দিন। তবে তাদের ভালোবাসার গোপন তথ্য ফাঁস করেছেন উভয়েই। তারা বলেছেন, উভয়ের মধ্যে ভালোবাসা + পরিপক্কতা + পারস্পরিক শ্রদ্ধা থাকতে হবে। সিএনএন জানিয়েছে, ১৯৪১ সালে ভালোবেসে একে অপরকে বিয়ে করেন। যদিও সেসময় দুই পরিবার থেকে তাদের এ সম্পর্ককে মেনে নেওয়া হয়নি। বিয়ের আগে তারা বন্ধু ছিলেন। বোনের বিয়েতে ভগ্নীপতির কাজিনের সঙ্গে বন্ধুত্বের সাত বছর পর বিবাহ বন্ধনে আবদ্ধ হন তারা। সালটি ছিল ১৯৪১ সালের ৭ ফেব্রুয়ারি। বর্তমানে ৫ ছেলে-মেয়ে ও ১১ নাতি-নাতনি ও তাদেরও ছেলে-মেয়ে মিলে বিশাল এক সংসার এ দম্পতির। ছেলে মেয়েদের সবাই কলেজ পর্যায়ের ডিগ্রি অর্জন করেছেন। দম্পতির এক মেয়ে অরা সিসিলিয়া জানান, তাদের মা-বাবা এখনও একসঙ্গে সিনেমা দেখেন, থিয়েটারে যান, বাগান করেন, এমনকি প্রাত:রাশ কিংবা রাতের খাবারের সময়েও পরিবারের সঙ্গে সময় দিতে পছন্দ করেন।গিনেজ বুকের এক বিবৃতিতে ওই দম্পতি জানান, সব সদস্যদের প্রতি ভালোবাসা, পারস্পরিক সম্মান, সততা ও শিক্ষাই পারে একটি পরিবারের সঠিক মূল্যবোধ ধরে রাখতে। ",22/9/2020,international
ভেনিজুয়েলায় শতাধিক বিরোধীদলীয় নেতাকে মুক্তি দিলেন মাদুরো,"ভেনিজুয়েলায় জাতীয় সংসদ নির্বাচনের আগে বেশ কয়েকজন মার্কিন সমর্থিত সংসদ সদস্যসহ শতাধিক বিরোধীদলীয় রাজনৈতিককে মুক্তি দিয়েছে দেশটির সরকার।



প্রেসিডেন্ট নিকোলাস মাদুরো দেশের বিদ্যমান রাজনৈতিক বিভাজন দূর করে জাতীয় সংহতি দৃঢ় করার পদক্ষেপ হিসেবে এ উদ্যোগ নিয়েছেন।খবর এএফপির।তার এ পরিকল্পনা অংশ হিসেবে বিরোধী বন্দীদের মুক্তি দেয়া হচ্ছে। প্রেসিডেন্ট মাদুরো নিজেই বিষয়টি নিশ্চিত করেছেন।তিনি বলেছেন, ল্যাটিন আমেরিকায় রাজনৈতিক ঐক্য ও সংহতি জোরদার করার জন্যই তিনি এ ব্যবস্থা নিয়েছেন।

যেসব বিরোধী বন্দিকে মুক্তি দেয়া হয়েছে তাদের বিরুদ্ধে সহিংস বিক্ষোভ, সামরিক অভ্যুত্থানের প্রচেষ্টা এবং দেশের মধ্যে বিদ্বেষ ছড়ানোসহ নানা ধরনের অপরাধমূলক তৎপরতার অভিযোগ ছিল।মুক্তিপ্রাপ্ত বন্দীদের মধ্যে বেশ কয়েকজন মার্কিন সমর্থিত সংসদ সদস্য রয়েছেন। কিন্তু প্রেসিডেন্ট মাদুরো তাদেরকে আইনের সুযোগ গ্রহণের সুবিধা দিয়েছেন।বিষয়টিকে ভেনিজুয়েলায় প্রশংসার দৃষ্টিতে দেখা হচ্ছে তবে বিরোধীদের অনেকেই এখনও প্রেসিডেন্ট মাদুরোর সমালোচনায় মুখর।  ",22/9/2020,international
চিলিতে ৬.৭ মাত্রার শক্তিশালী ভূমিকম্প,"ল্যাটিন আমেরিকার দেশ চিলির উত্তরাঞ্চলে মঙ্গলবার ৬.৭ মাত্রার শক্তিশালী একটি ভূমিকম্প আঘাত হেনেছে।



জার্মান রিসার্চ সেন্টারের ভূতাত্ত্বিক জরিপ কেন্দ্র এ তথ্য জানিয়েছে। খবর আরব নিউজ ও রয়টার্সের।

এর আগে চিলির ওই উপকূলীয় এলাকার ১০ কিলোমিটার ভূগর্ভে ৭ মাত্রার একটি ভূমিকম্প হয়।তাৎক্ষণিকভাবে ভূমিকম্পে ক্ষয়ক্ষতির পারিমাণ জানা যায়নি। ",22/9/2020,international
করোনার ধকল কাটিয়ে ওঠা ব্রাজিল প্রেসিডেন্টের কিডনিতে পাথর,"কোভিড-১৯ মহামারীর ধকল কাটিয়ে উঠতে না উঠতেই ফের দুঃসংবাদ ভর করেছে ব্রাজিল প্রেসিডেন্ট জাইর বোলসোনারোর কাঁধে। এবার তার কিনডিতে পাথর ধরা পড়েছে। এটি অপসারণে চলতি মাসের যে কোনো সময় তাকে অস্ত্রোপচার করানো লাগতে পারে। খবর বিবিসি ও সিএনএনের।



সিএনএন ব্রাজিলের খবরে বলা হয়েছে– আলট্রাসাউন্ড টেস্ট করার পর চিকিৎসকরা জানিয়েছেন, বোলসোনারোর কিনডিতে পাথর রয়েছে এবং সেটি শিমের দানার চেয়ে কিছুটা বড়। ক্যাথেটার ছাড়াই এটি অপসারণ করা যাবে। তবে এ বিষয়ে বিস্তারিত জানায়নি ব্রাজিলের প্রেসিডেন্ট অফিস।জুলাইয়ে করোনাভাইরাসে আক্রান্ত হন ৬৫ বছর বয়সী বোলসোনারো। এর পর দুই সপ্তাহ আইসোলেশনে থাকেন। সুস্থ হওয়ার পরই তিনি পুরোদমে কাজে যোগ দেন। জনসম্মুখে যাওয়া শুরু করেন। এর আগে কোভিড-১৯ মহামারীকে পাত্তাই দেননি তিনি। এটিকে সাধারণ ফ্লু বলে মন্তব্য করে দিব্যি ঘুরে বেড়ান মাস্ক ছাড়াই। এমনটি মোটর শোভাযাত্রাও করেন সমর্থকদের নিয়ে। এ নিয়ে ব্যাপক সমালোচিত হন ডানপন্থী এ নেতা।তবে অনেক দিন ধরে নানা ধরনের শারীরিক জটিলতায় ভুগছেন ৬৫ বছর বয়সী বোলসোনারো। ২০১৮ সালে প্রেসিডেন্ট নির্বাচনের প্রচারের সময় প্রতিপক্ষ সমর্থকের ছুরিকাঘাতে আহত হলে তার পেটে চারবার অস্ত্রোপচার করাতে হয়।

কিডনিতে পাথর ধরা পড়ার বিষয়টি বোলসোনারো নিজেই সিএনএন ব্রাজিলকে জানিয়ে বলেন, আমি হালকা ব্যথা অনুভব করছিলাম। এর পর চেকআপে যাই আমি। কিন্তু এখন ভালো আছি। বয়সের কারণে এমনটি হতে পারে।",22/9/2020,international
এবার সাংবাদিককে ঘুষি মারার হুমকি ব্রাজিল প্রেসিডেন্টের,"ফের বিতর্কে জড়ালেন ব্রাজিলের প্রেসিডেন্ট জাইর বোলসোনারো। এবার এক সাংবাদিকের মুখে ঘুষি মারার হুমকি দিয়েছেন তিনি। খবর সিএনএন ও দ্য গার্ডিয়ানের।



সিএনএনের প্রতিবেদনে বলা হয়েছে, রোববার রাজধানী ব্রাসিলিয়ার মেট্রোপলিটন ক্যাথেড্রাল (গির্জা) পরিদর্শনে যান ব্রাজিল প্রেসিডেন্ট। পরিদর্শন শেষে সাংবাদিকদের মুখোমুখি হন তিনি। সেখানে এক সাংবাদিক দুর্নীতিতে বোলসোনারোর স্ত্রীর জড়িত থাকার অভিযোগ নিয়ে তাকে প্রশ্ন করেন। এতে মেজাজ হারিয়ে ক্যামেরার সামনেই ওই সাংবাদিকের মুখে ঘুষি মারার হুমকি দেন ব্রাজিলের প্রেসিডেন্ট।জানা যায়, ওই সাংবাদিক হচ্ছেন দেশটির ‘ও গ্লোবো’ পত্রিকার প্রতিবেদক।স্ত্রীর দুর্নীতির অভিযোগ নিয়ে বোলসোনারোর বক্তব্য জানতে চেয়েছিলেন ওই প্রতিবেদক।
তখনই রেগে গিয়ে বোলসোনারো বলেন, তোমার মুখে ঘুষি মারতে ইচ্ছে করছে।ভিডিওতে দেখা গেছে, ‘ও গ্লোবো’র প্রতিবেদককে এ হুমকি দিয়েছেন ব্রাজিলের প্রেসিডেন্ট।পত্রিকাটি এক বিবৃতিতে জানায়, আমাদের প্রতিবেদক সেখানে পেশাগত দায়িত্ব পালন করছিলেন আর তার বিরুদ্ধে আগ্রাসী মনোভাব দেখালেন প্রেসিডেন্ট।প্রেসিডেন্ট বেরিয়ে আসার রিপোর্টার ফার্স্ট লেডি মিশেল বলসোনার অ্যামাজন দুর্নীতির বিষয়ে প্রশ্ন করেন। এতে প্রেসিডেন্ট দাঁড়িয়ে যান। বলে উঠেন, তোমার মুখে চড় কষে দিতে ইচ্ছে করছে আমার।এ ঘটনা নিয়ে বলসোনারোর কার্যালয়ে যোগাযোগ করা হলে এ বিষয়ে কোনো কিছু মন্তব্য করতে অস্বীকৃতি জানান তার মুখপাত্র।
",22/9/2020,international
"পেরুতে লকডাউনে নাইটক্লাবে অভিযান, পদদলিত হয়ে নিহত ১৩","দক্ষিণ আমেরিকার দেশ পেরুর রাজধানী লিমায় লকডাউনের মধ্যে খোলা রাখা একটি নাইটক্লাবে অভিযান চালায় পুলিশ।



শনিবার রাতে চালানো ওই অভিযানের সময় হুড়োহুড়ি করে পালাতে গিয়ে পদদলিত হয়ে অন্তত ১৩ জন প্রাণ হারিয়েছেন। খবর বিবিসির।করোনার মধ্যে লকডাউন নীতিমালা অমান্য করে নাইটক্লাব চালানোয় অভিযান চালিয়েছিল বলে জানিয়েছে পুলিশ।পুলিশ ও সরকারি কর্মকর্তারা জানান, শনিবার রাতে রাজধানীর থমাস রেস্তোরাঁর দ্বিতীয় তলায় পার্টি হচ্ছিল। পুলিশ এটি বন্ধে অভিযান চালালে অন্তত ১২০ জন পালানোর চেষ্টা করেন। এ সময় আহত হন ছয়জন। তাদের মধ্যে তিন পুলিশ সদস্যও রয়েছেন।পুলিশ জানায়, অভিযানের সময় মানুষ যখন একই পথ দিয়ে বের হওয়ার চেষ্টা করছিল, তখনই হুড়োহুড়িতে এ হতাহতের ঘটনা ঘটে।পেরুর স্বরাষ্ট্র মন্ত্রণালয় জানিয়েছে, অভিযানের পর ঘটনাস্থল থেকে পুলিশ কমপক্ষে ২৩ জনকে আটক করেছে।এ ধরনের পার্টির আয়োজকদের নিন্দা জানিয়ে দেশটির নারীবিষয়ক মন্ত্রী রোজারিও সাসিয়েস্তা বলেন, এমনটি হওয়া উচিত হয়নি। আমরা একটি মহামারী ও স্বাস্থ্যঝুঁকির মধ্যে রয়েছি। নাইটক্লাব মালিকদের সর্বোচ্চ শাস্তি দাবি করছি।লাতিন আমেরিকার দেশগুলোতে এখন দ্বিতীয় দফায় কোভিড-১৯ সংক্রমণ চলছে। গত মার্চে পেরুতে নাইটক্লাব ও বার বন্ধের নির্দেশ দেয়া হয়।",22/9/2020,international
ইরানি ক্ষেপণাস্ত্র কিনতে চান মাদুরো,"ইরান থেকে ক্ষেপণাস্ত্র কিনতে চান বলে ইঙ্গিত দিয়েছেন ভেনিজুয়েলার প্রেসিডেন্ট নিকোলাস মাদুরো। তিনি বলেন, ইরান থেকে ক্ষেপণাস্ত্র কেনার আইডিয়াটা বেশ ভালো। তিনি এ বিষয়ে ইরানের সঙ্গে আলোচনা করতে প্রতিরক্ষামন্ত্রীকে নির্দেশ দিয়েছেন। এর একদিন আগে কলম্বিয়া বলেছে, ইরান ও কারাকাসের মধ্যে ক্রমবর্ধমান সম্পর্কের মধ্যে ভেনিজুয়েলা ক্ষেপণাস্ত্র কেনার পরিকল্পনা বিবেচনা করছে।



শনিবার কলম্বিয়ার প্রেসিডেন্ট ইভান দুকের এমন মন্তব্যে প্রতিক্রিয়ায় এ কথা বলেন মাদুরো।ভেনিজুয়েলার রাষ্ট্রীয় টিভি চ্যানেল থেকে সরাসরি সম্প্রচারিত মন্ত্রিসভার বৈঠকে তিনি প্রতিরক্ষামন্ত্রীকে ইঙ্গিত করে বলেন, এই আইডিয়াটা তাদের মাথায় কেন এলো না।কলম্বিয়ার প্রেসিডেন্ট সম্প্রতি দাবি করেছেন, কলম্বিয়া সরকারের সঙ্গে যেসব আন্তর্জাতিক গোয়েন্দা সংস্থা কাজ করে তাদের কাছে এ তথ্য রয়েছে যে, ভেনিজুয়েলার প্রেসিডেন্ট নিকোলাস মাদুরো ইরানের কাছ থেকে মাঝারি ও দূরপাল্লার ক্ষেপণাস্ত্র কিনতে চান। এ ছাড়া রাশিয়ান ও বেলারুশের অস্ত্র কলম্বের সশস্ত্র গোষ্ঠীকে দিতে চান। এরপর ভেনিজুয়েলার পররাষ্ট্রমন্ত্রী জর্জ আরিয়াজা ইরানের কাছ থেকে ক্ষেপণাস্ত্র কেনার পরিকল্পনার দাবি নাকচ করেন।এবার ভেনিজুয়েলার প্রেসিডেন্ট নিজে এ বিষয়ে প্রতিক্রিয়া দেখালেন। তিনি প্রতিরক্ষামন্ত্রীকে বলেছেন, ইরানের সঙ্গে ভেনেজুয়েলার সম্পর্কের আলোকে স্বল্প, মাঝারি ও দূর পাল্লার ক্ষেপণাস্ত্র কেনার সম্ভাবনার বিষয়টি খতিয়ে দেখা দরকার। তবে ইরান এখন পর্যন্ত এ বিষয়ে কোনো প্রতিক্রিয়া দেখায়নি।সূত্র: ইয়েনি শাফাক
",22/9/2020,international
