মনোনয়নকে কেন্দ্র করে বিএনপিতে উত্তেজনা,"ঢাকা-১৮ আসনের উপনির্বাচন ঘিরে বিএনপির সম্ভাব্য প্রার্থীদের মধ্যে চলছে উত্তেজনা। মনোনয়নকে কেন্দ্র করে কার্যত বিভক্ত হয়ে পড়েছেন স্থানীয় নেতাকর্মী ও সমর্থকরা। এক গ্রুপের নেতৃত্ব দিচ্ছেন সম্ভাব্য প্রার্থী এসএম জাহাঙ্গীর ও অপর গ্রুপের নেতৃত্বে কফিলউদ্দিন আহম্মেদ। এ আসনে নয়জন মনোনয়নপত্র কিনলেও মূলত মাঠে রয়েছেন এরা দু’জনই। শনিবার গুলশান কার্যালয়ে সংঘর্ষের পর এদের কর্মী-সমর্থকরা প্রতিদিনই এলাকায় মহড়া দিচ্ছেন। হাইকমান্ড দ্রুত পরিস্থিতি নিয়ন্ত্রণে না আনলে ফের ভয়াবহ সংঘর্ষের আশঙ্কা করছেন অনেকে।



এদিকে মনোনয়নকে কেন্দ্র করে সম্ভাব্য প্রার্থীরা একে অপরের বিরুদ্ধে শুরু করেছেন কাদা ছোড়াছুড়ি। হাইকমান্ডের কাছে দিচ্ছেন লিখিত অভিযোগ। মনোনয়ন পেতে নেতাকর্মী ও সমর্থকদের নিয়ে প্রতিদিনই নির্বাচনী এলাকায় মতবিনিময় করছেন। নিষ্ক্রিয় নেতাকর্মীদের মাঠে নামানোর চেষ্টা করছেন তারা। সবমিলিয়ে নির্বাচন ঘিরে উত্তেজনার পাশাপাশি এ আসনে বিএনপি অনেকটা চাঙ্গা হয়ে উঠেছে।শনিবার বিএনপি চেয়ারপারসন খালেদা জিয়ার গুলশান কার্যালয়ে উপনির্বাচনে সম্ভাব্য প্রার্থীদের সাক্ষাৎকার চলাকালে জাহাঙ্গীর ও কফিলের সমর্থকদের মধ্যে সংঘর্ষ হয়। এ ঘটনা তদন্তে কেন্দ্রীয়ভাবে তদন্ত কমিটি করা হয়েছে। মৌখিকভাবে কেন্দ্রীয় তিন নেতাকে এ দায়িত্ব দেয়া হয়েছে। তবে এখনও তারা তদন্তের কাজ শুরু করেননি। এ আসনে সম্ভাব্য প্রার্থীদের সাক্ষাৎকার নেয়া হলেও চূড়ান্ত মনোনয়ন ঘোষণা করেনি বিএনপি। তফসিল ঘোষণার পর তা ঘোষণা করা হবে।সূত্র জানায়, গুলশান কার্যালয়ে সংঘর্ষের ঘটনায় একে অপরকে দায়ী করছেন জাহাঙ্গীর ও কফিল সমর্থকরা। প্রত্যক্ষদর্শীরা জানান, সাক্ষাৎকারের দিন দুপুরের পর তারা গুলশান কার্যালয়ের সামনে অবস্থান নেন। কিছুক্ষণ পর কফিলের সমর্থকরা প্ল্যাকার্ড নিয়ে সেখানে উপস্থিত হন। তাদের কার্যালয়ের সামনে থেকে সরে যেতে বলেন। এ নিয়ে উত্তেজনা সৃষ্টি হয়। একপর্যায়ে কফিল সমর্থকরা তাদের ধাওয়া দিয়ে সেখান থেকে সরিয়ে দেন। পরে আমরাও তাদের ধাওয়া করি। এরপর কিছুক্ষণ ধাওয়া-পাল্টা ধাওয়া হয়। পরে কেন্দ্রীয় নেতাদের হস্তক্ষেপে পরিস্থিতি শান্ত হয়। কফিল সমর্থকরাই প্রথমে এ ঘটনার সূত্রপাত করে। তবে কফিল সমর্থকদের দাবি, জাহাঙ্গীর বহিরাগতদের দিয়ে তাদের ওপর হামলা চালিয়েছে।মনোনয়নকে কেন্দ্র করে এ আসনের অন্তর্গত সাতটি থানা বিএনপির সভাপতি ও সাধারণ সম্পাদকসহ অঙ্গ-সংগঠনের একাংশ জাহাঙ্গীরের পক্ষে অবস্থান নিয়েছে। অপরদিকে থানা বিএনপি ও অঙ্গ-সংগঠনের একাংশ কফিলের পক্ষে রয়েছে। স্থানীয় নেতাদের দিয়ে হাইকমান্ডের কাছে প্রতিপক্ষের বিরুদ্ধে লিখিত অভিযোগ পাঠানো হচ্ছে। জাহাঙ্গীর ও কফিলকে মনোনয়ন দিতে নিজ নিজ সমর্থকরা আহ্বান জানাচ্ছেন। সর্বশেষ সাত থানা বিএনপির সভাপতি ও সাধারণ সম্পাদক এবং অঙ্গ-সংগঠনের নেতারা এসএম জাহাঙ্গীরকে এ আসনে মনোনয়ন দিতে কেন্দ্রে লিখিত আবেদন করেছেন। এর আগে গত সিটি নির্বাচনে বিএনপির কয়েক কাউন্সিলর প্রার্থী জাহাঙ্গীরকে মনোনয়ন না দিতে কেন্দ্রে লিখিত আবেদন করেন।জানতে চাইলে এসএম জাহাঙ্গীর হোসেন যুগান্তরকে বলেন, দেড় যুগের বেশি এ এলাকার রাজনীতির সঙ্গে জড়িত। প্রতিটি নেতাকর্মী ও সাধারণ মানুষের কাছেও আমার গ্রহণযোগ্যতা রয়েছে। বিগত আন্দোলন-সংগ্রামে মাঠে ছিলাম। এসব বিবেচনা করে হাইকমান্ড আমাকে মনোনয়ন দেবে বলে আশা করি। তিনি বলেন, এ আসনের বিএনপি ও অঙ্গ-সংগঠনের নেতাকর্মীরা ঐক্যবদ্ধ। আমরা যারা মনোনয়নপ্রত্যাশী তাদের মধ্যেও কোনো বিভেদ নেই। যারা দলের ঐক্য চান না তারা নানাভাবে আমাদের মধ্যে অনৈক্য সৃষ্টির চেষ্টা চালাচ্ছে।মনোনয়নপ্রত্যাশী এম কফিল উদ্দিন বলেন, আমি এ এলাকার স্থানীয়। মামলা-নির্যাতন উপেক্ষা করে নেতাকর্মীদের পাশে আছি। আশা করি দল সবকিছু মূল্যায়ন করে স্থানীয় হিসেবে মনোনয়ন দেবে। কোনো বহিরাগতকে যেন মনোনয়ন দেয়া না হয়।",19/9/2020,politics
সরকারি দলের সিন্ডিকেটকে সুবিধা দিতে পেঁয়াজের দাম বৃদ্ধি: রিজভী,"দেশের বাজারে হঠাৎ পেঁয়াজের দাম বৃদ্ধির জন্য ‘সরকারি দলের সিন্ডিকেটকে’ দায়ী করেছেন বিএনপির সিনিয়র যুগ্ম মহাসচিব রুহুল কবির রিজভী।



বুধবার দুপুরে রাজধানীর নয়াপল্টনে এক সংবাদ সম্মেলনে তিনি এ কথা বলেন।রিজভী বলেন, দেশের বাজারে প্রচুর পেঁয়াজ মজুদ থাকলেও বিক্রি কমিয়ে দিয়েছে অসাধু ব্যবসায়ীরা। ফলে বাজারে পেঁয়াজের তীব্র সংকট দেখা দিয়েছে। এই সংকট কৃত্রিম। আমরা বিভিন্ন সূত্র থেকে জানছি, গণমাধ্যমেও সংবাদ প্রকাশিত হয়েছে এই মজুদের কথা।‘আমরা মনে করি, এটাতে সরকারেরও কারসাজি থাকে। সরকার সমর্থিত দলের সিন্ডিকেটই পেঁয়াজের মূল্য বৃদ্ধির পৃষ্ঠপোষক। আমদানিকারক ও ব্যবসায়ী সিন্ডিকেটের কারসাজিতেই পেঁয়াজের এই মূল্য বৃদ্ধি। বিএনপি পেঁয়াজের এই অস্বাভাবিক মূল্য বৃদ্ধির ঘটনায় উদ্বেগ প্রকাশ করছে।’গত সোমবার ভারত পেঁয়াজ রফতানি বন্ধের ঘোষণা দিলে বাংলাদেশে একদিনের মধ্যেই নিত্য প্রয়োজনীয় পণ্যটির দাম বাড়তে থাকে। মঙ্গলবার রাজধানীর বিভিন্ন বাজারে ৬০ টাকা কেজির পেঁয়াজ ১০০ টাকায় উঠে যায়। অবিলম্বে পেঁয়াজের দাম স্বাভাবিক করতে বাজার নিয়ন্ত্রণে কঠোর ব্যবস্থা নেয়ার দাবি জানান রিজভী।তিনি বলেন, ভারতে ইলিশ উপহার হিসেবে পাঠানোর সঙ্গে সঙ্গেই বাংলাদেশে পেঁয়াজ রফতানি বন্ধ করে দিয়েছে। বাংলাদেশে এই সংবাদ পৌঁছানোর সঙ্গে সঙ্গেই বাজার সিন্ডিকেটের হোতারা তেলেসমাতি শুরু করে দেয়।‘পেঁয়াজ আছে। কিন্তু সরকারি দলের সমর্থিত সিন্ডিকেটকে সুবিধা দেয়ার জন্য, তাদের অর্থ-বিত্ত বাড়ানোর জন্য আজকে কৃত্রিমভাবে এই সংকট সৃষ্টি করা হয়েছে। তাতে কষ্ট পাচ্ছে কে? স্বল্প আয়ের মানুষ, নিম্ন আয়ের মানুষ, মজুর, কৃষক, ভূমিহীন কৃষক- এরা সবচাইতে বেশি কষ্ট পাচ্ছে।’সরকারের সমালোচনা করে তিনি বলেন, এর আগেও সরকার প্রধান নিজেও বলেছেন, পেঁয়াজ বিমানে উঠে গেছে, আর কোনো সমস্যা নাই। এই কথা বলার মানে কী? এর মানে হচ্ছে জনগণের সঙ্গে তামাশা করা। সরকার প্রধানের সেই কথাগুলো মানুষ ভুলে যায়নি। যেদিনই বলেছেন তার পরেরদিনই দাম বেড়েছে। গত বছর তিনশ টাকা কেজি হয়েছিল, ফাস্ট সেঞ্চুরি, ডাবল সেঞ্চুরি, ট্রিপল সেঞ্চুরি তারা করে ফেললেন। জনগণের সঙ্গে এই মশকরাগুলো করেছে সরকার।সংবাদ সম্মেলনে দলের যুগ্ম মহাসচিব খায়রুল কবির খোকন, সাংগঠনিক সম্পাদক সৈয়দ এমরান সালেহ প্রিন্স, কেন্দ্রীয় নেতা আবদুস সালাম আজাদ, ফিরোজ-উজ জামান, আমিনুল ইসলাম, অঙ্গ সংগঠনের শাহজাহান মিয়া সম্রাট, আহসান উদ্দিন খান শিপন, শেখ আব্দুল হালিম খোকন প্রমুখ উপস্থিত ছিলেন।",19/9/2020,politics
ওবায়দুল কাদেরকে পদত্যাগ করতে বললেন রিজভী,"শুরু থেকেই করোনা রোগীর আক্রান্ত ও মৃত্যুর সংখ্যা নিয়ে সরকার মিথ্যাচার করেছে বলে মন্তব্য করেছেন বিএনপির সিনিয়র যুগ্ম মহাসচিব রুহুল কবির রিজভী।



তিনি বলেছেন, সরকার শুরু থেকেই করোনা রোগীর আক্রান্ত ও মৃত্যুর সংখ্যা নিয়ে মিথ্যাচার করেছে। জাতির সামনে প্রকৃত তথ্য তুলে ধরা হচ্ছে না। করোনার টেস্ট কমিয়ে দিয়ে করোনা রোগী নেই বলে জনগণকে ধাপ্পা দিয়ে বিপদের মধ্যে ঠেলে দিচ্ছে। এর উদ্দেশ্য হচ্ছে করোনা থেকে জনদৃষ্টিকে অন্যদিকে সরিয়ে রাখা। নিজেদের ব্যর্থতা ঢাকা দেয়ার জন্য সরকারি প্রতিষ্ঠানগুলোকেও মিথ্যাচারের যন্ত্র বানানো হচ্ছে। মঙ্গলবার দুপুরে রাজধানীর নয়াপল্টনে বিএনপির কেন্দ্রীয় কার্যালয়ে এক সংবাদ সম্মেলনে তিনি এসব কথা বলেন।তিনি বলেন, করোনায় আক্রান্ত ও মৃত্যুর সংখ্যা প্রতিদিনই বৃদ্ধি পেয়েই যাচ্ছে। এখনও আক্রান্ত ও মৃত্যু সংখ্যার মধ্যে কোনো আশার আলো দেখা যাচ্ছে না। সরকারি হিসাবে করোনা আক্রান্ত হয়ে মৃত্যুর সংখ্যায় চীনকে ছাড়িয়ে গেছে বাংলাদেশ। এভাবে চলতে থাকলে এদেশে করোনা সংক্রমণ ও মৃত্যুর সংখ্যা ভয়াবহ রূপ ধারণ করবে। দেশের স্বাস্থ্য ব্যবস্থা ধ্বংসের দ্বারপ্রান্তে। রিজভী বলেন, আওয়ামী লীগের সাধারণ সম্পাদক কয়েক দিন আগে বলেছেন- বিএনপি চিরাচরিত মিথ্যাচার করছে। বিএনপি বলেছে সরকার করোনা রোগীদের পরিসংখ্যানে ৮২ হাজার রোগীর নাম বাদ দিয়েছে। তিনি বলেছেন ৮২ হাজারের তথ্য কোথায় পেয়েছেন এবং এ তালিকা জানতে চেয়েছেন। ওবায়দুল কাদের সাহেবের উদ্দেশ্যে বলতে চাই- বানোয়াট এবং অসত্য কথা বলার ফেরিওয়ালা আপনারা। একটি ইংরেজি পত্রিকায় এসেছে ৮২ হাজার নয়, ৮৪ হাজার করোনা রোগী সরকারের ডাটাবেজের অন্তর্ভুক্ত করা হয়নি।বিএনপির এই নেতা বলেন, ডিজি হেলথ সার্ভিস কি সরকারি নাকি বিরোধীদলীয় প্রতিষ্ঠান? এটি প্রত্যক্ষভাবে একটি সরকারি প্রতিষ্ঠান। তাদের ডাটাবেজ থেকে ৮৪ হাজার রোগীর নাম হারিয়ে গেল কীভাবে? এ তথ্যটি এমন একটি গণমাধ্যমে প্রকাশিত হয়েছে যেটি জনগণের কাছে বিশ্বাসযোগ্য। এ সংবাদ প্রতিবেদনে আরও বলা হয়েছে- সরকারি ডাটাবেজে এলাকাভিত্তিক করোনার সংখ্যা ও সংক্রমণের হারেরও তেমন তথ্য নেই। আমি বলতে চাই- পত্রিকাটি পাঠ করে ওবায়দুল কাদের সাহেবের নিজের আত্মমর্যাদার কথা চিন্তা করে এই মুহূর্তে পদত্যাগ করা উচিত। জনসম্মুখে ডাহা মিথ্যা উল্লেখ করার পর একজন মন্ত্রীর কোনোক্রমেই দায়িত্বে থাকা তার মর্যাদার সঙ্গে বেমানান।সংবাদ সম্মেলনে আরও উপস্থিত ছিলেন- বিএনপি চেয়ারপারসনের উপদেষ্টা আবদুস সালাম, সহ-সাংগঠনিক সম্পাদক অ্যাডভোকেট আবদুস সালাম আজাদ, নির্বাহী কমিটির সদস্য একরামুল হক বিপ্লব, স্বেচ্ছাসেবক দলের কেন্দ্রীয় নেতা জাহিদুর রহমান, মোরশেদ আলম প্রমুখ।
",19/9/2020,politics
খিচুড়ি রান্না শিখতে কর্মকর্তাদের বিদেশ পাঠানোকে ‘ফালতু’ বললেন রিজভী,"খিচুড়ি রান্না শিখতে সরকারি কর্মকর্তাদের বিদেশে পাঠানোর প্রস্তাবনাকে ‘ফালতু’ বলেছেন বিএনপির সিনিয়র যুগ্ম মহাসচিব রুহুল কবির রিজভী।



মঙ্গলবার দুপুরে রাজধানীর নয়াপল্টনে বিএনপির কেন্দ্রীয় কার্যালয়ে এক সংবাদ সম্মেলনে তিনি একথা বলেন।রিজভী বলেন, এখন খিচুড়ি রান্না প্রশিক্ষণের জন্য সরকারি কর্মকর্তাদের বিদেশ পাঠানোর কথাও খবরে বের হয়েছে। ইতোপূর্বে পুকুর খননের প্রশিক্ষণের জন্য সরকারি কর্মকর্তাদের বিদেশ পাঠানো হয়েছিল। এছাড়াও পাবদা মাছ চাষের প্রশিক্ষণ নিতে সরকারি কর্মকর্তারা বিদেশে গিয়েছিলেন। এসব অভিনব ও হাস্যকর তামাশা কেবলমাত্র শেখ হাসিনার আমলেই সম্ভব। আবহমানকাল ধরেই এ বিষয়গুলো সাধারণ মানুষের রপ্ত। অথচ সেসব বিষয়ে সরকারি কর্মকর্তাদের বিদেশ পাঠানোতে একটি প্রবাদ মনে পড়ে যায়- ‘সরকারি মাল দরিয়া মে ঢাল’। মোটা অংকের বৈদেশিক মুদ্রা খরচ করে ফালতু কাজে সরকারি কর্মকর্তাদের বিদেশ পাঠানো মূলত মিডনাইট নির্বাচনে সহায়তা করার জন্য সরকারি কর্মকর্তাদের উপঢৌকন দেয়া।সংবাদ সম্মেলনে আরও উপস্থিত ছিলেন- বিএনপি চেয়ারপারসনের উপদেষ্টা আবদুস সালাম, সহ-সাংগঠনিক সম্পাদক অ্যাডভোকেট আবদুস সালাম আজাদ, নির্বাহী কমিটির সদস্য একরামুল হক বিপ্লব, স্বেচ্ছাসেবক দলের কেন্দ্রীয় নেতা জাহিদুর রহমান, মোরশেদ আলম প্রমুখ।
",19/9/2020,politics
