১ জুন থেকে অভ্যন্তরীণ রুটে ফ্লাইট চালু,"আগামী ১ জুন থেকে দেশের অভ্যন্তরীণ রুটে (ডমেস্টিক) ফ্লাইট চালুর সিদ্ধান্ত নেয়া হয়েছে। তবে আন্তর্জাতিক রুটে বিমান চলাচলের সিদ্ধান্ত আগামী ১৫ জুনের পরে নেয়া হবে।



অভ্যন্তরীণ রুটে ফ্লাইট চালুর বিষয়টি গণমাধ্যমকে নিশ্চিত করেছেন বেসামরিক বিমান চলাচল কর্তৃপক্ষ (বেবিচক)।বৃহস্পতিবার বেবিচকের চেয়ারম্যান এয়ার ভাইস মার্শাল মফিদুর রহমান বলেন, আপাতত স্বাস্থ্যবিধি মেনে সীমিত পরিসরে ডমেস্টিক ফ্লাইট চলাচল শুরু হবে। শুরুতে ঢাকা, চট্টগ্রাম ও সিলেট বিমানবন্দরের ৩টি অভ্যন্তরীণ রুটের ফ্লাইট চলবে। এরপর সম্ভব হলে সৈয়দপুর বিমানবন্দরেও ফ্লাইট চালু করা হবে।তিনি আরও বলেন, এক সপ্তাহ পরিস্থিতি পর্যবেক্ষণ করে রাজশাহী, যশোর, বরিশাল, কক্সবাজার বিমানবন্দরে ফ্লাইট চলাচলের বিষয়ে সিদ্ধান্ত নেয়া হবে।উল্লেখ্য, অভ্যন্তরীণ ফ্লাইট রুটে দেশে বর্তমানে দেশের চারটি এয়ারলাইন্স কোম্পানি সেবা দিয়ে যাচ্ছে। এসব এয়ারলাইন্সে ঢাকা থেকে চট্টগ্রাম, সিলেট, কক্সবাজার, যশোর, সৈয়দপুর, রাজশারহী ও বরিশাল রুটে প্রতিদিন ১৪০টির মতো ফ্লাইট চলাচল করে থাকে।
করোনাভাইরাসের সংক্রমণ রোধে গত ২৪ মার্চ থেকে চীন ছাড়া সব দেশে যাত্রীবাহী ফ্লাইট চলাচল বন্ধ করে বেবিচক।তবে এর আগে গত ২০ মার্চ থেকে ফ্লাইট চলাচল বন্ধ ঘোষণা করে রিজেন্ট এয়ারওয়েজ।সে হিসাবে এখন বিমান বাংলাদেশ এয়ারলাইন্স, নভোএয়ার এবং ইউএস-বাংলা এয়ারলাইন্সই ফের ফ্লাইট পরিচালনা শুরু করবে।",22/9/2020,economics
১৬ মে পর্যন্ত স্থগিত অন-অ্যারাইভাল ভিসা,"বাংলাদেশে আগমনী ভিসা (ভিসা অন-অ্যারাইভাল) স্থগিতের মেয়াদ ৭ মে থেকে বাড়িয়ে আগামী ১৬ মে পর্যন্ত করা হয়েছে।



শনিবার স্বরাষ্ট্র মন্ত্রণালয়ের সুরক্ষা সেবা বিভাগ থেকে স্পেশাল ব্রাঞ্চের অতিরিক্ত মহাপুলিশ পরিদর্শকের কাছে পাঠানো এক নির্দেশনায় এ কথা জানানো হয়েছে।বৈশ্বিক মহামারী করোনাভাইরাসের বর্তমান পরিস্থিতি বিবেচনা করে এ মেয়াদ বাড়ানো হয়েছে বলে জানিয়েছে সংশ্লিষ্ট সূত্র।উল্লেখ্য, করোনা সংক্রমণ রোধে গত ১৫ মার্চ থেকে ৩১ মার্চ পর্যন্ত বাংলাদেশে সব ধরনের অন-অ্যারাইভাল ভিসা স্থগিত ঘোষণা করে সরকার। এরপর দফায় দফায় সাধারণ ছুটির মেয়াদ বাড়ানোর কারণে অন-অ্যারাইভাল ভিসা স্থগিতের মেয়াদও বাড়তে থাকে।সেই ধারাবাহিকতায় আগামী ১৬ মে পর্যন্ত সরকারের সাধারণ ছুটি ঘোষণার সঙ্গে তাল মিলিয়ে একই দিন পর্যন্ত অন-অ্যারাইভাল ভিসা স্থগিত রাখা হয়েছে।এদিকে বিমান চলাচলের নিষেধাজ্ঞার মেয়াদও ১৬ মে পর্যন্ত বাড়ানো হয়েছে। তবে অভ্যন্তরীণ রুটে সামাজিক দূরত্ব মেনে ৮ মে থেকে ফ্লাইট চলাচলের প্রস্তুতি নিতে বলা হয়েছে। ",22/9/2020,economics
পেঁয়াজ আমদানিতে ৫% শুল্ক কমানোর বিষয়টি বিবেচনা করা হবে: অর্থমন্ত্রী,"অর্থমন্ত্রী আ হ ম মুস্তফা কামাল বলেছেন, পেঁয়াজ আমদানিতে ৫ শতাংশ আমদানি শুল্ক কমানোর বিষয়টি বিবেচনা করা হবে। যদি রাজস্ব খাতে কোনো কিছু করার থাকে, অবশ্যই ছাড় দেয়া হবে। অতীতেও বিবেচনা করা হয়েছে, এখনও বিবেচনা করা হবে।



বুধবার অনলাইনে সরকারি ক্রয় সংক্রান্ত মন্ত্রিসভা কমিটির বৈঠক শেষে সংবাদিকদের প্রশ্নের জবাবে তিনি একথা বলেন।ভারতের পেঁয়াজ রফতানি বন্ধের ঘোষণায় দেশের বাজারে অস্থিরতা শুরু হয়েছে। ফলে জনগণ দুর্ভোগে পড়ছেন। এই দুর্ভোগ লাঘবে কী পদক্ষেপ নেবেন, সাংবাদিকদের এ প্রশ্নের জবাবে অর্থমন্ত্রী বলেন, জনগণের দুর্দশা বাড়ুক আমরা এটা চাই না। প্রধানমন্ত্রী থেকে শুরু করে আমরা কেউ এ প্রত্যাশা করি না। আমাদের হাতে যেটা আছে, যদি রাজস্ব খাতে কোনো কিছু করার থাকে, অবশ্যই ছাড় দেয়া হবে। অসাধু ব্যবসায়ীদের বিরুদ্ধে কী ব্যবস্থা নেয়া হবে- সাংবাদিকদের এমন প্রশ্নের জবাবে অর্থমন্ত্রী বলেন, আমার একটু অংশ ছিল। যদি কোনো কারণে রাজস্ব বাড়িয়ে দেই, সে কারণে যদি দাম বাড়ে, সেটার জন্য অর্থ মন্ত্রণালয় দায়ী। আর বাকি অংশ বাণিজ্য মন্ত্রণালয়ের। আমার মনে হয় বাণিজ্য মন্ত্রণালয় এ বিষয়ে দেখাশোনা করছে। অতীতেও সমস্যা হয়েছিল, পরে তা সমাধান হয়েছে। ",22/9/2020,economics
পেঁয়াজের শুল্ক প্রত্যাহারে আপত্তি এনবিআরের,"পেঁয়াজের আমদানি শুল্ক প্রত্যাহারে বাণিজ্য মন্ত্রণালয়ের আবেদন আমলে নেয়নি জাতীয় রাজস্ব বোর্ড (এনবিআর)।



এতে দেশের পেঁয়াজ চাষীরা ক্ষতিগ্রস্ত হবে এবং ভোক্তারাও শুল্ক প্রত্যাহারের সুফল পাবে না বলে মনে করে সংস্থাটি। এরই পরিপ্রেক্ষিতে বাণিজ্য মন্ত্রণালয় এনবিআর সিদ্ধান্ত পুনর্বিবেচনার আবেদন জানিয়েছে।গত ৭ সেপ্টেম্বর পেঁয়াজের আমদানি শুল্ক প্রত্যাহারে এনবিআরে চিঠি দেয় বাণিজ্য মন্ত্রণালয়। এরপর এনবিআর সার্বিক পরিস্থিতি পর্যালোচনা করে শুল্ক প্রত্যাহারে অপারগতা জানিয়ে ১৪ সেপ্টেম্বর বাণিজ্য মন্ত্রণালয়কে চিঠি দেয়। জবাবে বাণিজ্য মন্ত্রণালয় মঙ্গলবার এনবিআরকে সিদ্ধান্ত পুনর্বিবেচনার জন্য চিঠি দিয়েছে।এনবিআরের চিঠিতে বলা হয়েছে, দেশীয় পেঁয়াজ চাষীদের ন্যায্যমূল্য প্রাপ্তি নিশ্চিতকরণ, পেঁয়াজ চাষে উৎসাহ প্রদান ও আমদানি নির্ভরশীলতা হ্রাসে চলতি বাজেটে আমদানি পর্যায়ে ৫ শতাংশ শুল্ক আরোপ করা হয়। পেঁয়াজের ওপর আরোপিত শুল্ক প্রত্যাহার করলে দেশীয় পেঁয়াজ চাষীরা ন্যায্য মূল্য প্রাপ্তি থেকে বঞ্চিত হবে এবং আমদানি নির্ভরশীলতা বৃদ্ধি পাওয়ার ক্ষেত্র সৃষ্টি হবে। এতে দেশীয় চাষীদের ক্ষতিগ্রস্ত হওয়ার আশঙ্কা তৈরি হবে। এছাড়া পেঁয়াজের বিদ্যমান ৫ শতাংশ শুল্ক ভোক্তা পর্যায়ে মূল্যবৃদ্ধিতে তেমন প্রভাব সৃষ্টি করবে না।এর জবাবে মঙ্গলবার বাণিজ্য মন্ত্রণালয় সিদ্ধান্ত পুনর্বিবেচনা করতে এনবিআরে চিঠি দিয়েছে। এতে বলা হয়েছে, বর্তমান সময় পেঁয়াজ উৎপাদনের মৌসুম নয়। ফলে শুল্ক বহাল রাখার মাধ্যমে চাষীদের ন্যায্য মূল্য প্রাপ্তির বিষয়টি নিশ্চিত করা যাবে মর্মে প্রতীয়মান হয় না। মোট চাহিদার প্রায় ৩০ শতাংশ পেঁয়াজ আমদানির মাধ্যমে পূরণ করা হয়ে থাকে এবং এ আমদানির সিংহভাগ প্রতিবেশী দেশ ভারত থেকে হয়ে থাকে।কিন্তু সোমবার ভারতের ডিরেক্টর জেনারেল অব ফরেন ট্রেডের পক্ষ থেকে পেঁয়াজ রফতানি নিষিদ্ধ করা হয়। বর্তমান পরিস্থিতিতে আমদানি শুল্ক প্রত্যাহার করা হলে একদিকে যেমন ব্যবসায়ীরা বিকল্প বাজার থেকে পেঁয়াজ আমদানি করার ক্ষেত্রে উৎসাহিত হবেন, তেমনি পেঁয়াজের বাজার স্থিতিশীল রাখার ক্ষেত্রে এটি গুরুত্বপূর্ণ ভূমিকা পালন করবে বলে বাণিজ্য মন্ত্রণালয় মনে করছে। পেঁয়াজের ভরা মৌসুমে চাষীদের ন্যায্যমূল্য প্রাপ্তি নিশ্চিত করতে পুনরায় শুল্ক আরোপ করা যুক্তিযুক্ত হবে।গত ৭ সেপ্টেম্বরের বাণিজ্য মন্ত্রণালয়ের চিঠিতে বলা হয়, পেঁয়াজের বাজার আংশিক আমদানিনির্ভর একটি নিত্যপ্রয়োজনীয় পণ্য। নিকট অতীতে পেঁয়াজের বাজার বেশ কয়েকবার অস্থিতিশীল হয়েছে। গত অর্থবছরে এই সংকট মারাত্মক আকার ধারণ করেছিল। বাজার পরিস্থিতি পর্যালোচনায় দেখা যায়, পণ্যটির মূল্য অনেকাংশে বৃদ্ধি পেয়েছে। মূলত আমদানি মূল্য বেড়ে যাওয়া এর একটি অন্যতম কারণ।গত অর্থবছরের সেপ্টেম্বর-মার্চ সময়ে পেঁয়াজের ওপর আমদানি শুল্ক ছিল না, তারপরও আমদানি হ্রাস পাওয়ায় এই সমস্যা দীর্ঘায়িত হয়েছে। চলতি ২০২০-২১ অর্থবছরে পেঁয়াজ আমদানিতে ৫ শতাংশ শুল্ক আরোপ করায় অনুৎপাদনশীল সময় হিসেবে পরিচিত সেপ্টেম্বর-মার্চ সময়ে দামে নেতিবাচক প্রভাব পড়ার সম্ভাবনা রয়েছে। অপর এক চিঠিতে আমদানিকৃত পেঁয়াজ স্থলবন্দর (বেনাপোল, ভোমরা, সোনা মসজিদ, হিলি) এবং সমুদ্র বন্দর থেকে দ্রুত খালাসের ব্যবস্থা গ্রহণের জন্য নির্দেশনা দেয়া হয়েছে।",22/9/2020,economics
৫৩ কোটি টাকা শুল্ক ফাঁকি দিয়েছে খুলনার ৪ প্রতিষ্ঠান,"খুলনা অঞ্চলের বৃহৎ শিল্পগোষ্ঠী লকপুর গ্রুপের চারটি প্রতিষ্ঠানের বিরুদ্ধে বন্ড কেলেঙ্কারির মাধ্যমে ৫৩ কোটি টাকার শুল্ক ফাঁকির অভিযোগ উঠেছে। এ ঘটনায় শুল্ক আইনে ৪টি মামলা দায়েরের পাশাপাশি প্রতিষ্ঠানগুলোর লাইসেন্স সাসপেন্ড ও বীন নিবন্ধন লক করা হয়েছে। একই সঙ্গে লাইসেন্স কেন বাতিল করা হবে না, এ মর্মে শোকজ নোটিশ দেওয়া হয়েছে। বন্ড সুবিধায় আনা ৪৫০ কোটি টাকার মালামাল গুদাম থেকে সরিয়ে বড় অঙ্কের এই শুল্ক ফাঁকি দেয়া হয়েছে।



অনুসন্ধানে জানা যায়, এক্সপোর্ট ওরিয়েন্টেড প্রতিষ্ঠানগুলো তাদের বন্ডেড ওয়্যারহাউস লাইসেন্সের বদৌলতে পণ্য তৈরির জন্য যেসব কাঁচামাল বিদেশ থেকে আমদানি করে সেগুলো শুল্কমুক্ত সুবিধা পায়। তবে শর্ত থাকে যে, এসব কাঁচামাল দিয়ে উৎপাদিত পণ্য শুধু বিদেশেই রফতানি করা যাবে। দেশের বাজারে বিক্রির জন্য বন্ড সুবিধা প্রযোজ্য নয়। এটা করলে চোরাচালানি হিসেবে গণ্য হবে। আর এই শর্ত ভঙ্গ করেছে লকপুর গ্রুপের চারটি প্রতিষ্ঠান। তারা বন্ড সুবিধায় আনা প্রায় সাড়ে ৪শ’ কোটি টাকার ট্যাক্স ফ্রি মালামাল কালোবাজারে বিক্রি করে দিয়েছে।মোংলা কাস্টমস সূত্রে জানা যায়, খুলনা শহর থেকে ১০-১২ কিলোমিটার দূরে অবস্থিত লকপুর গ্রুপের এক্সপোর্ট ওরিয়েন্টেড প্রতিষ্ঠান ‘মেসার্স আলফা এক্সেসরিজ অ্যান্ড অ্যাগ্রো এক্সপোর্ট লিমিটেড’ ও এর পাশে ‘বাংলাদেশ পলি প্রিন্টিং ইন্টারন্যাশনাল’ এর বন্ড গুদামে গোপন সংবাদের ভিত্তিতে ২৭ আগস্ট মোংলা কাস্টমস ও রাজস্ব কর্মকর্তারা যৌথ অভিযান চালান। এ সময় বন্ড সুবিধার আওতায় আনা মালামাল গায়েব করার ঘটনা ধরা পড়ে। কাস্টমস সূত্রে বলা হয়েছে, এ দুটি প্রতিষ্ঠান মালামাল গায়েব করে যথাক্রমে ২৪ কোটি ৫২ লাখ এবং ১৪ কোটি ২৩ লাখ টাকা শুল্ক ফাঁকি দিয়েছে। এর চারদিন পর ১ সেপ্টেম্বর মোংলা ইপিজেডে অবস্থিত লকপুর গ্রুপের আরও দুটি প্রতিষ্ঠান ইস্টার্ন পলিমার ও মুন স্টার পলিমারে অভিযান চালায়। প্রতিষ্ঠান দুটি বন্ধ থাকায় তাদের আমদানি তথ্য ও ইনবন্ড রেজিস্ট্রার দেখে যে পরিমাণ মালামালের ঘাটতি দেখতে পাওয়া যায় তাতে যথাক্রমে ৮ কোটি ৬০ লাখ ও ৫ কোটি ৫৬ লাখ টাকা শুল্ক ফাঁকি দেয়া হয়েছে।মোংলা কাস্টমসের রাজস্ব কর্মকর্তা (প্রশাসন) আবদুর রহিম যুগান্তরকে জানান, চারটি প্রতিষ্ঠানের গুদামে বন্ড সুবিধায় আমদানি করা মালামালের মধ্য থেকে প্রায় সাড়ে ৪শ’ কোটি টাকার পিপি-এলডিপিই, বিওপিপি, ডুপ্লেক্স বোর্ড, ভিপিভি ফিল্ম, আর্ট কার্ড, ক্রাফট লাইনার পেপার, পেস্টিং গাম প্রভৃতি মালামাল সরিয়ে ফেলা হয়েছে। যার সরকারি শুল্কের পরিমাণ দাঁড়ায় প্রায় ৫৩ কোটি টাকা।মোংলা কাস্টমস কমিশনার হোসেন আহমেদ জানান, বন্ড সুবিধার আওতায় আনা মালামাল সরিয়ে ফেলা কালোবাজারে বিক্রির শামিল। এ ব্যাপারে শুল্ক আইনে চারটি মামলা করা হয়েছে। একই সঙ্গে ৪টি বন্ড লাইসেন্স সাসপেন্ড করা হয়েছে। বীন নিবন্ধন লক করা হয়েছে। পাশাপাশি মেসার্স আলফা এক্সেসরিজ অ্যান্ড অ্যাগ্রো এক্সপোর্ট লিমিটেড ও বাংলাদেশ পলি প্রিন্টিং ইন্টারন্যাশনালের বন্ড লাইসেন্স কেন বাতিল করা হবে না, এ মর্মে শোকজ করা হয়েছে।বন্ড সুবিধায় আনা মালামাল কালোবাজারে বিক্রির বিষয়ে লকপুর গ্রুপের মোংলা ইপিজেডের প্রতিষ্ঠান ইস্টার্ন পলিমার ও মুন স্টার পলিমারের দায়িত্বরত কর্মকর্তা আজগর আলীর কাছে জানতে চাইলে তিনি গ্রুপের ডিএমডি খান হাবিবুর রহমানের সঙ্গে কথা বলার পরামর্শ দেন। এরপর হাবিবুর রহমানের মোবাইল নম্বরে কল করা হলে তিনি পরে ফোন করতে বলেন। পরে একাধিকবার ফোন করা হলেও তিনি রিসিভ করেননি।",22/9/2020,economics
