অধ্যাপক মোর্শেদকে অব্যাহতির সিদ্ধান্ত বাতিল দাবি ঢাবি ছাত্রদলের,"ঢাকা বিশ্ববিদ্যালয়ের মার্কেটিং বিভাগের অধ্যাপক ড. মোর্শেদ হাসান খানকে চাকুরি থেকে অব্যাহতির সিদ্ধান্ত বাতিল এবং তাকে চাকুরিতে পুনর্বহালের দাবি জানিয়েছে ছাত্রদল।



রোববার রাজু ভাস্কর্যের পাদদেশে প্রতিবাদ সমাবেশে এ দাবি জানান ঢাকা বিশ্ববিদ্যালয় শাখা ছাত্রদল।সমাবেশে বক্তারা বলেন, ড. মোর্শেদ স্যারকে একটা লেখার কারণে চাকরি থেকে অব্যাহতি দেয়া আইনের পরিপন্থী। বিশ্ববিদ্যালয়ের আদেশে স্বাধীন মত প্রকাশের অধিকার দিয়েছে। রাজনৈতিক মতাদর্শ গ্রহণের অধিকার দিয়েছে। লেখাটির জন্য দুঃখ প্রকাশ করে লেখাটি প্রত্যাহার করেছে। তারপরও বিশ্ববিদ্যালয় প্রশাসন তদন্তসহ নানা কার্যক্রম করেছে। চাকরি থেকে অব্যাহতি বাইরের কারো চাপে দেয়া হয়েছে। এক্ষেত্রে বিশ্ববিদ্যালয়ের আদেশ ও স্ট্যাটিউট ফলো করা হয়নি। শুধু দলীয় কারণে তাকে চাকুরি থেকে অব্যাহতি দেয়া হয়েছে।ঢাকা বিশ্ববিদ্যালয় ছাত্রদলের আহবায়ক রাকিবুল ইসলাম রাকিবের সভাপতিত্বে এবং সদস্য সচিব আমানউল্লাহ আমানের সঞ্চালনায় সমাবেশে আরও বক্তব্য দেন কেন্দ্রীয় সংসদের সাধারণ সম্পাদক ইকবাল হোসেন শ্যামল, সহ-সভাপতি জাকিরুল ইসলাম জাকির, আশরাফুল আলম ফকির লিংকন, হাফিজুর রহমান হাফিজ, মাজেদুল ইসলাম রুমন, কে এম মুসাব্বির সাফি, যুগ্ম সম্পাদক মো. শাহনেওয়াজ, তানজিল হাসান,তবিবুর রহমান সাগর,এ বি এম মাহমুদ আলম সরদার, নিজামউদ্দিন রিপন,মারুফ এলাহী রনি, সহ-সাধারণ সম্পাদক আবু আফসান মোহাম্মদ ইয়াহ ইয়াহ,কে এম সাখাওয়াত হোসাইন, মাঈনুদ্দিন নিলয়, আক্তারুজ্জামান আকতার সহ-সাংগঠনিক সম্পাদক ডা. তৌহিদুর রহমান আউয়াল, চট্টগ্রাম বিভাগীয় সহ-সাংগঠনিক সম্পাদক সাব্বির হোসেন, ঢাকা বিশ্ববিদ্যালয়ের যুগ্ম আহবায়ক আকতার হোসেন, নাছিরউদ্দীন নাছির,জহিরউদ্দীন আহমেদ, আশরাফুল ইসলাম খান আনিক, খোরশেদ আলম সোহেল, এইচ এম আবু জাফর,সোহেল রানা, এবিএম এজাজুল কবির জুয়েল,শাফি ইসলাম, রিয়াদ রহমান, হাসান আল আরিফ, মশিউর রহমান, জেহাদুল ইসলাম রঞ্জু, শরিফুল ইসলাম প্রধান, এস এম মাহমুদুল হাসান রনি, এনামুল হক এনাম, মাসুদুর রহমান মাসুদ, আবুল বাসার, জসীমউদ্দিন, মোস্তাফিজুর রহমান রুবেল, এনায়েত উল্লাহ শরিফ, ফারুক হোসেন, বায়জিদ হোসাইন, জিএম ফখরুল ইসলাম, শরিফুল ইসলাম, মিয়া মো. রাসেল প্রমুখ।",21/9/2020,politics
প্রার্থী মনোনয়ন নীতিমালায় সংশোধনী এনেছে বিএনপি,"স্থানীয় সরকার নির্বাচনে দলীয় প্রার্থী নির্বাচনে তৃণমূলের মতামতকে গুরুত্ব দেবে বিএনপি। এরই অংশ হিসেবে উপজেলা, পৌরসভা ও ইউনিয়ন পরিষদ নির্বাচনে প্রার্থী মনোনয়নের নীতিমালা প্রণয়ন করেছে দলটি। 
রোববার বিএনপির সিনিয়র যুগ্ম মহাসচিব রুহুল কবির রিজভী স্বাক্ষরিত এক সংবাদ বিজ্ঞপ্তিতে মাঠপর্যায়ের নেতারা প্রার্থী মনোনয়নের জন্য যে পদ্ধতি ও প্রক্রিয়া অনুসরণ করবেন তার পুনঃসংশোধনী প্রকাশ করা হয়।
আগামী ডিসেম্বর থেকে উপজেলা, পৌরসভা ও ইউনিয়ন পরিষদের নির্বাচনের পরিপ্রেক্ষিতে বিএনপির পক্ষ থেকে এ নীতিমালা দলের মাঠপর্যায়ের নেতাদের অনুসরণ করতে বলা হয়েছে। ফলে স্থানীয় সরকার নির্বাচনে অংশ নিতে হলে তৃণমূল বিএনপির কাছে যেতে হবে সম্ভাব্য প্রার্থীকে।
বিজ্ঞপ্তিতে বলা হয়, উপজেলা পরিষদ নির্বাচনের ক্ষেত্রে জেলা বিএনপির সভাপতি, সাধারণ সম্পাদক অথবা আহ্বায়ক ও সদস্য সচিব/১নং যুগ্ম আহ্বায়ক (২ জন), উপজেলা বিএনপির সভাপতি, সাধারণ সম্পাদক ও ১নং সাংগঠনিক সম্পাদক অথবা আহ্বায়ক, সদস্য সচিব ও ১নং যুগ্ম আহ্বায়ক, (যে কমিটিতে সদস্য সচিব নাই, সেখানে আহ্বায়ক, ১নং ও ২নং যুগ্ম আহ্বায়ক সুপারিশ করবে) (৩ জন)- এ ৫ জন আলোচনাক্রমে দলীয় প্রার্থী মনোনয়নের জন্য লিখিত সুপারিশ করবেন। এবং সংশ্লিষ্ট প্রার্থীর আবেদন ‘জাতীয় পরিচয় পত্র’ এবং হালনাগাদ ‘ভোটার তালিকাসহ মনোনয়ন দাখিলের শেষ তারিখের ৫ কার্যদিবস পূর্বে চেয়ারপারসনের গুলশান কার্যালয়ে বাহক মারফত পাঠাবেন।
পৌরসভা নির্বাচনের ক্ষেত্রে জেলা বিএনপির সভাপতি, সাধারণ সম্পাদক অথবা আহ্বায়ক ও সদস্য সচিব/১নং যুগ্ম আহ্বায়ক (২ জন), পৌরসভা বিএনপির সভাপতি, সাধারণ সম্পাদক ও ১নং সাংগঠনিক সম্পাদক অথবা আহ্বায়ক, সদস্য সচিব ও ১নং যুগ্ম আহ্বায়ক, (যে কমিটিতে সদস্য সচিব নাই, সেখানে আহ্বায়ক, ১নং ও ২নং যুগ্ম আহ্বায়ক সুপারিশ করবে) (৩ জন)-৫ জন আলোচনাক্রমে দলীয় প্রার্থী মনোনয়নের জন্য লিখিত সুপারিশ করবেন। এবং সংশ্লিষ্ট প্রার্থীর আবেদন ‘জাতীয় পরিচয় পত্র’ এবং হালনাগাদ ‘ভোটার তালিকাসহ মনোনয়ন দাখিলের শেষ তারিখের ৫ কার্যদিবস পূর্বে চেয়ারপারসনের গুলশান কার্যালয়ে বাহক মারফত পাঠাবেন।
ইউনিয়ন পরিষদ নির্বাচনের ক্ষেত্রে উপজেলা বিএনপির সভাপতি, সাধারণ সম্পাদক অথবা আহ্বায়ক ও সদস্য সচিব/১নং যুগ্ম আহ্বায়ক (২ জন), ইউনিয়ন বিএনপির সভাপতি, সাধারণ সম্পাদক ও সাংগঠনিক সম্পাদক অথবা আহ্বায়ক, সদস্য সচিব ও ১নং যুগ্ম আহ্বায়ক, (যে কমিটিতে সদস্য সচিব নাই, সেখানে আহ্বায়ক, ১নং ও ২নং যুগ্ম আহ্বায়ক সুপারিশ করবে) (৩ জন)- এ ৫ জন আলোচনাক্রমে দলীয় প্রার্থী মনোনয়নের জন্য লিখিত সুপারিশ করবেন। এবং সংশ্লিষ্ট প্রার্থীর আবেদন ‘জাতীয় পরিচয় পত্র’ এবং হালনাগাদ ‘ভোটার তালিকাসহ মনোনয়ন দাখিলের শেষ তারিখের ৫ কার্যদিবস পূর্বে চেয়ারপারসনের গুলশান কার্যালয়ে বাহক মারফত পাঠাবেন।
বিজ্ঞপ্তিতে রুহুল কবির রিজভী আরও জানান, সারা দেশে দলের জেলা সভাপতি, সাধারণ সম্পাদক, আহ্বায়ক; উপজেলা সভাপতি, সাধারণ সম্পাদক, আহ্বায়ক, পৌরসভা সভাপতি, সাধারণ সম্পাদক, আহ্বায়ক এবং ইউনিয়ন সভাপতি, সাধারণ সম্পাদক ও আহ্বায়কদের জ্ঞাতার্থে জানানো যাচ্ছে যে, উপজেলা পরিষদ চেয়ারম্যান, ভাইস চেয়ারম্যান (পুরুষ ও মহিলা), পৌরসভা মেয়র এবং ইউনিয়ন পরিষদ চেয়ারম্যান পদে সাধারণ নির্বাচন/উপনির্বাচনে দলীয় প্রার্থী মনোনয়নের জন্য এই পদ্ধতি/প্রক্রিয়া অনুসরণের মাধ্যমে অংশ নিতে পারবেন।



",21/9/2020,politics
খালেদা জিয়ার ৪ মামলার স্থগিতাদেশ আপিলেও বহাল,"দুর্নীতির দুই মামলায় দণ্ডিত বিএনপি চেয়ারপারসন খালেদা জিয়ার বিরুদ্ধে থাকা নাশকতার তিন ও মানহানির এক মামলার কার্যক্রমের ওপর হাইকোর্টের দেয়া স্থগিতাদেশ বহাল রেখেছেন আপিল বিভাগ। একইসঙ্গে অগ্রাধিকার ভিত্তিতে হাইকোর্টের রুল শুনানি করতে বলা হয়েছে।



মামলাগুলো সচল চেয়ে রাষ্ট্রপক্ষের আবেদনের শুনানি শেষে রোববার বিচারপতি ইমান আলীর নেতৃত্বাধীন তিন সদস্যের আপিল বিভাগ এ আদেশ দেন। আদালতে রাষ্ট্রপক্ষে শুনানিতে ছিলেন অতিরিক্ত অ্যাটর্নি জেনারেল মমতাজ উদ্দিন ফকির। আর খালেদা জিয়ার পক্ষে শুনানিতে ছিলেন ব্যারিস্টার মাহবুব উদ্দিন খোকন।খালেদা জিয়ার আইনজীবী ব্যারিস্টার এহসানুর রহমান গণমাধ্যমকে এই তথ্য নিশ্চিত করেন।এর আগে ২০১৪ সালের নির্বাচনের আগে ও পরে গাড়ি ভাঙচুরসহ অগ্নিসংযোগের অভিযোগে খালেদা জিয়াকে হুকুমের আসামি করে নাশকতার মামলাগুলো দায়ের করা হয়। রাজধানীর দারুস সালাম থানায় নাশকতার অভিযোগে তিনটি এবং মুক্তিযুদ্ধে শহীদদের সংখ্যা নিয়ে বিরূপ মন্তব্যের অভিযোগ পৃথক আরেকটি মামলা হয়। এসব মামলা স্থগিত চেয়ে খালেদা জিয়ার পক্ষে হাইকোর্টে আবেদন জানানো হলে তা মঞ্জুর করা হয়। একইসঙ্গে মামলার স্থগিতের বিষয়ে রুল জারি করেন হাইকোর্ট। পরে হাইকোর্টের আদেশের বিরুদ্ধে আপিল বিভাগে আবেদন জানায় রাষ্ট্রপক্ষের আইনজীবীরা। প্রসঙ্গত, এই চার মামলাসহ খালেদা জিয়ার বিরুদ্ধে থাকা মামলাগুলোর মধ্যে মোট ১১ মামলার কার্যক্রমের ওপর স্থগিতাদেশ বহাল রাখলেন আপিল বিভাগ।",21/9/2020,politics
স্বাস্থ্যবিধি মেনে সাংগঠনিক কার্যক্রম চালুর সিদ্ধান্ত বিএনপির,"যুগান্তর রিপোর্ট প্রায় ছয় মাসের মাথায় স্বাস্থ্যবিধি মেনে সাংগঠনিক কার্যক্রম পুনরায় চালু করার সিদ্ধান্ত নিয়েছে বিএনপি। শনিবার স্থায়ী কমিটির ভার্চুয়াল বৈঠকে এ সিদ্ধান্ত নেয়া হয়।



বাংলাদেশসহ বিশ্বব্যাপী কোভিড-১৯ মহামারীর প্রেক্ষিতে বিএনপি’র সাংগঠনিক কার্যক্রম/সাংগঠনিক গঠন ও পুণর্গঠন প্রক্রিয়া গত ১৫ মার্চ থেকে স্থগিত করেছিল দলটি। দলের ভারপ্রাপ্ত চেয়ারম্যান তারেক রহমানের সভাপতিত্বে অনুষ্ঠিত ভার্চুয়াল এই বৈঠকে নিজ নিজ বাসা থেকে অংশ নেন মহাসচিব মির্জা ফখরুল ইসলাম আলমগীর, স্থায়ী কমিটির স্থায়ী কমিটির সদস্য ড. খন্দকার মোশাররফ হোসেন, ব্যারিস্টার মওদুদ আহমদ, ব্যারিস্টার জমির উদ্দিন সরকার, মির্জা আব্বাস, গয়েশ্বর চন্দ্র রায়, ড. আব্দুল মঈন খান, নজরুল ইসলাম খান, আমীর খসরু মাহমুদ চৌধুরী, সেলিমা রহমান ও ইকবাল হাসান মাহমুদ টুকু।বৈঠক শেষে বিএনপির সিনিয়র যুগ্ম মহাসচিব রুহুল কবির রিজভী জানান, বিশ্বব্যাপী কোভিড- ১৯ মহামারীর প্রেক্ষিতে বিএনপি’র সাংগঠনিক কার্যক্রম/সাংগঠনিক গঠন ও পূণর্গঠন প্রক্রিয়া গত ১৫ সেপ্টেম্বর পর্যন্ত স্থগিত করা হয়েছিল। বাংলাদেশসহ বিশ্বব্যাপী করোনা মহামারী এখনো বিরাজমান। বাস্তবতার নিরীখে দলীয় কার্যক্রমের অগ্রগতির জন্য সাংগঠনিক কার্যক্রম/সাংগঠনিক গঠন ও পূণর্গঠন পুনরায় চালু করার সিদ্ধান্ত গ্রহণ করা হয়েছে।দেশব্যাপী দলের নেতাকর্মীদের সামাজিক দুরত্ব বজায় রেখে বিশ্বস্বাস্থ্য সংস্থার স্বাস্থ্যবিধি মেনে সাংগঠনিক কার্যক্রম পরিচালনার জন্য অনুরোধ করা হচ্ছে। বৈঠক সূত্রে জানা গেছে, গত ১৫ সেপ্টেম্বর আন্তর্জাতিক গণতন্ত্র দিবসে ডেইলি স্টারে ‘আফটার থার্টি ইয়ার্স অব অটোক্রেসিস ডিমাইস, ডেমোক্রেসি স্টিল রিমেইনস এ ডিস্ট্যান্ট ড্রিম’ শিরোনামে মাহফুজ আনামের নিবন্ধ প্রকাশিত হয়। বিএনপির চেয়ারপারসন খালেদা জিয়া সম্পর্কে নিবন্ধে যা উল্লেখ করা হয়েছে তা নিয়েও বৈঠকে আলোচনা হয়েছে। এরই মধ্যে ওই প্রবন্ধে খালেদা জিয়াকে নিয়ে যা বলা হয়েছে তা প্রত্যাখ্যান করেছে বিএনপি। এরপরও বিএনপি থেকে ওই নিবন্ধের বিষয়ে একটি লিখিত প্রতিবাদ লিপি পাঠানো হবে বলে জানা গেছে। 
",21/9/2020,politics
