সবাইকে অবশ্যই করোনা টেস্ট করাতে হবে: ওবায়দুল কাদের,"সবাইকে আবশ্যিকভাবে করোনাভাইরাস পরীক্ষা করার নির্দেশনা দিয়েছেন আওয়ামী লীগের সাধারণ সম্পাদক ও সেতুমন্ত্রী ওবায়দুল কাদের।



তিনি বলেন, অনেকেই টেস্টের ব্যাপারটিকে খুবই হেলাফেলা করছেন। টেস্ট করাচ্ছেন না। কাজেই টেস্ট বাধ্যতামূলক এবং সবাইকে অবশ্যই করোনা সংক্রমণ হয়েছে কিনা এ ব্যাপারে পরীক্ষা করাতে হবে। এখানে কোনো ভুল করলে তার মাশুল আমাদের দিতে হবে।বৃহস্পতিবার সচিবালয়ে নিজ দফতরে সমসাময়িক বিষয় নিয়ে সাংবাদিকদের সঙ্গে আলাপকালে তিনি এসব কথা বলেন।করোনার সংক্রমণ রোধে মানুষের মাঝে অবহেলা রয়েছে জানিয়ে ওবায়দুল কাদের বলেন, করোনা সংক্রমণ রোধে জনসাধারণের মাঝে অবহেলা দেখা যাচ্ছে। দেখা যাচ্ছে গা-ছাড়া ভাব। হাটে বাজারে, পরিবহনে, ফেরিঘাট, শপিংমল, জনসমাগমস্থলে যে চিত্র দেখা যাচ্ছে, মনে হচ্ছে দেশে কোনো করোনাই নেই। এই অবহেলা করোনা সংক্রমণ নতুন করে ঝুঁকিতে নিয়ে যেতে পারে।আসন্ন শীতে করোনার দ্বিতীয় তরঙ্গ আঘাত হানতে পারে বলে বিশেষজ্ঞরা বারবার বলছেন। সংক্রমনের ধারাবাহিকতা এখনো ক্রমহ্রাসমান ধারায় নামছে না।তিনি বলেন, প্রতিবেশী দেশ ভারতে প্রতিদিন সংক্রমণের সংখ্যা ৯০ হাজার থেকে এক লাখ এ পৌঁছে গেছে। এজন্য পার্শ্ববর্তী দেশ হিসেবে আমাদেরকে সচেতন ও সতর্ক থাকতে হবে। এরই মাঝে ইউরোপসহ পৃথিবীর বিভিন্ন দেশে দ্বিতীয় তরঙ্গ আঘাত হানছে। এ প্রেক্ষাপটে আমাদের কোনোভাবেই হেলাফেলা করার সুযোগ নেই। স্বাস্থ্যবিধি মেনে মাস্ক পরে জীবন-জীবিকার চাকা এগিয়ে নিতে হবে। সামান্য অবহেলা আমাদের ঝুঁকিতে ফেলতে পারে।বিএনপি চেয়ারপারসন খালেদা জিয়ার মুক্তির জন্য নতুন করে আন্দোলনের হুমকি প্রসঙ্গে আওয়ামী লীগ সাধারণ সম্পাদক ওবায়দুল কাদের বলেন, আন্দোলনের হাঁকডাক আমরা দশ বছর ধরে শুনেছি। দেশের জনগণ তাদের আন্দোলনের সক্ষমতা ইতিমধ্যে দেখে ফেলেছেন। বাস্তবে ৫০০ লোক নিয়ে যারা রাজপথে এক দলীয় নেত্রীর জন্য একটি মিছিল পর্যন্ত করতে পারেননি। এ ব্যর্থতা তারা ঢাকবেন কী করে?তিনি বলেন, প্রধানমন্ত্রী শেখ হাসিনা মানবিকতা প্রদর্শন করে বেগম জিয়ার বয়স বিবেচনা প্রথমে ছয় মাস পরে আরও ছয় মাস তার জামিনের মেয়াদ বাড়িয়ে দেন এটি বিএনপির আন্দোলনের ফসল নয়, শেখ হাসিনার মহানুভবতা ও মানবিকতার উদাহরণ।বিএনপির আন্দোলনের ডাক আষাঢ়ের তর্জন গর্জন সার উল্লেখ করে কাদের বলেন, কেউ যদি মনে করেন বিদেশে বসে খোমেনী স্টাইলে বিপ্লব ঘটি এদেশে সরকার পরিবর্তন ঘটাবেন তাহলে সে স্বপ্ন দুঃস্বপ্নেরই নামান্তর। আন্দোলন করে ক্ষমতার পরিবর্তন আসবে না। বাংলাদেশি আন্দোলনে কোনো বস্তুগত পরিস্থিতি বিরাজমান নেই। নির্বাচনের মাধ্যমেই ক্ষমতা পালাবদল হবে। অন্য কোনো অলিগলি পথ খুঁজে লাভ নেই। সেই সুযোগও নেই।",19/9/2020,politics
নেত্রীর জন্য ৫০০ লোক নিয়ে একটি মিছিলও করতে পারেননি: কাদের,"বিএনপির চেয়ারপারসন খালেদা জিয়ার মুক্তির জন্য দলটির নেতাদের নতুন করে আন্দোলনের হুমকি প্রসঙ্গে আওয়ামী লীগের সাধারণ সম্পাদক ওবায়দুল কাদের বলেছেন, গত ১০ বছর ধরে আন্দোলনের হাঁকডাক শুনছি, দেশের জনগণ তাদের আন্দোলনের সক্ষমতাও ইতিমধ্যে দেখে ফেলেছে।



তিনি বলেন, বাস্তবে ৫০০ লোক নিয়ে রাজপথে একটি মিছিলও এ পর্যন্ত বেগম জিয়ার জন্য করতে পারেনি; বিএনপি এ ব্যর্থতা ঢাকবে কী করে?ওবায়দুল কাদের বৃহস্পতিবার সকালে সচিবালয়ে তার নিজ দফতরে সমসাময়িক ইস্যুতে ব্রিফিংয়ে এ কথা বলেন। তিনি বলেন, বিএনপি নেতারা আন্দোলনের ডাক দিয়ে শীতাতপ নিয়ন্ত্রিত ঘরে বসে থাকলে কর্মীরা আন্দোলন করবে কীভাবে? বিএনপির আন্দোলনের ডাক আষাঢ়ের তর্জন-গর্জনই সার।সড়ক পরিবহন ও সেতুমন্ত্রী ওবায়দুল কাদের করোনা প্রসঙ্গে বলেন, বিশেষজ্ঞের মতে, আসন্ন শীতে সংক্রমণের দ্বিতীয় তরঙ্গ আঘাত হানতে পারে, তাই সবাইকে সর্বোচ্চ সতর্কতা অবলম্বন করতে হবে।তিনি বলেন, এরই মধ্যে বিশ্বের বিভিন্ন দেশে দ্বিতীয় তরঙ্গ আঘাত এনেছে, পার্শ্ববর্তী দেশ ভারতেও প্রতিদিন ৯০ হাজার থেকে এক লাখ রোগী শনাক্ত হচ্ছে। তাই এ প্রেক্ষাপটে কোনোভাবেই হেলাফেলার সুযোগ নেই। তিনি বলেন, সবাইকে মাস্ক পরিধানসহ স্বাস্থ্যবিধি মেনে জীবন ও জীবিকার চাকা এগিয়ে নিয়ে যেতে হবে, সামান্য অবহেলা আমাদের ঝুঁকিতে ফেলতে পারে।
",19/9/2020,politics
প্রধানমন্ত্রীর মানবিকতায় খালেদা জিয়ার জামিন বেড়েছে: কাদের,"দুর্নীতির দুই মামলায় দণ্ডিত বিএনপির চেয়ারপারসন খালেদা জিয়ার মুক্তির মেয়াদ আরও ৬ মাস বৃদ্ধি প্রসঙ্গে আওয়ামী লীগের সাধারণ সম্পাদক ওবায়দুল কাদের বলেছেন, এটি বিএনপির আন্দোলনের ফসল নয়, বরং প্রধানমন্ত্রীর মানবিকতায় খালেদা জিয়ার জামিন ছয় মাস বাড়ানো হয়েছে।



তিনি বৃহস্পতিবার সকালে সচিবালয়ে তার নিজ দফতরে সমসাময়িক ইস্যুতে ব্রিফিংয়ে এ কথা বলেন। ওবায়দুল কাদের বলেন, প্রধানমন্ত্রী শেখ হাসিনা মানবিকতা প্রদর্শন করে খালেদা জিয়ার বয়সজনিত বিষয়টি বিবেচনায় নিয়ে প্রথমে ছয় মাস, পরে আরও ছয় মাস জামিনের মেয়াদ বাড়িয়েছেন। তাই বলে এটি বিএনপির আন্দোলনের ফসল নয়, এটি শেখ হাসিনার মহানুভবতা ও মানবিকতার উদাহরণ'-যোগ করেন আওয়ামী লীগ সাধারণ সম্পাদক। আন্দোলনের হুমকি না দিয়ে বিএনপিকে পরবর্তী নির্বাচনের প্রস্তুতি নেয়ার আহ্বান জানান ওবায়দুল কাদের।ওবায়দুল কাদের বলেন, দেশে এ মূহুর্তে আন্দোলনের বস্তুগত কোনো পরিস্থিতি বিরাজমান নেই। বিএনপির সাবজেক্টিভ কোনো প্রিপারেশনও নেই। ক্ষমতার পালাবদল চাইলে, অন্য কোনো অলিগলি পথ না খুঁজে আগামী নির্বাচনের প্রস্তুতি নিন।
",19/9/2020,politics
হুমকি না দিয়ে পরবর্তী নির্বাচনের প্রস্তুতি নিন: বিএনপিকে কাদের,"আন্দোলনের হুমকি না দিয়ে বিএনপিকে পরবর্তী নির্বাচনের প্রস্তুতি নেয়ার আহ্বান জানিয়েছেন আওয়ামী লীগের সাধারণ সম্পাদক ওবায়দুল কাদের।



তিনি বৃহস্পতিবার সকালে সচিবালয়ে তার নিজ দফতরে সমসাময়িক ইস্যুতে ব্রিফিংয়ে এ আহ্বান জানান। ওবায়দুল কাদের বলেন, দেশে এ মূহুর্তে আন্দোলনের বস্তুগত কোনো পরিস্থিতি বিরাজমান নেই। বিএনপির সাবজেক্টিভ কোনো প্রিপারেশনও নেই। ক্ষমতার পালাবদল চাইলে, অন্য কোনো অলিগলি পথ না খুঁজে আগামী নির্বাচনের প্রস্তুতি নিন।খালেদা জিয়ার মুক্তির জন্য বিএনপির নতুন করে আন্দোলনের হুমকি প্রসঙ্গে আওয়ামী লীগের সাধারণ সম্পাদক বলেন, গত ১০ বছর ধরে আন্দোলনের হাঁকডাক শুনছি, দেশের জনগণ তাদের আন্দোলনের সক্ষমতাও ইতিমধ্যে দেখে ফেলেছে। তিনি বলেন, বাস্তবে ৫০০ লোক নিয়ে রাজপথে একটি মিছিলও এ পর্যন্ত বেগম জিয়ার জন্য করতে পারেনি; বিএনপি এ ব্যর্থতা ঢাকবে কী করে?'প্রধানমন্ত্রী শেখ হাসিনা মানবিকতা প্রদর্শন করে খালেদা জিয়ার বয়সজনিত বিষয়টি বিবেচনায় নিয়ে প্রথমে ছয় মাস, পরে আরও ছয় মাস জামিনের মেয়াদ বাড়িয়েছেন। তাই বলে এটি বিএনপির আন্দোলনের ফসল নয়, এটি শেখ হাসিনার মহানুভবতা ও মানবিকতার উদাহরণ'-যোগ করেন আওয়ামী লীগ সাধারণ সম্পাদক। তিনি বলেন, বিএনপি নেতারা আন্দোলনের ডাক দিয়ে শীতাতপ নিয়ন্ত্রিত ঘরে বসে থাকলে কর্মীরা আন্দোলন করবে কীভাবে? বিএনপির আন্দোলনের ডাক আষাঢ়ের তর্জন-গর্জনই সার।সড়ক পরিবহন ও সেতুমন্ত্রী ওবায়দুল কাদের করোনা প্রসঙ্গে বলেন, বিশেষজ্ঞের মতে, আসন্ন শীতে সংক্রমণের দ্বিতীয় তরঙ্গ আঘাত হানতে পারে, তাই সবাইকে সর্বোচ্চ সতর্কতা অবলম্বন করতে হবে।তিনি বলেন, এরই মধ্যে বিশ্বের বিভিন্ন দেশে দ্বিতীয় তরঙ্গ আঘাত এনেছে, পার্শ্ববর্তী দেশ ভারতেও প্রতিদিন ৯০ হাজার থেকে এক লাখ রোগী শনাক্ত হচ্ছে। তাই এ প্রেক্ষাপটে কোনোভাবেই হেলাফেলার সুযোগ নেই। তিনি বলেন, সবাইকে মাস্ক পরিধানসহ স্বাস্থ্যবিধি মেনে জীবন ও জীবিকার চাকা এগিয়ে নিয়ে যেতে হবে, সামান্য অবহেলা আমাদের ঝুঁকিতে ফেলতে পারে।
",19/9/2020,politics
এক সপ্তাহের মধ্যে উপকমিটির তালিকা দেয়ার নির্দেশ ওবায়দুল কাদেরের,"আগামী এক সপ্তাহের মধ্যে উপকমিটির তালিকা জমা দিতে আওয়ামী লীগের কেন্দ্রীয় নির্বাহী কমিটির সম্পাদকদের নির্দেশ দিয়েছেন দলটির সাধারণ সম্পাদক ওবায়দুল কাদের।



বুধবার দুপুরে নিজের সরকারি বাসভবনে ব্রিফিংকালে তিনি একথা জানান। এর আগে সকালে গণভবনে সভাপতিমণ্ডলীর সভায় দলীয় সভাপতি শেখ হাসিনার এ সংক্রান্ত নির্দেশনা আসে বলে জানান কাদের।ওবায়দুল কাদের বলেন, কেন্দ্রীয় নির্বাহী কমিটির সম্পাদকরা যারা এখনও উপকমিটির তালিকা জমা দেননি, তাদেরকে আগামী এক সপ্তাহের মধ্যে সংশ্লিষ্ট চেয়ারম্যানদের সঙ্গে পরামর্শ করে উপকমিটির তালিকা জমা দিতে হবে।এছাড়াও সারা দেশে দলের সাংগঠনিক কার্যক্রম জোরদারের লক্ষ্যে ৮টি বিভাগীয় কমিটি গঠনের নির্দেশ দেন আওয়ামী লীগ সাধারণ সম্পাদক।ওবায়দুল কাদের বলেন- যুগ্ম সাধারণ সম্পাদক, সাংগঠনিক সম্পাদক ছাড়াও সভাপতিমণ্ডলীর সদস্যরা এসব কমিটি গঠনে দায়িত্বে থাকবেন এবং বিভিন্ন বিভাগীয় কমিটিতে কেন্দ্রীয় নির্বাহী পরিষদের সদস্যরাও থাকবেন।তিনি বলেন, তৃণমূল পর্যন্ত দলকে পুনর্গঠন করার লক্ষ্যে যেসব জেলা ও মহানগরে সম্মেলন হয়নি, সেগুলোতে সম্মেলন করতে হবে। তবে এর আগে ওয়ার্ড, ইউনিয়ন ও উপজেলা পর্যায়ে সম্মেলনের কাজ শেষ করার নির্দেশ দেন ওবায়দুল কাদের। তিনি বলেন- ইতোপূর্বে যেসব উপজেলা, জেলা, মহানগর ও সহযোগী সংগঠনের সম্মেলন হয়েছে সেগুলোর কমিটি গঠন করে ১৫ সেপ্টেম্বরের মধ্যে তালিকা জমা দেয়ার কথা থাকলেও অনেকেই দেননি। যারা এখনও দেয়নি তাদের আগামী ৭ দিনের মধ্যে চূড়ান্ত কমিটির তালিকা জমা দিতে হবে। বিভিন্ন পর্যায়ের উপকমিটিতে ত্যাগী নেতাকর্মীদের এবং দুঃসময়ে দলের জন্য ত্যাগ স্বীকার করছেন- এমন নেতাদের মূল্যায়ন করতে হবে উল্লেখ করে কমিটি করার সময় কোনো ভাবেই স্বজনপ্রীতি দেখানো যাবে না বলে সতর্ক করে দেন আওয়ামী লীগ সাধারণ সম্পাদক।",19/9/2020,politics
বাহাউদ্দিন নাছিম করোনায় আক্রান্ত,"করোনায় আক্রান্ত হয়েছেন আওয়ামী লীগের যুগ্ম সাধারণ সম্পাদক কৃষিবিদ আ ফ ম বাহাউদ্দিন নাছিম।



বুধবার গণমাধ্যমকে বাহাউদ্দিন নাছিম নিজেই তার করোনা পজিটিভের বিষয়টি নিশ্চিত করেন। তিনি জানান, করোনার কিছু উপসর্গ দেখা দিলে তিনি নমুনা পরীক্ষা করাতে দেন। গেল মঙ্গলবার তার করোনা রিপোর্ট পজিটিভ আসে।বর্তমানে তিনি রাজধানীর একটি হাসপাতালে চিকিৎসাধীন আছেন বলে জানান নাছিম। তিনি ও তার পরিবার সবার কাছে দোয়া চেয়েছেন।",19/9/2020,politics
