নোয়াখালী হাসপাতালের যন্ত্রপাতি আত্মসাতে দুদকের অনুসন্ধান,"২৫০ শয্যাবিশিষ্ট নোয়াখালী জেনারেল হাসপাতালের ৭ কোটি টাকার যন্ত্রপাতি আত্মসাতের অভিযোগে দুদক অনুসন্ধান শুরু করেছে। নোয়াখালী দুদকের সহকারী পরিচালক ও তদন্ত টিমের প্রধান সুবেল আহমেদের নেতৃত্বে গঠিত টিম বুধবার থেকে এ অনুসন্ধান শুরু করেছে বলে জেলা দুদক সূত্র জানায়।



২৫০ শয্যা নোয়াখালী জেনারেল হাসপাতালে বিভিন্ন সময়ে সরবরাহকৃত সি আর এক্স-রে মেশিনসহ সরঞ্জামাদি ও যন্ত্রপাতির মূল্য যাচাই সম্পর্কে দুদক স্বাস্থ্য বিভাগের একটি উচ্চপদস্থ টিম নিয়ে সরেজমিন বুধবার থেকে অনুসন্ধান শুরু করেছে।দুদকের এই অনুসন্ধান টিমের অন্য সদস্যরা হচ্ছেন সিএমএইচডি ঢাকার উপ-পরিচালক ডা. নিজামুদ্দিন, স্বাস্থ্য অধিদফতর হাসপাতাল-৪-এর সহকারী পরিচালক ডা. আহসানুল হক, শহীদ সোহরাওয়ার্দী মেডিকেল কলেজের রেডিওলোজী বিভাগের সহযোগী অধ্যাপক ডা. শহিদুল ইসলাম, নিমিউ এন্ড টিসির সহকারী প্রকৌশলী (ইলেকট্রনিকস) নাশিদ রহমান, ডিপিএম হাসপাতালের ডা. সুরজিত দত্ত।দুদকের সহকারী পরিচালক শফিউল আহমেদের নেতৃত্বে এই টিম বুধবার হাসপাতালে এসে দেখতে পায়, প্রায় ৫০ লাখ টাকা মূল্যের একটি সিআর এক্স-রে মেশিন -৫০০ অকেজো অবস্থায় পড়ে আছে যা প্রায় ৫ বছর সরবরাহ নেয়ার পর থেকে একদিনও কাজে আসেনি। এ ছাড়া ২০১৩-১৪ ও ২০১৪-১৫ অর্থবছরে সরবরাহ নেয়া অটোমেশন, পোর্টাবেল ৪-ডি আল্ট্রাসনোগ্রাফি, আইসিইউ বেড, ডেন্টাল চেয়ারসহ যন্ত্রপাতি সরবরাহ নেয়া পণ্যের স্পেসিফিকেশন অনুযায়ী সঠিক পাওয়া যায়নি। যার মূল্য অভিযোগকারী তার অভিযোগে ৭ কোটি টাকা উল্লেখ করেছেন।নোয়াখালী দুদকের উপ-পরিচালক জাহাঙ্গীর আলম জানান, অনুসন্ধান অব্যাহত রয়েছে। শিগগিরই এই অনুসন্ধান শেষ করে সরকারি টাকা আত্মসাৎকারীদের আইনের আওতায় আনা হবে।",20/9/2020,country-news
তহশিলদারের গলায় ছুরি ধরে ডিসিআর লুট যুবলীগ নেতার,"নোয়াখালী সদরের মৃধারহাট ভূমি অফিসের তহশিলদার আবদুল হাইয়ের গলায় ছুরি ধরে জোরপূর্বক স্বাক্ষর করিয়ে সরকারি ডিসিআর লুট করে নিয়েছে যুবলীগ নেতার নেতৃত্বে একদল দুর্বৃত্ত। তারা অফিসে ঢুকে সহকারী কমিশনারকেও (ভূমি) হুমকি-ধমকি দেয়।



মৃধারহাট ভূমি অফিসের তহশিলদার আবদুল হাই জানান, প্রতিদিনের মতো ১৪ জুলাই তহশিলে বসে কাজ করছিলেন তিনি। দুপুর দেড়টার দিকে নেয়াজপুর ইউনিয়ন যুবলীগ সভাপতি মেজবাহ উদ্দিন শামীম ও তার সহযোগী যুবলীগ নেতা জিয়া উদ্দিন রাব্বির নেতৃত্বে একদল দুর্বৃত্ত তার অফিসে হামলা করে চেয়ার, টেবিল ও আলমারিতে লাথি মারে। তাকে ১১৫নং জাহানাবাদ মৌজার সরকারের নদী শ্রেণির ১৬.৫৫ একর জায়গা-সম্পত্তি আত্মসাতের জন্য ডিসিআর কেটে দিতে বলে। তিনি রাজী না হওয়ায় যুবলীগ সভাপতি ও তার লোকজন গলায় ছুরি ধরে জোর পূর্বক ডিসিআর বইতে স্বাক্ষর করিয়ে তা লুট করে নিয়ে যায়।এ ব্যাপারে ঊর্ধ্বতন কর্মকর্তাদের অনুমতি নিয়ে আবদুল হাই সুধারাম থানায় যুবলীগ সভাপতি মেজবাহ উদ্দিন শামীমসহ যুবলীগ নেতা জিয়া উদ্দিন রাব্বি, জয়নাল আবেদিন, দেলোয়ার হোসেন, বেলায়েত হোসেন, আকবার হোসেন, জসিমউদ্দীন, খলিলুর রহমান ও মো. রাকিবকে আসামি করে মামলা দায়ের করেন।তহশিলদার কেন মামলা করল তা নিয়ে জিয়া উদ্দিন রাব্বি সহকারী কমিশনার (ভূমি) অফিসে গিয়ে মামলা প্রত্যাহার করা না হলে তহশিলদারকে দেখে নেয়ার হুমকি দেয়।একটি সূত্র জানায়, ঊর্ধ্বতন কর্মকর্তারা এখন তাকে আপাতত তহশিলে না যাওয়ার পরামর্শ দিয়েছেন।সদর উপজেলার সহকারী কমিশনার (ভূমি) মো. জাকারিয়া ঘটনার সত্যতা নিশ্চিত করে বলেন, যুবলীগ সভাপতির নেতৃত্বে এ চক্রটি ১১৫নং জাহানাবাদ মৌজার ১৮৬ দাগের সরকারের নদীশ্রেণির ১৬.৫৫ একর জায়গা-সম্পত্তি আত্মসাতের জন্য তহশিলদারকে রাজী করাতে না পারায় তার গলায় ছুরি ধরে ডিসিআরে স্বাক্ষর করিয়ে তা লুট করে নিয়েছে। আইন মোতাবেক ব্যবস্থা নেয়া হচ্ছে।সুধারাম থানার ওসি নবির হোসেন বলেন, আসামিরা পলাতক থাকায় গ্রেফতার করা যাচ্ছে না।এ ব্যাপারে যুবলীগ সভাপতি মেজবাহ উদ্দিন শামীম বলেন, এ সম্পত্তির মালিক তারা। তহশিলদার ডিসিআর দিচ্ছিল না তাই সমস্যা হয়েছে।",20/9/2020,country-news
নোয়াখালীর গ্রামে-গঞ্জেও ছড়িয়ে পড়ছে করোনা,"নোয়াখালী জেলা, উপজেলা শহরসহ গ্রামে-গঞ্জে ছড়িয়ে পড়েছে করোনাভাইরাস। জেলায় এ পর্যন্ত মারা গেছেন ৪৩ জন, আক্রান্ত হয়েছেন ১১৬ পুলিশ সদস্যসহ ১ হাজার ৮২৮ জন। বর্তমানে কোম্পানীগঞ্জ উপজেলায় লকডাউন চলছে।



জেলা সিভিল সার্জন ডা. মাসুম ইফতেখার জানান, গত ২৪ ঘণ্টায় আক্রান্ত হয়েছে ১৯ জন এবং মারা গেছেন ২ জন। এ নিয়ে মারা গেছে ৪৩ জন। জেলায় ১১৬ পুলিশ সদস্যসহ ১ হাজার ৮২৮ জনের করোনা শনাক্ত হয়েছে। ৪২ লাখ মানুষের জেলায় এ পর্যন্ত ১০ হাজার ৪২ জনের করোনা স্যাম্পল কালেকশন করে রিপোর্ট পাওয়া গেছে ৮ হাজার ৯৪৬ জনের।এ জেলায় করোনা উপসর্গ নিয়ে মারা গেছেন ১৩ জন। বিনা চিকিৎসায় মারা গেছেন ৫ জন।সিভিল সার্জন ডা. মাসুম ইফতেখার জানান, জেলার নোয়াখালী সদর, চৌমুহনী ও চাটখিল পৌরসভার ৯টি ওয়ার্ডের করোনা পরিস্থিতি দ্রুত অবনতির কারণে ৩ দিন পূর্বে এ ওয়ার্ডগুলোকে রেড জোন ঘোষণা করার অনুমতির জন্য স্বাস্থ্য অধিদফতরে চিঠি লেখা হয়েছে। বৃহস্পতিবার পর্যন্ত কোনো আদেশ না দেয়ায় রেড জোন ঘোষণা করা যাচ্ছে না। এ ব্যাপারে জেলা স্বাচিপ সভাপতি ডা. ফজলে এলাহী খান ঢাকায় কাজ করছেন।তিনি বলেন, নোয়াখালী জেলা, উপজেলা শহরসহ গ্রামে-গঞ্জে ছড়িয়ে পড়েছে করোনাভাইরাস। পরিস্থিতি দ্রুত অবনতির দিকে যাওয়ায় আমরা অনেক বাড়ি লকডাউন ঘোষণা করার চিন্তা-ভাবনা করছি।তবে বাড়ির সংখ্যা তিনি জানাতে পারেননি।",20/9/2020,country-news
"নোয়াখালীতে করোনায় ৪০ জনের মৃত্যু, শনাক্ত ১৮০৯ জন","নোয়াখালীতে করোনায় আক্রান্ত হয়ে মোট ৪০ জনের মৃত্যু হয়েছে। জেলায় নতুন করে ৬৯ জনসহ মোট ১ হাজার ৮০৯ জনের করোনা শনাক্ত হয়েছে। নতুন ১২ জনসহ মোট আক্রান্ত হয়েছেন ৬৮০ জন।



বুধবার দুপুরে জেলা সিভিল সার্জন ডা. মাসুম ইফতেখার জানান, এ যাবত আবদুল মালেক উকিল মেডিকেল কলেজে ও নোয়াখালী বিজ্ঞান ও প্রযুক্তি বিশ্ববিদ্যালয় (নোবিপ্রবি) করোনা ল্যাবে মোট ৯ হাজার ৮৯৯ জনের নমুনা পাঠানো হয়। এর মধ্যে ফলাফল এসেছে ৮ হাজার ৮৩৩ জনের।২১ ও ২২ জুন যাদের শরীরের নমুনা সংগ্রহ করে পরীক্ষা জন্য আবদুল মালেক উকিল মেডিকেল কলেজে এবং নোয়াখালী বিজ্ঞান ও প্রযুক্তি বিশ্ববিদ্যালয় (নোবিপ্রবি) করোনা ল্যাবে পাঠানো হয়েছিল। ২৩ জুন রাতে তাদের ৫৯ জনের রিপোর্ট করোনা পজিটিভ আসে। এতে ১ হাজার ৮০৯ জনের করোনা পজিটিভ আসে। এর মধ্যে সুস্থ হয়েছেন ৬৮০ জন। আক্রান্তদের মধ্যে ৩৪ জনকে মাইজদী শহীদ ভুলু স্টেডিয়ামে অস্থায়ী করোনাভাইরাস হাসপাতালের আইসোলেশনে রাখা হয়েছে। ১ হাজার ৫৫ জন নিজ নিজ বাড়িতে আইসোলেশনে রয়েছেন।করোনাভাইরাসের সংক্রমণ ও মৃত্যু বেড়ে যাওয়ায় নোয়াখালীর কোম্পানীগঞ্জ উপজেলায় লকডাউন চলছে। সদর ও বেগমগঞ্জ উপজেলায় গতকাল লকডাউন না মেনে দোকান খোলা রাখায় ৩টি প্রতিষ্ঠানকে ৪ হাজার ৫০০ টাকা জরিমানা এ ছাড়া সড়কে যানবাহন চলাচল করায় ১০টি গাড়ি আটক করেছে মোবাইল কোর্ট।",20/9/2020,country-news
"নোয়াখালীর ৩ উপজেলার লকডাউন শেষ, এবার ৩ পৌরসভা","নোয়াখালীর ৩টি উপজেলার ১৫ দিনের লকডাউন মঙ্গলবার শেষ হচ্ছে। আর জেলার নোয়াখালী সদর পৌরসভা, চৌমুহনী পৌরসভা ও চাটখিল পৌরসভার ৯টি ওয়ার্ড ও করোনা আক্রান্ত রোগীর বাড়ি বাড়ি কঠোর লকডাউনের ঘোষণা আসছে।



জেলা সিভিল সার্জন ডা. মাসুম ইফতেখার জানান, নোয়াখালীর করোনা পরিস্থিতি দ্রুত অবনতির কারণে মঙ্গলবার বেলা ১১টায় নোয়াখালীর জেলা প্রশাসক তন্ময় দাসের সভাপতিত্বে জেলা করোনা কমিটির সভার সিদ্ধান্ত অনুযায়ী বেগমগঞ্জ, সদর ও কোম্পানীগঞ্জ উপজেলার লকডাউন আর বৃদ্ধি করা হচ্ছে না। স্বাস্থ্য বিভাগের রূপরেখা অনুযায়ী জেলার নোয়াখালী পৌরসভার ৪টি ওয়ার্ড, চৌমুহনী পৌরসভার ৩টি ওয়ার্ড ও চাটখিল পৌরসভার ২টি ওয়ার্ডকে রেড জোন ঘোষণা করা হবে। পরে এ ৩ পৌরসভার ৯টি ওয়ার্ডে কঠোরভাবে লকডাউন করা হবে।তিনি জানান, জেলার যে সব বাড়িতে করোনা পজিটিভ রোগী পাওয়া যাবে ওই বাড়িগুলোকে লকডাউন করা হবে। লকডাউন করা কোনো ওয়ার্ড বা বাড়ি থেকে কোনো লোকজনকে বাইরে যেতে বা আসতে দেয়া হবে না। স্বাস্থ্য বিভাগ লকডাউন ঘোষিত এলাকায় স্বাস্থ্যসেবা নিশ্চিত করবে। আইন প্রয়োগকারী সংস্থা ও স্বেচ্ছাসেবকরা লকডাউন কড়াকড়ি নিশ্চিত করবেন।",20/9/2020,country-news
নোয়াখালী করোনা হাসপাতালে আইসিইউ-ভেন্টিলেটর দিলেন ওবায়দুল কাদের,"করোনা রোগীদের চিকিৎসায় নোয়াখালী করোনা হাসপাতালের জন্য সড়ক পরিবহন ও সেতু মন্ত্রী এবং আওয়ামী লীগের সাধারণ সম্পাদক ওবায়দুল কাদের নিজস্ব তহবিল থেকে দুই সেট আইসিইউ-ভেন্টিলেটর দিয়েছেন।



সোমবার দুপুরে ঢাকায় তার সরকারি বাসভবনে স্বাস্থ্য প্রকৌশল অধিদফতরের নিকট ভেন্টিলেটর দুটি হস্তান্তর করেন তিনি।এসময় তিনি সরকারের পাশাপাশি একরামুল করিম চৌধুরী এমপির মত জেলার সামর্থ্যবানদেরকেও জেলার মানুষের স্বাস্থ্যসেবায় এগিয়ে আসার আহ্বান জানান।ওবায়দুল কাদের বলেন, ২৪ ঘণ্টার মধ্যে এ ভেন্টিলেটর দুটি নোয়াখালী সিভিল সার্জনের নিকট পৌঁছে দেয়া হবে। যা দ্রুততম সময়ের মধ্যে রোগীদের সেবায় ব্যাবহার করতে হবে।এ ব্যাপারে জেলা সিভিল সার্জন ডা. মাসুম ইফতেখার জানান, নোয়াখালীতে কোনো আইসিইউ নাই। এই ভেন্টিলেটর গুলি বসাতে আরও অনেক যন্ত্রপাতি লাগবে। সে ব্যাপারে স্বাস্থ্য অধিদফতরে চাহিদা দেয়া হবে। যন্ত্রপাতি পাওয়ার পর সিদ্ধান্ত নেয়া হবে এটা কি কবিরহাট হাসপাতালে নাকি জেনারেল হাসপাতালে বসানো হবে। কক্ষ ঠিক করে ভেন্টিলেটর বসানো হবে বলে তিনি জানান।",20/9/2020,country-news
নোয়াখালীতে এবার বাড়ি বাড়ি লকডাউন!,"নোয়াখালীতে এবার করোনা আক্রান্তদের বাড়ি বাড়ি লকডাউনের ঘোষণা আসছে। এ লকডাউন করা বাড়িগুলোর পাহারায় থাকবে ছাত্রলীগ ও যুবলীগের কর্মীরা। লক করা এ সব বাড়ি থেকে কেউ বেরোতে পারবে না এবং কাউকে বাড়িতে ঢুকতে দেয়া হবে না।



এ ব্যাপারে রোববার জেলা প্রশাসক, পুলিশ সুপার, সিভিল সার্জন, সদর উপজেলা চেয়ারম্যানের সঙ্গে সভায় এ সিদ্ধান্ত নেয়া হয়েছে বলে এক বেসরকারি টেলিভিশনের সঙ্গে কথা বলার সময় জানান, নোয়াখালী-৪ (সদর ও সুবর্ণচর) আসনের এমপি ও স্বাস্থ্য মন্ত্রণালয় সম্পর্কিত স্থায়ী কমিটির সদস্য একরামুল করিম চৌধুরী।তিনি বলেন, বেগমগঞ্জ ও সদর লকডাউন শেষ হচ্ছে ২৩ জুন। তার পর থেকে আর এলাকাভিত্তিক লকডাউন না দিয়ে বাড়ি বাড়ি লকডাউনের সিদ্ধান্তটা নেয়া হয়েছে। লকডাউনে তিনি মাঠে ছিলেন কিন্তু দুই-একটা পত্রিকার বিরূপ সংবাদ পরিবেশনের কারণে তিনি ঘরে চলে যান। কিন্তু এর পর তার নেতাকর্মীরা একে একে মারা যাচ্ছে তাই তিনি ঘরে বসে থাকতে পারেন না।দু'দিন আগে তিনি ফেসবুক লাইভে বলেছিলেন, স্বাস্থ্য বিভাগ কে চালায়? এর আগাগোড়া নেই। তিনি সংসদীয় কমিটির সদস্য অথচ তিনি জানেন না কীভাবে চলছে এ বিভাগ।এক প্রশ্নের জবাবে তিনি জানান, এ অসহযোগিতা বা অনিয়মের কথা প্রধানমন্ত্রীকে জানানো হয়নি তবে সময় এসেছে জানানো হবে। স্বাস্থ্য বিভাগের কোনো আগা-গোড়া নেই বলেও এ এমপি উস্মা প্রকাশ করেন।",20/9/2020,country-news
নোয়াখালীতে আরও ২৬ জনের করোনা শনাক্ত,"নোয়াখালীতে নতুন করে আরও ২৬ জন করোনাভাইরাসে আক্রান্ত হয়েছেন। এ নিয়ে জেলায় মোট আক্রান্ত ১ হাজার ৬৮৩ জন। এদের মধ্যে মৃত্যু হয়েছে ৪০ জনের। আর সুস্থ হয়েছেন ৬০৫ জন।



রোববার বেলা ১১টায় বিষয়টি নিশ্চিত করে জেলা সিভিল সার্জন ডা. মাসুম ইফতেখার বলেন, পজিটিভ কোনো ব্যক্তি যেন বাইরে ঘোরাঘুরি করতে না পারে সে জন্য বিশেষ ব্যবস্থা নেয়া হবে।১৮ ও ১৯ জুন যাদের শরীরের নমুনা সংগ্রহ করে পরীক্ষা জন্য আবদুল মালেক উকিল মেডিকেল কলেজে ও নোয়াখালী বিজ্ঞান ও প্রযুক্তি বিশ্ববিদ্যালয় (নোবিপ্রবি) করোনা ল্যাবে পাঠানো হয়েছিল শনিবার রাতে ২৬ জনের করোনা পজিটিভ আসে। ২৪ ঘণ্টায় দুইটি ল্যাবে স্যাম্পল প্রেরণ ৩৬৩ জনের, ফলাফল এসেছে ৫৭ জনের।আক্রান্ত ১ হাজার ৬৮৩ জনের মধ্যে বেগমগঞ্জে ৫৮১ জন, সদরে ৫৬১ জন, চাটখিলে ১১০ জন, সোনাইমুড়ীতে ৮৮ জন, কবিরহাটে ১৩৭ জন, কোম্পানীগঞ্জে ৪৪ জন, সেনবাগে ৮৫ জন, হাতিয়া ১২ জন ও সুবর্ণচরে ৬৫ জন।",20/9/2020,country-news
