আফগানিস্তানে সন্তানের পরিচয়পত্রে বাবার পাশাপাশি মায়ের নাম,"আফগানিস্তানে এখন থেকে সন্তানের জাতীয় পরিচয়পত্রে বাবার নামের পাশাপাশি মায়ের নামও থাকবে। দেশটির কর্মকর্তাদের বরাতে বিবিসি এমন খবর জানিয়েছে।



বৃহস্পতিবার প্রেসিডেন্ট আশরাফ গনি এ সংক্রান্ত একটি আইনের সংশোধনীতে সই করেছেন।বিবিসির খবরে বলা হয়, নারী অধিকার কর্মীদের দীর্ঘ আন্দোলনের ফলে আফগান কর্তৃপক্ষ সন্তানের পরিচয়পত্রে মায়ের নাম যুক্ত করতে যাচ্ছে।যুদ্ধবিধ্বস্ত এ দেশটির অনেক অংশে এখনও কোনো নারীর নাম প্রকাশ্যে এলে তাকে নেতিবাচকভাবে দেখা হয়। কোথাও কোথাও একে অপমানজনক বলেও বিবেচনা করা হয়।এ রীতির কারণে এতদিন ধরে আফগানিস্তানে শিশুদের জাতীয় পরিচয়পত্রে কেবল বাবার নামই থাকতো।শেষ পর্যন্ত সন্তানের পরিচয়পত্রে মায়ের নাম যুক্ত হওয়ার সিদ্ধান্তে সন্তোষ প্রকাশ করেছেন হয়ার ইজ মাই নেম হ্যাশট্যাগ ক্যাম্পেইনের প্রতিষ্ঠাতা লালেহ ওসমানি।তিনি বলেন, ধারাবাহিক প্রচার এবং দাবির পক্ষে নাগরিক ও প্রচারকর্মীদের ঐক্যবদ্ধ অবস্থানের ফলেই যে এ বিজয় এসেছে, তাতে কোনো সন্দেহই নেই।",19/9/2020,international
বাড়ছে চীন-তাইওয়ান উত্তেজনা,"তাইওয়ান প্রণালীতে যখন ১৮টি চীনা বিমানের মহড়া চলছিল, তখন তার জবাবে বেশ কয়েকটি জঙ্গি বিমান উড়িয়েছে তাইওয়ান।



এসব বিমান তাইওয়ান প্রণালীর স্পর্শকাতর মধ্যরেখা অতিক্রম করেছে। তাইপেতে এক জ্যেষ্ঠ মার্কিন কর্মকর্তার আলোচনার প্রেক্ষাপটে এই মহড়ার আয়োজন করেছে চীন।যুক্তরাষ্ট্র ও তাইওয়ানের মধ্যে ষড়যন্ত্রের অভিযোগ তুলে তার নিন্দা জানিয়ে যুদ্ধ মহড়ার ঘোষণা দেয় চীন। তাইওয়ানকে নিজের অবিচ্ছেদ্য অংশ বলে মনে করে চীন।তিন দিনের সফরে বৃহস্পতিবার তাইপেতে পা রাখেন মার্কিন অর্থনীতি বিষয়ক আন্ডারসেক্রেটারি কেইথ ক্রাচ। গত চার দশকের মধ্যে তাইওয়ান সফরে আসা সবচেয়ে জ্যেষ্ঠ কর্মকর্তা হলেন তিনি।তবে এ ঘটনার প্রয়োজনীয় জবাব দেয়া হবে বলে জানিয়েছে চীন। মার্কিন পররাষ্ট্র মন্ত্রণালয় বলছে, প্রেসিডেন্ট লি টেং-হুইয়ের স্মরণানুষ্ঠানে অংশ নিতে তাইওয়ানে গেছেন ক্রাচ। লিকে তাওয়ানের গণতন্ত্রের জনক বলে আখ্যায়িত করা হয়।এরপর শুক্রবারেই ১৮টি চীনা বিমান তাইওয়ান প্রণালীর মিডলাইনের ওপর দিয়ে উড়ে গেছে বলে জানিয়েছে তাইওয়ানের প্রতিরক্ষামন্ত্রণালয়।টুইটারে ইংরেজি ভাষার এক বিবৃতিতে মন্ত্রণালয় বলেছে, ১৮ সেপ্টেম্বরে দুটি এইচ-৬, আটটি জে-১৬, চারটি জে-১০ এবং চারটি জে-১১ জঙ্গি বিমান তাইওয়ান প্রণালীর মিডলাইন পার হয়ে তাইওয়ানের দক্ষিণপশ্চিমের এডিআইজেড (এয়ার ডিফেন্স আইডেন্টিফিকেশন জোন)-এ প্রবেশ করেছে।এই চীনা জঙ্গিবিমানগুলো যে পথ দিয়ে উড়ে গেছে তার একটি মানচিত্র দেখিয়েছে তাইওয়ানের প্রতিরক্ষামন্ত্রণালয়। সেগুলোর তাইওয়ানপ্রণালী মিডলাইন পেরোনোরও প্রমাণ দিয়েছে তারা। সাধারণত কোনও পক্ষেরই জঙ্গি বিমান এই মিডলাইন পেরোয় না।কিন্তু এবার তাইওয়ানের ভাষ্যমতে, চীন সেখানে একগাদা জঙ্গি বিমান উড়িয়েছে। তাইওয়ানের লিবার্টি টাইমস নিউজপেপার বলেছে, চীনের জঙ্গিবিমানগুলোকে দূরে সরে যাওয়ার সতর্কবার্তা দিয়ে তাইওয়ানের জঙ্গিবিমানগুলো শুক্রবার সকালে ৪ ঘন্টা ধরে ১৭ বার আকাশে চক্কর দিয়েছে।তাছাড়া তাইওয়ানের পূর্ব উপকূলের হুয়ালিয়েন বিমান ঘাঁটিতে এফ-১৬ জঙ্গিবিমানে ক্ষেপণাস্ত্র ভরার একটি ছবিও ছাপিয়েছে পত্রিকাটি।",19/9/2020,international
"নেপালে পাঠ্যবইয়ে নতুন মানচিত্র, এরপর মুদ্রায় ","সীমান্তের বিতর্কিত তিন ভূখণ্ড মানচিত্রে যুক্ত করে গত জুনে সংবিধান সংশোধন করেছিল নেপাল। এবার সেই নতুন মানচিত্র সম্বলিত পাঠ্যবই প্রকাশ করল দেশটির শিক্ষা দফতর।



শুধু তাই নয়, নেপালের নতুন মুদ্রাতেও খোদাই করা থাকবে নয়া ম্যাপ। নেপালের সরকারি একটি সূত্রের বরাতে টাইমস অব ইন্ডিয়া এ তথ্য জানিয়েছে। 

নেপালের শিক্ষামন্ত্রী গিরিরাজ মনি পোখারেল জানিয়েছেন, উচ্চ মাধ্যমিকের পাঠ্যবইয়ে নতুন মানচিত্র সংযোজন হয়েছে। এছাড়া মানচিত্র সম্বলিত পাঠ্যবইয়ে শিক্ষামন্ত্রী নিজেই ভূমিকা লিখেছেন। আর সেখানে লিপুলেখ, কালাপানি এবং লিম্পিয়াধাউরাকে নেপালের ভূখণ্ড হিসেবে দেখানো হয়েছে।নতুন বইয়ে নেপালের মোট ভূখণ্ড উল্লেখ করা হয় ১ লাখ ৪৭ হাজার ৬৪১.২৮ বর্গ কিলোমিটার। এর মধ্যে শুধু কালাপানি এলাকা ধরা হয়েছে ৪৬০ বর্গ কিলোমিটার। এছাড়া নতুন মানচিত্র সংযোজিত করে নতুন ১ টাকা ও ২ টাকার কয়েনও তৈরি করা হচ্ছে। দশেরার দিন আনুষ্ঠানিকভাবে সেই কয়েন নেপালের বাজারে ছাড়ার পরিকল্পনা রয়েছে ওলি সরকারের। গত জুনে সীমান্তের বিতর্কিত লিপুলেখ, কালাপানি এবং লিম্পিয়াধাউরাকে নেপালের ভূখণ্ড দাবি করে সংসদের উচ্চকক্ষে নতুন মানচিত্র বিল পাস হয়। এর মধ্যেই আরও দুটি বিতর্কিত ভূখণ্ড নৈনিতাল ও দেরাদুনকেও নেপালের ভূখণ্ড বলে দাবি করছে ওলি সরকার। ",19/9/2020,international
শান্তি আলোচনার মধ্যেই আফগান তালেবান সংঘর্ষ,"কাতারের দোহায় আফগান সরকারের সঙ্গে বিদ্রোহী গোষ্ঠী তালেবানের চলমান শান্তি আলোচনার মধ্যে আফগানিস্তানের নানগারহারে দুই পক্ষের মধ্যে তীব্র লড়াই শুরু হয়েছে।



বুধবার থেকে চলমান হামলা-পাল্টাহামলায় উভয়পক্ষের অন্তত ৬০ যোদ্ধা নিহত হয়েছেন। এর মধ্যে তালেবানের একজন কামন্ডার রয়েছে। খবর আলজাজিরার।দুই দশক ধরে চলা রক্তক্ষয়ী সংঘাতে আফগানিস্তানে কয়েক হাজার মানুষ নিহত হয়েছেন। বাস্তুচ্যুত হয়েছেন কয়েক লাখ মানুষ। এবার শান্তি প্রতিষ্ঠার লক্ষ্যে দেশটির নির্বাচিত সরকারের সঙ্গে প্রথমবারের মতো মুখোমুখি আলোচনায় অংশ নিচ্ছে তালেবান।শনিবার থেকে কাতারের রাজধানী দোহায় তাদের ঐতিহাসিক শান্তি আলোচনা শুরু হয়েছে। দুই দশক ধরে চলমান যুদ্ধের অবসান ছাড়াও দেশটিতে নারী অধিকার রক্ষার বিষয়টিও গুরুত্ব পেয়েছে আলোচনায়।ওই শান্তি আলোচনার মধ্যে বুধবার রাতে নানগারহার প্রদেশে দুই পক্ষের মধ্যে লড়াই শুরু হয়। নানগারহার প্রাদেশিক সরকারের মুখপাত্র জানান, বুধবার রাতে পূর্বাঞ্চলীয় প্রদেশের একটি শহরে রাতভর এই লড়াইয়ে আফগান নিরাপত্তা বাহিনীর ১১ সদস্য, আটজন সরকার সমর্থক যোদ্ধা এবং ৩০ তালেবান সদস্য নিহত হয়েছেন।প্রাদেশিক সরকারের মুখপাত্র আতাউল্লাহ খোজিয়ানি দাবি করেন, তালেবান যোদ্ধারা কয়েকটি নিরাপত্তা চৌকিতে হামলা চালালে এই লড়াই শুরু হয়। আফগান প্রতিরক্ষামন্ত্রী আসাদুল্লাহ খালিদ বলেন, ‘আমাদের তরফ থেকে কোনো হামলাহয়নি। শত্রুরা হামলা অব্যাহত রেখেছে আর আফগান নাগরিকদের রক্তপাত চালিয়ে যাচ্ছে।’তবে আফগান কর্তৃপক্ষের এ দাবির ব্যাপারে কোনো মন্তব্য করেনি। তোলো নিউজ জানিয়েছে, বৃহস্পতিবার কাবুলে আফগান বাহিনীর পৃথক এক অভিযানে গাইরুল্লাহ নামে তালেবানের ‘রেড ইউনিট’র এক শীর্ষ কমান্ডার নিহত হয়েছেন।এছাড়া ওই অভিযানে আরও সালাহুদ্দিন সাদিক নামে এক যোদ্ধা নিহত ও ১০ জন আহত হয়েছেন। এদিকে কাতারের দোহায় চলমান আলোচনা ‘খুবই আশাপ্রদ ও আফগান জনগণের জন্য গুরুত্বপূর্ণ’ বলে মন্তব্য করেছেন আফগানিস্তানে মার্কিন ও ন্যাটো বাহিনীর কমান্ডার জেনারেল স্কট মিলার।তবে আফগান সরকারের প্রতিনিধি আবদুল্লাহ আবদুল্লাহ বলেছেন, আলোচনা চালিয়ে যাওয়া খুবই কঠিন। তবে আমাদের আরও কঠিন সিদ্ধান্ত নিতে হবে।",19/9/2020,international
যুক্তরাষ্ট্রকে সতর্ক করে তাইওয়ান প্রণালীতে সামরিক মহড়া চীনের,"তাইওয়ান প্রণালীতে সামরিক মহড়া চালিয়েছে চীন। তাইওয়ানে যখন মার্কিন উচ্চ পদস্থ কর্মকর্তা সফরে গেছেন ঠিক সে সময়ই এই মহড়া দিয়েছে বেইজিং। নিজেদের সার্বভৌমত্ব রক্ষা করতেই এই মহড়া চালানো হয়েছে বলে দাবি চীনের। খবর বিবিসির।



যুক্তরাষ্ট্র ও চীনের মধ্যে তীব্র উত্তেজনা চলছে। তাইওয়ানকে ঘিরে দুই দেশেরে সম্পর্ক আগুনে ঘি ঢালার মতো অবস্থা। যুক্তরাষ্ট্রের কূটনীতি তাইওয়ানের পক্ষাবলম্বন করায় উত্তেজনা আরও বেড়েছে। চীন স্বশাসিত তাইওয়ানকে একটি বিচ্ছিন্ন প্রদেশ হিসেবে মনে করে। তাইপে স্বাধীন হওয়ার চেষ্টা করলে প্রয়োজনে শক্তি প্রয়োগেরও হুমকি দিয়ে রেখেছে তারা।তাইওয়ানের প্রেসিডেন্ট সাই ইং-ওয়েনের সঙ্গে বৈঠক করতে তিনদিনের সফর তাইপেতে এসেছেন মার্কিন অর্থনীতি বিষয়ক আন্ডার সেক্রেটারি কেইথ ক্রাচ। এছাড়া নানা বিষয়ে আলোচনা হওয়ার কথা রয়েছে।চীনের প্রতিরক্ষা মন্ত্রণালয়ের মুখপাত্র বিবৃতিতে জানান, যুক্তরাষ্ট্র-তাইওয়ানের ঘণিষ্ঠ সম্পর্কের কারণে এই অঞ্চলে উত্তেজনা সৃষ্টির মূল কারণ হয়ে দাঁড়িয়েছে। যারা আগুন নিয়ে খেলছে তারাই সেই আগুনে পুড়বে বলে আমেরিকাকে ইঙ্গিত করে সতর্ক করেছে বেইজিং।সাম্প্রতিক মাসগুলোতে তাইওয়ান প্রণালীতে মার্কিন যুদ্ধজাহাজের আনাগোনাও বাড়ছে।",19/9/2020,international
আফগানিস্তানের কাছে ন্যাটোর ৪ জঙ্গিবিমান হস্তান্তর,"আফগানিস্তানের সেনাবাহিনীর কাছে চারটি জঙ্গিবিমান হস্তান্তর করেছে উত্তর আটলান্টিক নিরাপত্তা জোট বা ন্যাটো।



আফগান বিমান বাহিনীর সঙ্গে চুক্তি অনুযায়ী ২৬টি 'এ-২৯ সুপার টোকানো' মডেলের জঙ্গিবিমান দেয়ার কথা রয়েছে ন্যাটোর।খবর ন্যাটো প্রেসের।রাজধানী কাবুলে বৃহস্পতিবার অনুষ্ঠানিকভাবে জঙ্গিবিমানগুলো হস্তান্তর হয়েছে।এ সময় ন্যাটোর কর্মকর্তারা বলেছেন, তারা এ পর্যন্ত আফগান বাহিনীর কাছে ১৮টি জঙ্গিবিমান হস্তান্তর করেছেন। আগামী কয়েক মাসের মধ্যে আরও ছয়টি বিমান দেয়া হবে।আফগানিস্তানের ভারপ্রাপ্ত প্রতিরক্ষামন্ত্রী আসাদুল্লাহ খালেদ বলেছেন, সেনাবাহিনী নিজেরাই দেশ রক্ষার সক্ষমতা রাখে। শত্রুরা সেনাবাহিনীকে ভেঙে দেয়ার যে স্বপ্ন দেখে তা কোনো দিন সফল হবে না।ন্যাটোর সঙ্গে আফগানিস্তানের সহযোগিতা অব্যাহত থাকবে বলে তিনি জানান।কাতারের রাজধানী দোহায় আফগান সরকারের সঙ্গে তালেবানের আলোচনার প্রক্রিয়া চলার মধ্যেই চারটি জঙ্গিবিমান হস্তান্তরের কাজ সম্পন্ন করল ন্যাটো।",19/9/2020,international
ভারতের আরও দুই এলাকা দাবি নেপালের ,"চীনের সঙে সীমান্ত নিয়ে উত্তেজনা বৃদ্ধির পর থেকেই একের পর এক ভূখণ্ড দাবি করে আসছে নেপাল। এবার নতুন করে উত্তরাখণ্ডের নৈনিতাল ও দেরাদুনকেও নিজেদের ভূখণ্ড বলে দাবি করল দেশটি।



এর আগে জুন মাসে নেপাল ভারতের উত্তরাখণ্ডের লিম্পিয়াধুরা, কালাপানি ও লিপুলেখ নিজেদের বলে দাবি করে। পরে এই অংশগুলো নিজেদের দাবি করে সংসদে নতুন মানচিত্র পাস করে কমিউনিস্ট সরকার।ভারতীয় সংবাদ মাধ্যম বলছে, নেপাল কমিউনিস্ট পার্টি, ইউনিফায়েড নেপাল ন্যাশনাল ফ্রন্টের সঙ্গে যৌথ উদ্যোগে গ্রেটার নেপাল প্রচার শুরু করেছে। সেই প্রচারের অংশ হিসেবে ১৮১৬ সালের সুগৌলি চুক্তির আগে নেপালের ম্যাপকেই সামনে আনা হচ্ছে। বলা হচ্ছে, ওই মানচিত্রে উত্তরাখণ্ড, হিমাচল প্রদেশ, উত্তরপ্রদেশ, বিহার এমনকী সিকিমের বড় বড় শহরকেও নিজেদের বলে দাবি করছে নেপাল। জোরকদমে এই প্রচারের অংশ হিসেবে ফেসবুক, টুইটার ও ইউটিউব চ্যানেলে লাগাতার বক্তব্য রাখা হচ্ছে। খবরে বলা হয়, ভারতের বিরুদ্ধে নবীন প্রজন্মকে উসকানিও দেওয়া হচ্ছে। সেখানে যোগ করা হয়েছে পাকিস্তানের যুব সম্প্রদায়ের একাংশকেও।তবে এর আগে উত্তরাখণ্ডের যে তিনটি অঞ্চলকে নেপাল নিজেদের বলে দাবি করছিল, তার কোনো ঐতিহাসিক ভিত্তি নেই বলে জানিয়েছিল নয়াদিল্লি। পাশাপাশি ওই অঞ্চল ভারতের অবিচ্ছেদ্য অংশ বলেও পররাষ্ট্র মন্ত্রণালয়ের পক্ষ থেকে পরিস্কার করা হয়েছিল। গত ৮ মে লিপুলেখ গিরিপথ থেকে কৈলাস মানস সরোবরে যাওয়ার নয়া ৮০ কিলোমিটার দীর্ঘ রাস্তার উদ্বোধন করেছিলেন ভারতের প্রতিরক্ষামন্ত্রী রাজনাথ সিং। এর পরেই ভারত ও নেপালের মধ্যে কূটনৈতিক সম্পর্কে টানাপোড়েন শুরু হয়। সঙ্গে সঙ্গেই এই রাস্তা উদ্বোধনের প্রতিবাদ জানায় কাঠমান্ডু। পালটা হিসেবে নতুন মানচিত্র প্রকাশে উদ্যোগী হয় নেপাল। নতুন মানচিত্রে ভারত-নেপাল সীমান্তের লিম্পিয়াধুরা, কালাপানি ও লিপুলেখকে নেপালের অংশ হিসেবে দাবি করা হয়। এবার তাতে যোগ করা হল নৈনিতাল ও দেরাদুনকেও।বিশ্লেষকদের অনেকেই বলছেন, সীমান্ত নিয়ে কাঠমান্ডুর সাম্প্রতিক এই কার্যক্রমের নেপথ্যে কলকাঠি নাড়ছে চীন। কমিউনিস্ট পার্টি ক্ষমতায় আসার পর থেকেই নেপালের সঙ্গে চীনের ঘনিষ্ঠতা উত্তোরত্তর বেড়েছে। এই সময়",19/9/2020,international
